Category,Product,Product ID,Price,Old Price,Description,Image URL,Product URL
Health & Beauty,Kids Liquid D3 400mg,6024,$9.49,,Recommended purpose: Helps in the absorption and use of calcium and phosphorus. Helps in the normal development and maintenance of bones and teeth. A factor in the maintenance of good health..[newline][newline]A great way for you to ensure your children get their Vitamin D !.[newline][newline][newline][newline]Assured Quality.[newline][newline]Since 1948[newline]Product Number: 20359390_EA,https://assets.shop.loblaws.ca/products/20359390/b1/en/front/20359390_front_a01_@2.png,https://www.loblaws.ca/kids-liquid-d3-400mg/p/20359390_EA
Pet Supplies,Paws Expandable Dog Leash - 1 Count,6101,$26.24,,Paws Expandable Dog Leash - 1 Count[newline]Product Number: SP151813,https://assets.sellers.loblaw.ca/products/all/1127/151813_1.jpg?size=274,https://www.loblaws.ca/paws-expandable-dog-leash-1-count/p/SP151813
Pet Supplies,Caldex Classic Oriental Tower Ornament (Multicoloured),6253,$13.45,,Hand crafted and hand painted polyresin aquarium ornament. This tall oriental tower is a stunning addition to a far eastern or oriental themed aquarium. Size: 7.5 x 6.5 x 16cm.[newline]Product Number: SP212089,https://assets.sellers.loblaw.ca/products/all/1291/212089_1.jpg?size=274,https://www.loblaws.ca/caldex-classic-oriental-tower-ornament-multicolour/p/SP212089
Pet Supplies,Nobby Danika Dog Coat,6173,$60.70,,Danika dog coat. Waterproof and windproof synthetic fibre. Warm lining. With hook and loop fastening. Hand wash only. Opening at top of coat to allow use of a harness.[newline]Product Number: SP198236,https://assets.sellers.loblaw.ca/products/all/1291/198236_1.jpg?size=274,https://www.loblaws.ca/nobby-danika-dog-coat/p/SP198236
Health & Beauty,Kohl Eyeliner- 89 Indigo,6025,$4.98,,Product Number: 20307144010_EA,https://assets.shop.loblaws.ca/products/20307144010/b1/en/front/20307144010_front_a01_@2.png,https://www.loblaws.ca/kohl-eyeliner-89-indigo/p/20307144010_EA
Pet Supplies,Sharples Faces N Feathers Butterfly Cat Toy (Yellow/Blue),6102,$4.20,,Fabric: Fabric- Plush. Design: Butterfly. Infused With Catnip. Packaging: Backing Card.[newline]Product Number: SP212129,https://assets.sellers.loblaw.ca/products/all/1291/212129_1.jpg?size=274,https://www.loblaws.ca/sharples-faces-n-feathers-butterfly-cat-toy-yellow/p/SP212129
Pet Supplies,Long Paws Comfort Padded Step In Dog Harness,6254,$27.70,,Padded dog harness. The Long Paws Comfort Collection has been made with the active pet in mind. The range has been manufactured to the highest safety standards and combines quality and comfort in a new and unique package. The Comfort Harness has a soft neoprene base making it comfortable for dogs to wear and also helping to prevent skin irritation on sensitive dogs. They have strong and secure buckles which are protected with a double D ring for attaching the lead. The woven seam is reflective to keep your dog visible in low light and dark conditions. And best part- as a step-in harness- you dont need to fit it over your dogs head- so your pet will find it comfortable to wear and hopefully drama-free to put on. Measurements (to fit dogs with chest size). XS - 31-37cm/12.5-15in - dogs up to 5kg- tensile strength 70kg. S - 38-56cm/15-22.5in - dogs up to 17kg- tensile strength 119kg. M - 42-65cm/17-26in - dogs up to 32kg- tensile strength 224kg. L - 58-78cm/23-31in - dogs up to 41 kg- tensile strength 257kg.[newline]Product Number: SP211818,https://assets.sellers.loblaw.ca/products/all/1291/211818_1.jpg?size=274,https://www.loblaws.ca/long-paws-comfort-padded-step-in-dog-harness/p/SP211818
Pet Supplies,Nobby Danika Dog Coat,6174,$80.70,,Danika dog coat. Waterproof and windproof synthetic fibre. Warm lining. With hook and loop fastening. Hand wash only. Opening at top of coat to allow use of a harness.[newline]Product Number: SP198251,https://assets.sellers.loblaw.ca/products/all/1291/198251_1.jpg?size=274,https://www.loblaws.ca/nobby-danika-dog-coat/p/SP198251
Health & Beauty,Little Ones Formula,6026,$23.99,$29.99,Source of vitamins and minerals factors in normal growth and development[newline]Source of antioxidants for the maintenance of good health[newline]Supports energy production[newline]Helps in the normal function of the immune system[newline]Helps maintain healthy metabolism[newline]Product Number: 21299272_EA,https://assets.shop.loblaws.ca/products/21299272/b1/en/front/21299272_front_a01_@2.png,https://www.loblaws.ca/little-ones-formula/p/21299272_EA
Pet Supplies,Kruuse Buster City Waterproof Dog Fashion Coat,6103,$59.95,,Stylish waterproof and windproof dog coat with buckle detail. Breathable build. Adjustable double zipper. Can be used with harnesses and leads. Adjustable stomach elastic. Machine washable. Choice of sizes. Size (Dog length): XX-Small- 20cm- X-Small- 26cm- Small- 32cm- Small/Medium- 36cm- Medium- 40cm- Medium/Large- 44cm- Large- 48cm- X-Large- 54cm- XX-Large- 60cm.[newline]Product Number: SP198202,https://assets.sellers.loblaw.ca/products/all/1291/198202_1.jpg?size=274,https://www.loblaws.ca/kruuse-buster-city-waterproof-dog-fashion-coat/p/SP198202
Pet Supplies,Wellness Therapeutic Round Pet Mat,6255,$355.20,,Wellness Pet Mats are intentionally designed to be therapeutically beneficial for dogs and a low-maintenance solution for pet professionals and pet parents. Constructed with proprietary Advanced Polyurethane Technology- the revolutionary engineered material system offers ultimate comfort- support and longevity. Health benefits: evenly distributes weight for joint support. Contours the bone to prevent pressure sores. Firm- yet cushioned- surface provides a safe- secure footing for lowering and rising. Intended for universal use- but specifically engineered to benefit dogs who suffer from physical ailments- are participating in rehabilitation- and are affected by disabilities and use medical equipment. Pet professionals and parent benefits: anti-microbial by design providing a clean- germ-free space for your dog to rest on exam table- surgery table- grooming tables- scale cover- floor exams to protect doctors knees and dog- crates- dog runs and for home use. Easy to wipe clean with any pet friendly cleaner. Will never absorb liquids or odours. Rip- tear- and chew resistant. Made from Latex- PVC and BPA. Allergen-free. 100% Recyclable. Made in the USA. Size: 114cm x 76cm.[newline]Product Number: SP211840,https://assets.sellers.loblaw.ca/products/all/1291/211840_1.jpg?size=274,https://www.loblaws.ca/wellness-therapeutic-round-pet-mat/p/SP211840
Pet Supplies,Juwel BioCarb Carbon Sponge,6175,$8.70,,The black carbon sponge removes chemical impurities and other organic dirt normally contained in the water.[newline]Product Number: SP208725,https://assets.sellers.loblaw.ca/products/all/1291/208725_1.jpg?size=274,https://www.loblaws.ca/juwel-biocarb-carbon-sponge/p/SP208725
Health & Beauty,Derma+care Scalp Conditioner for soft-smooth hair Aloe & Restore with aloe vera and ginger,6027,$4.99,,Dove Derma+care Scalp Aloe & Restore Conditioner for hydrated hair and scalp[newline]This conditioner fights symptoms of dry hair: dullness- frizz- less shiny[newline]System suitable for managing overall health of hair and scalp and gives hair nourishment[newline]This hair conditioner nourishes dry- damaged strands and seals in moisture for healthy- free-flowing hair[newline]This moisturizing hair care product is safe for colour treated hair[newline]To round out your scalp hair care routine- pair with Dove Derma+care Scalp Anti-Dandruff Aloe & Restore Shampoo[newline]Product Number: 21229419_EA,https://assets.shop.loblaws.ca/products/21229419/b1/en/front/21229419_front_a01_@2.png,https://www.loblaws.ca/derma-care-scalp-conditioner-for-soft-smooth-hair/p/21229419_EA
Pet Supplies,Antos Natural Root Dog Chew (May Vary),6104,$20.70,,Natural root chew for dogs. Long lasting and will not splinter. Hand crafted. Nutrient rich. Low in fat. No artificial additives or preservatives.[newline]Product Number: SP208746,https://assets.sellers.loblaw.ca/products/all/1291/208746_1.jpg?size=274,https://www.loblaws.ca/antos-natural-root-dog-chew-may-vary/p/SP208746
Pet Supplies,Animooos Squeaky Plush Toy - 1 Count,6176,$17.49,,Animooos Squeaky Plush Toy - 1 Count[newline]Product Number: SP151869,https://assets.sellers.loblaw.ca/products/all/1127/151869_1.jpg?size=274,https://www.loblaws.ca/animooos-squeaky-plush-toy-1-count/p/SP151869
Pet Supplies,Harold Moore Feed Scoop,6256,$11.95,,Lightweight durable plastic. Small: Approximately 500g (17.6oz) per scoop. Large: Approximately 1kg (2.2lb) per scoop. Note: each size and colour sold separately.[newline]Product Number: SP209675,https://assets.sellers.loblaw.ca/products/all/1291/209675_1.jpg?size=274,https://www.loblaws.ca/harold-moore-feed-scoop/p/SP209675
Health & Beauty,Colorstay Brow Pencil 205 Blonde,6028,$9.98,,Product Number: 21000192001_EA,https://assets.shop.loblaws.ca/products/21000192001/b1/en/front/21000192001_front_a01_@2.png,https://www.loblaws.ca/colorstay-brow-pencil-205-blonde/p/21000192001_EA
Pet Supplies,Jolly Pets Jolly Egg Jolly Ball,6105,$29.20,,Designed for constant- erratic motion with a fun oval shape.[newline]Product Number: SP209977,https://assets.sellers.loblaw.ca/products/all/1291/209977_1.jpg?size=274,https://www.loblaws.ca/jolly-pets-jolly-egg-jolly-ball/p/SP209977
Pet Supplies,Vital Pet Products Corduroy And Leather Dog Coat,6177,$18.45,,Corduroy/leather dog coat. Ideal for your dog to wear in the cooler months. Coat size is determined by measuring nape of the neck to base of tail. Available in a variety of colours and sizes. Material: outside- 100% Cotton- inside- 100% Acrylic.[newline]Product Number: SP198186,https://assets.sellers.loblaw.ca/products/all/1291/198186_1.jpg?size=274,https://www.loblaws.ca/vital-pet-products-corduroy-and-leather-dog-coat/p/SP198186
Pet Supplies,Beaphar Cage Fresh Granules (May Vary),6257,$11.20,,Cage Fresh Granules contain friendly microbes that neutralise the odours in urine that cause the characteristically unpleasant hutch and cage smell. For best results- simply sprinkle under the bedding in a freshly cleaned hutch or cage.[newline]Product Number: SP213986,https://assets.sellers.loblaw.ca/products/all/1291/213986_1.jpg?size=274,https://www.loblaws.ca/beaphar-cage-fresh-granules-may-vary/p/SP213986
Health & Beauty,Face Mask with Vitamin C,6029,$3.99,,Product Number: 21237506_EA,https://assets.shop.loblaws.ca/products/21237506/b1/en/front/21237506_front_a01_@2.png,https://www.loblaws.ca/face-mask-with-vitamin-c/p/21237506_EA
Pet Supplies,Interpet Aqua Long Air Stone (May Vary),6106,$4.45,,Long air stone for all types of aquarium.[newline]Product Number: SP212171,https://assets.sellers.loblaw.ca/products/all/1291/212171_1.jpg?size=274,https://www.loblaws.ca/interpet-aqua-long-air-stone-may-vary/p/SP212171
Pet Supplies,Small Breed Grain Free Chicken- Sweet Potato & Pumpkin Recipe Dog Food 1.8kg,6178,$12.99,,Nature's Recipe- a Grain Free natural dog food with added vitamins- minerals and nutrients. This premium dog food is created with the best of nature's ingredients to deliver all the nutrition dogs need and nothing they don't. Our delicious- SMALL BREED Grain Free Chicken- Sweet Potato & Pumpkin Recipe is carefully crafted with real chicken as the #1 ingredient- and no artifical colours- flavours or preservatives- in bite-size pieces that are just right for your small dog. Fuel the wag with Nature's Recipe![newline]Product Number: 21120910_EA,https://assets.shop.loblaws.ca/products/21120910/b1/en/front/21120910_front_a01_@2.png,https://www.loblaws.ca/small-breed-grain-free-chicken-sweet-potato-pumpki/p/21120910_EA
Pet Supplies,TastyBone Peanut Butter Flavoured Bone Dog Chew Toy (May Vary),6258,$11.45,,Made from tough durable virgin nylon. Engages natural gnawing instincts. Irresistible flavour ensures extended play. Size refers to breed.[newline]Product Number: SP211528,https://assets.sellers.loblaw.ca/products/all/1291/211528_1.jpg?size=274,https://www.loblaws.ca/tastybone-peanut-butter-flavoured-bone-dog-chew-to/p/SP211528
Health & Beauty,Super Lustrous Lipstick Crï¿½me 463 Sassy Mauve,6030,$6.98,,Product Number: 20690764014_EA,https://assets.shop.loblaws.ca/products/20690764014/b1/en/front/20690764014_front_a01_@2.png,https://www.loblaws.ca/super-lustrous-lipstick-cr-me-463-sassy-mauve/p/20690764014_EA
Pet Supplies,Fantasy Cozy Puppy & Cat Castle,6107,$84.99,,Incorporates a perch- cat house- scratching posts and climber. Can accommodate multiple cats. Provides lots of funand safe climbing exercises.[newline]Product Number: SP51071,https://assets.sellers.loblaw.ca/products/all/1148/51071_8497356974_2.jpg?size=274,https://www.loblaws.ca/fantasy-cozy-puppy-cat-castle/p/SP51071
Pet Supplies,Paw-fect for Winter Dog Quilted Coat Blue Fashionable and Sporty Faux Fur Trim Pet Coat XXS,6179,$36.79,,7 SIZES AVAILABLE (XXS/XS/S/M/L/XL/XXL/XXL): Can fit small- medium or large dogs. Please measure your pet's size before ordering for the perfect fit.[newline]EASY-ON/OFF DESIGN: Adjustable velcro strap designed with your dog in mind so that you can spend more time on walks and less time getting dressed.[newline]KEEP YOUR PET WARM THIS WINTER: Just as humans need their jacket to brave the cold- dog winter coats are a staple for keeping your pet at a comfortable temperature.[newline]MATERIAL: Made with 100% polyester woven fabric- this jacket is durable- warm- and easy to clean. Features Faux Fur on the Hood.[newline]ADJUSTABLE and ACCURATE FIT: Adjustable chest closure for better tuck-in of the body and keep body heat.[newline]FASHIONABLE DESIGN: A must-have item for any stylish pup's winter wardrobe collection in bright blue with a trendy faux fur trim hood. Perfect for keeping your pup warm while looking cool! Available in various other patterns.[newline][newline][newline]Chilly weather is the paw-fect reason to keep your dog warm in a stylish outer layer! From morning walks to playing in the snow- your pup will love doing their favourite activities in our Quilted Coat. Just as humans need their jackets to brave the cold- dog winter coats are essential for keeping your pet at a comfortable temperature. This coat comes in a beautiful shade of blue- making it excellent for getting adorable photos of your pup this winter![newline][newline]This Quilted Coat for dogs features a fashionable faux fur lined hood- a cozy inner lining- and has an easy-wear design so that you can spend more time on walks and less time getting dressed.[newline][newline]Show & Tails Winter Coat Collection is a staple for keeping your pup warm while looking cool! With so many styles to choose from- you are sure to find the perfect match for your perfect pet.[newline][newline]Show & Tail is passionate about creating fun- stylish- and adorable apparel for your pet. We offer a diverse range of holiday wear- seasonal clothing- bandanas- and more.[newline][newline]Established in 1949- Pamson has been a leading manufacturer for more than 70 years with success with importers and retailers across the globe.[newline]Product Number: SP159963,https://assets.sellers.loblaw.ca/products/all/1127/159963_1.jpg?size=274,https://www.loblaws.ca/paw-fect-for-winter-dog-quilted-coat-blue-fashiona/p/SP159963
Pet Supplies,Superpet Space Park Flying Saucer Pet Toy (Multicoloured),6259,$7.70,,Pet toy with cute flying saucer design. Connects to any cage- allowing small pets including hamster- gerbils and mice to climb inside.[newline]Product Number: SP212825,https://assets.sellers.loblaw.ca/products/all/1291/212825_1.jpg?size=274,https://www.loblaws.ca/superpet-space-park-flying-saucer-pet-toy-multicol/p/SP212825
Health & Beauty,Every Man Jack Beard + Face Wash Sandalwood,6032,$9.49,$10.49,Product Number: 21203762_EA,https://assets.shop.loblaws.ca/products/21203762/b1/en/front/21203762_front_a01_@2.png,https://www.loblaws.ca/every-man-jack-beard-face-wash-sandalwood/p/21203762_EA
Pet Supplies,Caldex Classic Dogs Pimple Rubber Rings Tug Toy (May Vary),6108,$8.95,,Solid rubber dog toy. Extremely durable and produced in vibrant colours- this is a super toy which is great for interactive play with your dog. Looped header card with Euro slot. Overall length: 190mm.[newline]Product Number: SP208564,https://assets.sellers.loblaw.ca/products/all/1291/208564_1.jpg?size=274,https://www.loblaws.ca/caldex-classic-dogs-pimple-rubber-rings-tug-toy-ma/p/SP208564
Pet Supplies,Backpack harness P7021,6180,$32.50,,This adorable multi-function backpack for your pet can be used as a backpack- which you can fill with small items or poop bags- as well as a harness. As an added bonus- a leash is included![newline][newline]Product Number: SP67083,https://assets.sellers.loblaw.ca/products/all/1174/67083_2190518764_2.jpg?size=274,https://www.loblaws.ca/backpack-harness-p7021/p/SP67083
Pet Supplies,Hydor Pico Replacement Filter Sponge (Silver),6260,$6.45,,Replacement filter sponge for use with the Hydor Pico Power Filter.[newline]Product Number: SP211372,https://assets.sellers.loblaw.ca/products/all/1291/211372_1.jpg?size=274,https://www.loblaws.ca/hydor-pico-replacement-filter-sponge-silver/p/SP211372
Health & Beauty,Purifying Facial Cleansing Wipes- With Charcoal,6033,$4.99,,Product Number: 21210748_EA,https://assets.shop.loblaws.ca/products/21210748/b1/en/front/21210748_front_a01_@2.png,https://www.loblaws.ca/purifying-facial-cleansing-wipes-with-charcoal/p/21210748_EA
Pet Supplies,Interpet Mighty Mutts Rubber Ball,6109,$25.95,,Heavyweight rubber toy made for aggressive chewers who destroy other toys in minutes.Hollow centre ideal for stuffing with treats or peanut butter. Floating rubber makes this toy great for playing fetch. Large size suitable for dogs of 27-40kg. Medium size suitable for dogs of 13.5-27kg.[newline]Product Number: SP210523,https://assets.sellers.loblaw.ca/products/all/1291/210523_1.jpg?size=274,https://www.loblaws.ca/interpet-mighty-mutts-rubber-ball/p/SP210523
Pet Supplies,Rogz Graphic Adjustable Dog Collar (Navy Paw),6181,$7.70,,A wide range of cool graphic ribbons are stitched onto high grade webbing- ensuring your dog sports the latest and greatest designs. Rounded contoured plastic components ensure that every ROGZ collar fits snuggly. Die-cast ring.[newline]Product Number: SP209303,https://assets.sellers.loblaw.ca/products/all/1291/209303_1.jpg?size=274,https://www.loblaws.ca/rogz-graphic-adjustable-dog-collar-navy-paw/p/SP209303
Pet Supplies,Whitaker Weir Dog Coat (Navy),6261,$36.70,,Denier: 600D. Design: Logo- Reflective. 2 Heated Chest Panels- Waterproof. Fastening: Touch and Close Fastening.[newline]Product Number: SP198361,https://assets.sellers.loblaw.ca/products/all/1291/198361_1.jpg?size=274,https://www.loblaws.ca/whitaker-weir-dog-coat-navy/p/SP198361
Health & Beauty,Energizing Face Scrub for fresh- glowing skin Coconut & Coffee 100% naturally sourced facial exfoliator,6034,$3.99,$4.99,St. Ives Energizing Coconut & Coffee Face Scrub deeply exfoliates and leaves skin fresh and glowing[newline]Wake up your senses with a face scrub boasting the delightful scent of coconut and fresh coffee[newline]St. Ives Energizing Face Scrub is made with 100% naturally sourced exfoliants (walnut shell powder)[newline]St. Ives exfoliating scrub is dermatologist tested and paraben-free[newline]St. Ives Coconut & Coffee Facial Scrub is also non-comedogenic to prevent pores from blocking[newline]Our facial exfoliator cleanses and exfoliates to reveal soft- smooth and healthy-looking skin[newline]Product Number: 21169957_EA,https://assets.shop.loblaws.ca/products/21169957/b1/en/front/21169957_front_a01_@2.png,https://www.loblaws.ca/energizing-face-scrub-for-fresh-glowing-skin-cocon/p/21169957_EA
Pet Supplies,Rosewood Boredom Breaker Peanut Small Pet Food,6110,$8.45,,Ingredients: Glycerin- Honey- Alfalfa- Peanuts- Flax Seed- Wheat- Seeds- Corn- Dried Apple- Carrots. Cage Clip- Hanging Loop. Suitable for: Chinchillas- Guinea Pigs- Rats- Small Animals. Flavour: Peanut.[newline]Product Number: SP214189,https://assets.sellers.loblaw.ca/products/all/1291/214189_1.jpg?size=274,https://www.loblaws.ca/rosewood-boredom-breaker-peanut-small-pet-food/p/SP214189
Pet Supplies,TastyBone Peanut Butter Flavoured Bone Dog Chew Toy (May Vary),6182,$11.45,,Made from tough durable virgin nylon. Engages natural gnawing instincts. Irresistible flavour ensures extended play. Size refers to breed.[newline]Product Number: SP211528,https://assets.sellers.loblaw.ca/products/all/1291/211528_1.jpg?size=274,https://www.loblaws.ca/tastybone-peanut-butter-flavoured-bone-dog-chew-to/p/SP211528
Pet Supplies,Pet Mate Cat Mate Water Fountain Replacement Filter Cartridge (Pack Of 2) (Assorted),6262,$15.95,,Replacement Filter Cartridge (x2) for Pet Fountain.[newline]Product Number: SP211962,https://assets.sellers.loblaw.ca/products/all/1291/211962_1.jpg?size=274,https://www.loblaws.ca/pet-mate-cat-mate-water-fountain-replacement-filte/p/SP211962
Health & Beauty,Shaving Bowl,6035,$4.99,,Vintage feel shave brush is made with the finest boar bristles to exfoliate the skin and help lift and moisten the beard.[newline]Soften & exfoliate the bristles are fine and soft on your skin- yet firm enough to exfoliate and lift facial hairs before your shave.[newline]Barbershop at home use with our Wilkinson Sword vintage soap bowl for a rich creamy lather.[newline]CLASSIC SHAVE SINCE 1898- Wilkinson Sword has been offering trusted- affordable shaving innovations since the introduction of their first safety razor in 1898.[newline]Product Number: 21245905_EA,https://assets.shop.loblaws.ca/products/21245905/b1/en/front/21245905_front_a01_@2.png,https://www.loblaws.ca/shaving-bowl/p/21245905_EA
Pet Supplies,PETKIT Deep Sleep All Season Bed,6111,$73.99,,New and Latest 2020 model[newline]The unique modular design has a tighter and firmer construction- ensuring the bed keep its shape and last longer![newline]Double-sided Double Comfort mattress - HIgh-Density Memory Foam with Heat Release and 3D Wave Shaped Orthopedic support.[newline]The jacket is a removable and washable Skin-friendly fabric handle that can be hung and lifted- easy to dry.[newline]The storage side pocket can store small things[newline]The non-slip bottom surface- 3D plastic dripping- wear-resistant and breathable[newline]Easy to Clean - Removable and Machine-Washable bedding cover[newline]Bamboo charcoal memory sponge- return to the natural curve[newline][newline][newline][newline][newline]Product Number: SP67221,https://assets.sellers.loblaw.ca/products/all/1066/67221_6347299228_1.jpg?size=274,https://www.loblaws.ca/petkit-deep-sleep-all-season-bed/p/SP67221
Pet Supplies,Superpet Space Park Flying Saucer Pet Toy (Multicoloured),6183,$7.70,,Pet toy with cute flying saucer design. Connects to any cage- allowing small pets including hamster- gerbils and mice to climb inside.[newline]Product Number: SP212825,https://assets.sellers.loblaw.ca/products/all/1291/212825_1.jpg?size=274,https://www.loblaws.ca/superpet-space-park-flying-saucer-pet-toy-multicol/p/SP212825
Pet Supplies,Pawsitively Chilly Dog Fleece Coat Colourful Paw and Bone Pattern Winter Pet Coat Large,6263,$32.19,,8 SIZES AVAILABLE (XXS/XS/S/M/L/XL/XXL/XXXL): Can fit small- medium or large dogs. Please measure your pet's size before ordering for the perfect fit.[newline]EASY-ON/OFF DESIGN: Adjustable velcro strap designed with your dog in mind so that you can spend more time on walks and less time getting dressed.[newline]KEEP WARM WITH POLAR FLEECE: Soft and breathable polar fleece to keep your dog warm and comfortable in the cold weather.\[newline]ADJUSTABLE and ACCURATE FIT: Adjustable chest closure for better tuck-in of the body and keep body heat.[newline]FASHIONABLE DESIGN: A must-have item for any stylish pup's winter wardrobe collection in a fun pattern with bright colours. Perfect for keeping your pup warm while looking cool! Available in various other patterns.[newline][newline][newline][newline]Chilly weather is the paw-fect reason to keep your dog cozy in a fashionable outer layer! From morning walks to playing in the snow- your pup will love staying warm while doing their favorite activities in our Fleece Coat. Just like fleece layers for humans- dog fleece coats and jackets are essential for keeping your pet at a comfortable temperature. Our Fleece Coats are also excellent for getting adorable photos of your pup this winter![newline][newline]This Fleece Coat for dogs features a colorful paw print pattern- polar fleece lining on the collar for extra warmth- and has an easy-wear design so that you can spend more time on walks and less time getting dressed.[newline][newline]Show & Tail's Winter Coat Collection is a staple for keeping your pup warm while looking cool! With so many styles to choose from- you are sure to find the perfect match for your perfect pet.[newline][newline]Show & Tail is passionate about creating fun- stylish- and adorable apparel for your pet. We offer a diverse range of holiday wear- seasonal clothing- bandanas- and more.[newline][newline]Established in 1949- Pamson has been a leading manufacturer for more than 70 years with success with importers and retailers across the globe.[newline]Product Number: SP159952,https://assets.sellers.loblaw.ca/products/all/1127/159952_1.jpg?size=274,https://www.loblaws.ca/pawsitively-chilly-dog-fleece-coat-colourful-paw-a/p/SP159952
Health & Beauty,Solution 0.02,6036,$56.99,,Product Number: 20062633_EA,https://assets.shop.loblaws.ca/products/20062633/b1/en/front/20062633_front_a01_@2.png,https://www.loblaws.ca/solution-0-02/p/20062633_EA
