Category,Product,Product ID,Price,Old Price,Description,Image URL,Product URL
Baby,Island Bliss Shampoo - 33oz,1543,$72.00,,Now we have thicker- smoother luxurious hair with our new Island Bliss Shampoo. Unlike other sulfate free shampoos that can weigh hair down- our brilliant formula delivers touchable- smooth volume that lasts all day. Keeps color fresh without sulfates and makes hair stronger with vegan protein. Our delicious island aroma sweeps us away for our daily island escape. Enjoy![newline][newline]Professional Performance[newline]Gentle pH of 6.0-7.0 to Help Retain Hair Color[newline]With Vegan Protein & Moisture[newline]For Color Treated or Dry Hair[newline][newline]Worry-Free[newline]Lice & Insects don’t like Organic Rosemary but We Love It![newline]Free of Phytoestrogens Lavender & Tea Tree- Phthalates- Clove & Musk[newline]No Soy- Gluten- Honey- Peanut or Dairy[newline]No Nanoparticles or Titanium Dioxide[newline]100% Vegan[newline]Product Number: SP23804,https://assets.sellers.loblaw.ca/products/all/1075/23804_5730467325_2.jpg?size=274,https://www.loblaws.ca/island-bliss-shampoo-33oz/p/SP23804
Baby,Dream Unisex Muslin Quilt,1767,$51.50,,Made from layers of unbleached 100% cotton muslin- this blanket is breathable yet thermal to keep you little one warm and cozy. The fabric is super soft and supple. Machine wash in cold water and tumble dry on low.[newline]Product Number: SP31015,https://assets.sellers.loblaw.ca/products/all/1077/31015_1.jpg?size=274,https://www.loblaws.ca/dream-unisex-muslin-quilt/p/SP31015
Baby,Stage 3 Wheat Biscuit Baby Cereal,1600,$4.99,,Now that baby has experienced different tastes and textures- GERBER Stage 3 Wheat Biscuit Baby Cereal (227 g) is perfect for little ones 8 months and older. With the smell- taste and texture of biscuit- feel good knowing every serving contains calcium- iron- and other essential nutrients that support baby's normal growth and development and probiotics to support a healthy gut flora. Since our cereals already contain milk- all you have to do is add water for quick- super convenient- and wholesome goodness. Made with no added sugar or salt**- and with no preservatives- artificial colours or flavours. Pair with a GERBER Veggie and Fruit Purée for extra nutrition. Introduce new flavours and textures to baby as they grow with the next stage of GERBER cereals! Also available in Oat Banana Mango- Multigrain Yogurt Apple Pear Banana- Multigrain Yogurt Raspberry and Multigrain Yogurt Blueberry. GERBER Stage 3 Wheat Biscuit Baby Cereal (227 g) is an excellent source of essential nutrients. With 100% of baby's daily recommended amount of iron which contributes to normal cognitive development; .Added probiotic B. lactis* contributes to baby's healthy gut flora. Different textures and flavours help expand baby's taste buds; ;No added salt** or sugar- and no preservatives- artificial colours or flavours.*1 billion B. lactis per 28 g **All cereal-based foods for babies under 12 months should not contain salt[newline]Product Number: 20358339010_EA,https://assets.shop.loblaws.ca/products/20358339010/b1/en/front/20358339010_front_a01_@2.png,https://www.loblaws.ca/stage-3-wheat-biscuit-baby-cereal/p/20358339010_EA
Baby,Twistshake 2x Pacifier 0-6m Pastel Blue Green,1544,$9.99,,Twistshake pacifiers are made to comfort your baby with its perfectly adapted shield. The four air holes helps to keep the skin dry and prevents irritation. Twistshakes super soft silicone is every babys first choice and the orthodontic shape is safe for your babys dental development.[newline]Product Number: SP140461,https://assets.sellers.loblaw.ca/products/all/1226/140461_0291338860_3.jpg?size=274,https://www.loblaws.ca/twistshake-2x-pacifier-0-6m-pastel-blue-green/p/SP140461
Baby,PPB - Valet Stroller Clips - Leatherette - Black Matte,1768,$32.99,,Designed especially for fashion-savvy moms in motion- our sturdy- easy-to-use Valet Stroller Clips allow most diaper bags to go from shoulder to stroller in a snap![newline][newline][newline]FEATURES[newline][newline][newline][newline][newline]Unlike simple stroller hooks- our clips feature non-skid straps that fit most stroller handles and keep diaper bags in place[newline][newline]Sturdy metal snap-hook hardware easily attaches diaper bag to Valet Stroller Clips[newline][newline][newline][newline][newline][newline][newline][newline][newline]Product Number: SP137996,https://assets.sellers.loblaw.ca/products/all/1091/137996_1.jpg?size=274,https://www.loblaws.ca/ppb-valet-stroller-clips-leatherette-black-matte/p/SP137996
Baby,Pamper Unscented,1601,$27.99,,A trusted clean- Pampers Baby Wipes clean and wipe away germs and are fragrance-free for delicate skin. These hardworking wipes are 4x stronger* for tough messes. Hypoallergenic- Pampers Unscented Wipes are alcohol-free- fragrance-free- paraben-free- and latex-free.**[newline]From Pampers- the #1 pediatrician recommended brand. For healthy skin- use Pampers Wipes together with Pampers Baby-Dry diapers.[newline]*Vs. leading U.S. sub-brand[newline]**Natural rubber[newline]Product Number: 21284750_EA,https://assets.shop.loblaws.ca/products/21284750/b1/en/front/21284750_front_a01_@2.png,https://www.loblaws.ca/pamper-unscented/p/21284750_EA
Baby,Baby Care Sea Petal Grey Playmat - Large,1545,$249.99,,Baby Care Playmats create a cushioned space for your little one to safely play- learn and toddle on without bumps or bruises. Whether it’s learning to sit- crawl or walk- these supportive playmats work to keep your child protect as they grow and learn new skills. Their slightly textured surface is soft and slip resistant. When not in use- simply roll these playmats up for easy storage. Each Baby Care Playmat is reversible- featuring a unique design on each side. With numerous designs to choose from- you’re sure to find the perfect playmat for your home![newline]• Made of nontoxic materials and free of latex- BPA- lead- formaldehyde and EVA.[newline]• Waterproof and easy to clean by wiping with soapy water.[newline]• Large Baby Care Playmats are compatible with Baby Care Funzone Playpens.[newline]• This Baby Care Playmat features a grey petal design on the front with an abstract alphabet design on the reverse.[newline]Product Number: SP15468,https://assets.sellers.loblaw.ca/products/all/1043/15468_1.jpg?size=274,https://www.loblaws.ca/baby-care-sea-petal-grey-playmat-large/p/SP15468
Baby,Chewbies Teether,1769,$5.99,,No 1 Teether Brand*.[newline][newline]*Based partly on Industry Data.[newline]Product Number: 20856415_EA,https://assets.shop.loblaws.ca/products/20856415/b1/en/front/20856415_front_a01_@2.png,https://www.loblaws.ca/chewbies-teether/p/20856415_EA
Baby,Organic Rice Rusks- Blueberry Apple Beet- Baby Snacks,1602,$4.99,,Has your little one started teething? GERBER Organic Rice Rusks- Blueberry Apple Beet- Baby Snacks (24 Rusks- 50 g) are perfect for this stage. They dissolve easily- are easy to grasp and hold- all while soothing those teething gums. Each rice rusk is made with real fruits and veggies. They are gluten-free with no artificial colours or flavours- and contain no added salt*. Plus- they come as 12 individually wrapped 2-packs- making them perfect for when you and baby are on-the-go. Our recipes are lovingly made with carefully selected- 100% wholesome ingredients before being quality tested to ensure they’re good enough to be called GERBER. Try both yummy flavours of GERBER Organic Rice Rusks: Mango Banana Carrot- and Blueberry Apple Beet. Appropriate for babies 7 months and up. ; ;; ;•A perfect first snack for baby – our Rice Rusks dissolve easily (they are melt-in-your-mouth good)- are easy to hold- and soothes teething gums; ;•Made with carefully selected- 100% wholesome ingredients like real fruits and veggies; ;•GERBER Organic Rice Rusks contain no artificial colours or flavours- no added salt*- and are gluten-free; ;•GERBER Organic Rice Rusks- Baby Snacks are non-GMO**; ;•Conveniently wrapped in individual 2-packs- making them perfect for when you and baby are on-the-go; ;•*All cereal-based foods for babies under 12 months should not contain added salt.**Not made with genetically engineered ingredients- like all organic products.[newline]Product Number: 21181650_EA,https://assets.shop.loblaws.ca/products/21181650/b1/en/front/21181650_front_a01_@2.png,https://www.loblaws.ca/organic-rice-rusks-blueberry-apple-beet-baby-snack/p/21181650_EA
Baby,A+ Ready to Feed Vanilla Flavour Toddler Nutritional Drink,1546,$14.99,,Enfagrow A+ is an every day toddler nutritional drink with brain-building DHA (a type of Omega-3 fat). It has 26 nutrients to help support growth including iron- calcium- vitamins C and D and a fibre blend. Enfagrow A+ can be served with a meal or as a nutritious snack.[newline]Enfagrow A+ is designed for toddlers 12-36 months old[newline]Contains 26 nutrients- including 23 vitamins and minerals[newline]Resealable ready to drink bottles[newline]Is an excellent source of calcium[newline]Is available in Vanilla and Milk Flavour[newline]Product Number: 21207723_EA,https://assets.shop.loblaws.ca/products/21207723/b1/en/front/21207723_front_a01_@2.png,https://www.loblaws.ca/a-ready-to-feed-vanilla-flavour-toddler-nutritiona/p/21207723_EA
Baby,Play and Learn Monkey,1770,$35.99,,A child’s first introduction to the nurturing and caring of parenting. The adult monkey has a removable cute baby in it’s pouch for endless open ended fun. Story telling and the concept of child caring can be explored. A mirror on it’s tummy- squeaker- rattle and teethers all add to the fun.[newline]Product Number: SP70208,https://assets.sellers.loblaw.ca/products/all/1068/70208_5650484576_3.jpg?size=274,https://www.loblaws.ca/play-and-learn-monkey/p/SP70208
Baby,Upseat Floor & Booster Seat with Tray,1603,$119.99,,The Upseat was developed with the help of leading physiotherapists. Its ergonomic design encourages anterior pelvic tilt; a slight forward rotation of the pelvis that engages the muscles responsible for proper- upright posture. The Upseat is also designed to splay the infant's legs- and encourage healthy hip development.[newline][newline]Ages 4 months to 2.5 years[newline]Ergonomic design[newline]Booster seat straps included[newline]Includes a large tray[newline]Easy handling[newline]Product Number: SP64883,https://assets.sellers.loblaw.ca/products/all/1145/64883_2258200484_10.jpg?size=274,https://www.loblaws.ca/upseat-floor-booster-seat-with-tray/p/SP64883
Baby,Swad Diaper Cpp Size 7,1771,$29.99,,Product Number: 21376125_EA,https://assets.shop.loblaws.ca/products/21376125/b1/en/front/21376125_front_a01_@2.png,https://www.loblaws.ca/swad-diaper-cpp-size-7/p/21376125_EA
Baby,Minky Purple 10 Piece Baby Crib Bedding set,1604,$159.99,,The BabyFad Minky Purple 10 piece crib bedding set features a beautiful mixture of purple minky dot chenille fabric along with white and purple 100% natural cotton fabrics. This combination of premium fabrics and modern design is perfect for a baby girl nursery.[newline]Each 10 Piece Set Includes:[newline]• Crib Quilt (36" x 45"). The quilt features a continuous quilting pattern sewn into the front of the quilt. The border of the quilt is trimmed with 5.5" of ultra soft purple minky fabric. The quilt measures 36" x 45" which allows for several years of use before it is outgrown.[newline]• Crib Bumper (10.5" x 158"). The bumper is made with 100% natural cotton and minky dot chenille fabric- trimmed with satin. The bumper is durable- easy to setup and designed to fit any standard sized crib.[newline]• Crib Skirt (Dust Ruffle). The crib skirt has an 11" drop and is made with color coordinating fabrics.[newline]• Fitted Sheet. The fitted sheet is fully elasticized for a snug fit and fits a standard sized 52" x 28" crib mattress. The fitted sheet is made from 100% cotton providing a soft gentle fabric next to baby’s skin.[newline]• 2 Window Valances (38" x 19"). The valances will dress up the nursery window(s) nicely. Also made from 100% cotton- the valances are beautiful and durable.[newline]• Diaper Stacker (21" x 11.5" x 8")[newline]• Toy Bag (23" x 15").[newline]• Decorative Pillow (15" x 10").[newline]• Musical Mobile. Saving the best for last- this set also includes the matching musical mobile. Your baby entertained for hours with this musical mobile that plays Brahms lullaby.[newline]Care instructions: Machine washable- tumble dry low- iron on low setting as required.[newline]Product Number: SP16783,https://assets.sellers.loblaw.ca/products/all/1058/16783_9005772895_1.jpg?size=274,https://www.loblaws.ca/minky-purple-10-piece-baby-crib-bedding-set/p/SP16783
Baby,Bentley 6-in-1 Stroller/Tricycle - Fuschia Pink,1548,$659.99,,Designed in collaboration with Bentley Motors and your toddlers needs in mind- the Bentley 6-in-1 Stroller/Tricycle is the perfect combination of elegance and function. Transforming from a stroller to a trike- this product ensures that your infant or toddler is safe and comfortable using it.[newline]Product Number: SP13041,https://assets.sellers.loblaw.ca/products/all/1043/13041_1.jpg?size=274,https://www.loblaws.ca/bentley-6-in-1-stroller-tricycle-fuschia-pink/p/SP13041
Baby,Edison Owl Dual Non-Slip Stainless Lunch Box W/Pouch,1772,$46.99,,Entrust your child's lunch to Edison stainless steel picnic lunch box set. This package includes 2 lunch containers with a shallower 2 compartment box and a deep stainless steel one compartment box. Guarantee leakage-free and worries-free for your child. INCLUDES: 2 Bento/Lunch Box Containers (2-Compartment & 1-Compartment Deep with Stainless Steel Inserts) in Fabric Pouch.[newline]SMART DESIGN: Secure Locking- Mix Prevention Travel Containers with Utensils / Experience the Innovative Design(s) focused on the Ease of Use- and Cleanliness.[newline]-BPA FREE / FOOD SAFE / MADE IN KOREA under strict Quality Control with accompanying safety certifications in South Korea & Europe[newline]-GUARANTEED QUALITY - Trusted Brand in South Korea with innovation and safety in mind since 2021[newline]Product Number: SP223442,https://assets.sellers.loblaw.ca/products/all/1245/223442_1.jpg?size=274,https://www.loblaws.ca/edison-owl-dual-non-slip-stainless-lunch-box-w-pou/p/SP223442
Baby,Grey Cable-Knit Receiving Blanket,1605,$49.99,,To snuggle inside this luxuriously plush blanket is like being wrapped in a cloud made of cotton candy. Soft fabric- a cable-knit look and the perfect color-everything about this piece is precious.[newline]Product Number: SP21719,https://assets.sellers.loblaw.ca/products/all/1049/21719_1.jpg?size=274,https://www.loblaws.ca/grey-cable-knit-receiving-blanket/p/SP21719
Baby,B.Box Bowl & Straw New Edition Boysenberry,1549,$19.99,,This colourful bowl and straw make it easier and more fun for little ones to drink/eat soup- cereal and much more. Simply clip the straw onto the side of the bowl so kids can slurp up their milk and cereal. You may have noticed the unique tear drop shape? That’s so kids can drink straight from the bowl. And when it’s snack time on-the-go- just pop in the snack insert to stop little mishaps. When little tummies are full- just clip on the easy storage lid and pack it away.[newline]Product Number: SP195832,https://assets.sellers.loblaw.ca/products/all/1245/195832_1.jpg?size=274,https://www.loblaws.ca/b-box-bowl-straw-new-edition-boysenberry/p/SP195832
Baby,Contour Change Pad Cover and Portable Changing Pad Organic Jersey Print 2 Pack,1773,$57.99,,This soft- premium 100% Organic Cotton Jersey Contoured Change Pad Cover is a nursery must-have!Give your baby a natural- comfy and cozy surface during diaper changes. This soft- pure and breathable changing pad cover measures 17 x 33 and it is designed to fit most contoured change pads. Our change pad cover has built-in slits to accommodate a safety strap to keep your little one safe.Your baby will simply love the soft and soothing comfort of Kushies linens. Babys skin is 10 times thinner and more vulnerable than adult skin. Thats why Kushies uses 100% Organic cotton jersey.All linens are generously sized and allow for shrinkage. These sheets are available in a variety of mix and match- trendy prints and solids to match any nursery!SIZING: This change pad sheet fits all contoured change pads up to 4.5. Our exceptional product measures 33 L x 17 W x 6D inches.[newline]Our best-selling Organic Jersey Portable Changing Pad Liners are mommy faves!Used on top of the changing pad or on any surface that needs protection. Great for on-the-go- this multi-use changing pad liner fits perfectly in the diaper bag. The generous size allows for extra coverage to fully protect your baby- especially in public places where you need it the most.Our flat changing pad liners are 100% premium quality organic jersey for protection against babys skin with a waterproof bottom and a bias trim for added durability. These liners are a great addition to any diaper bag as they are extremely light- and compact.Our larger than most waterproof changing pad liners measure 20 x 30. This size allows extra coverage to protect your baby while in use- as well as the ability to use it for a variety of other functions.Our Portable Changing Pads come in a variety of colours and patterns. We offer 100% Cotton Flannel- Terry- Organic Jersey & Bamboo to fit everyones needs.SOFT AND BREATHABLE 100% PURE ORGANIC COTTON: We use 100% certified organic cotton that is soft and breathable against your babys skin. Our fabric is pure cotton- no blending with synthetic materials.SUPERIOR QUALITY: We use the best materials for your baby. Our organic cotton feels super soft and is breathable.FULL ELASTIC: Our exceptional sheets are all fully elasticized. The all-around elastic feature keeps the sheet in place for a snug- safe fit STYLISH: Designed especially for you and are available in a variety of mix and match- trendy prints and solids including black & white to match any nursery!QUALITY MADE IN CANADA: Lovingly made in Canada by parents- for babies. We do not compromise on quality and continue to up our standards every year. Our factory passes the most rigid standards in the industry so you can rest easy.[newline]Product Number: SP23319,https://assets.sellers.loblaw.ca/products/all/1042/23319_1.jpg?size=274,https://www.loblaws.ca/contour-change-pad-cover-and-portable-changing-pad/p/SP23319
Baby,Contour Change Pad Cover and Portable Changing Pad (Waterproof) Bundle,1606,$39.99,,This soft changing pad cover is designed to fit 3 inch pads and is fully elasticized for a perfect fit. Your precious baby will simply love the soft and soothing comfort of Kushies' linens. Hospitals have been swaddling babies in cotton flannel for decades because of the soft smooth feel on baby's skin. That's why Kushies uses premium 100% breathable cotton flannel for your baby. All linens are generously sized and allow for shrinkage. These sheets are available in a variety of mix and match- trendy prints and solids including black & white to match any nursery! Ethically made in Canada. Other sizes available.[newline]Kushies best-selling Portable Changing Pad Liners are mommy faves! Used on top of the changing pad or on any surface that needs protection. Great for on-the-go- this multi-use changing pad liner fits perfectly in the diaper bag. The generous size allows for extra coverage to fully protect your baby- especially in public places where you need it the most.Our flat changing pad liners are 100% premium quality cotton for protectionagainst babys skin with a waterproof bottom and a bias trim for added durability. These liners are a great addition to any diaper bag as they are extremely light- and compact.Our larger than most waterproof changing pad liners measure 20 x 30. This size allows extra coverage to protect your baby while in use- as well as the ability to use it for a variety of other functions.Our Portable Changing Pads come in a variety of colours and patterns. We offer 100% Cotton Flannel- Terry- Organic Jersey & Bamboo to fit everyones needs.[newline]Product Number: SP23332,https://assets.sellers.loblaw.ca/products/all/1042/23332_1.jpg?size=274,https://www.loblaws.ca/contour-change-pad-cover-and-portable-changing-pad/p/SP23332
Baby,Paw Patrol Toddler Boys 3pk Training Pants Pack of 6,1550,$139.75,,Track her potty training progress in comfort with this Paw Patrol training pants set.[newline]• Paw Patrol 3-pack training pants and chart set[newline]• Combed cotton construction[newline]• Elastic trim Pattern[newline]• May Vary Training chart and stickers included[newline]• 100% cotton Machine wash warm I[newline]• Imported[newline]Product Number: SP148113,https://assets.sellers.loblaw.ca/products/all/1127/148113_1.jpg?size=274,https://www.loblaws.ca/paw-patrol-toddler-boys-3pk-training-pants-pack-of/p/SP148113
Baby,Devon Changing Table - White,1774,$94.99,,Look to the Concord Baby Devon changing table to complete your nursery in contemporary style. A classic design- the table includes a waterproof changing pad with a security belt for extra safety. Two open shelves below the changing station keep diapers- wipes- bedding- toys and other necessities within easy reach. Crafted from solid wood- this changing table was made to last.[newline][newline]• Waterproof pad with safety belt[newline]• 2 Open shelves for storing baby’s essentials[newline]• Solid wood with non-toxic finish[newline]• Dimensions: 34"L X 20"W X 40"H[newline]• Pair this changing table with a matching Concord Baby Crib[newline]Product Number: SP161062,https://assets.sellers.loblaw.ca/products/all/1225/161062_9982102605_1.jpg?size=274,https://www.loblaws.ca/devon-changing-table-white/p/SP161062
Baby,Baby Soothing Relief Moisture Cream,1607,$7.49,,- Hypoallergenic - Steroid-free.[newline][newline]AVEENO BABY SOOTHING RELIEF MOISTURE CREAM is clinically proven to moisturize and provide relief for extra dry- chapped or cracked skin for 24 hours. This exclusive soothing cream contains natural colloidal oatmeal[newline]Product Number: 20922622_EA,https://assets.shop.loblaws.ca/products/20922622/b1/en/front/20922622_front_a01_@2.png,https://www.loblaws.ca/baby-soothing-relief-moisture-cream/p/20922622_EA
Baby,Pure Protection Club Pack Plus - Newborn Diapers Size N 104 Count,1551,$29.99,$33.99,Product Number: 21304068_EA,https://assets.shop.loblaws.ca/products/21304068/b1/en/front/21304068_front_a01_@2.png,https://www.loblaws.ca/pure-protection-club-pack-plus-newborn-diapers-siz/p/21304068_EA
Baby,Organic Purï¿½e- Pear Banana Blueberry Raspberry- Baby Food,1775,$1.99,,Introduce your little one to the goodness of fruits with GERBER Organic Purée- Pear Banana Blueberry- Baby Food (128 ml).[newline][newline]Let’s face it – nothing is ever 100% mess proof. That’s why we’ve put our proprietary Smart Flow spout on all our GERBER Organic pouches. The Smart Flow spout helps get more food on that little spoon and less everywhere else- so mealtime should become a more nutritious- less messy experience. It also gives toddlers big control when they’re learning to self-feed*. Less mess and more nutrition? That’s a win for everyone.[newline][newline]Plus- all our pouches are now in transparent packaging- so you can see the nutrition inside.[newline][newline]All of our recipes are lovingly made using carefully selected ingredients- with over 100 GERBER quality checks- guaranteeing that they’ll be loved by tiny taste buds.[newline][newline]Try all 15 yummy new flavours of GERBER Organic Purées: Apple Summer Peach- Apple Blueberry Spinach- Apple Kale Fig- Banana Beet Pomegranate- Pear Banana Blueberry Raspberry- Apple- Banana Mango- Pear Banana Blueberry- Banana Apple Raspberry- Banana Squash- Pear Peach Strawberry- Mango Apple Carrot Kale- Pear Peach Pumpkin Fig- Mango Apple Pear- and Pumpkin Banana Carrot.[newline][newline]Appropriate for babies 6 months and up.[newline]Perfect for introducing babies to the goodness of fruits- GERBER Organic Purée- Pear Banana Blueberry is made with 1/3 pear- ½ banana- and 10 blueberries[newline]Features our new Smart Flow spout- which helps create less mess- and more nutrition you can see[newline]GERBER Organic Purées- Pear Banana Blueberry has no sugar or salt added[newline]GERBER Organic Purée are non-GMO**[newline]Re-sealable easy-to-use pouch makes it convenient to bring GERBER Organic Purées on-the-go[newline]*For younger babies (6+ months)- squeeze puree directly onto a spoon. Toddlers (12+ months) may consume the puree directly from the pouch.[newline]**Not made with genetically engineered ingredients- like all organic products.?[newline]Product Number: 21024878_EA,https://assets.shop.loblaws.ca/products/21024878/b1/en/front/21024878_front_a01_@2.png,https://www.loblaws.ca/organic-pur-e-pear-banana-blueberry-raspberry-baby/p/21024878_EA
Baby,Diaper System Refill,1608,$5.99,,Product Number: 21307016_EA,https://assets.shop.loblaws.ca/products/21307016/b1/en/front/21307016_front_a01_@2.png,https://www.loblaws.ca/diaper-system-refill/p/21307016_EA
