Category,Product,Product ID,Price,Old Price,Description,Image URL,Product URL
Health & Beauty,Nano Gel Eyeliner- Luxurious Brown,6003,$9.98,$11.98,Product Number: 21159450003_EA,https://assets.shop.loblaws.ca/products/21159450003/b1/en/front/21159450003_front_a01_@2.png,https://www.loblaws.ca/nano-gel-eyeliner-luxurious-brown/p/21159450003_EA
Pet Supplies,Zoï¿½ Super Bars Dog Treats - Chicken 170g - 8 bags,6229,$79.99,,Zoë Super Bars Chicken Recipe- 170g[newline]Product Number: SP17423,https://assets.sellers.loblaw.ca/products/all/1072/17423_4716562460_1.jpg?size=274,https://www.loblaws.ca/zo-super-bars-dog-treats-chicken-170g-8-bags/p/SP17423
Pet Supplies,Horsemens Pride Jolly Flyer Dog Toy,6154,$17.45,,Disc shaped dog toy with Jolly Pets logo and image. Helps clean teeth and gums. Puncture resistant- and can float. Made from 100% natural rubber. Note: each size and colour sold separately.[newline]Product Number: SP209051,https://assets.sellers.loblaw.ca/products/all/1291/209051_1.jpg?size=274,https://www.loblaws.ca/horsemens-pride-jolly-flyer-dog-toy/p/SP209051
Pet Supplies,Friskies 7 Cat Food,6079,$8.49,,It’s finally here! A mix of your cat’s 7 favorite flavors for 7 x the yum! This one-of-a-kind meal features the flavors of chicken- beef- turkey- salmon- tuna- shrimp and cheese. A combination so delish- it’ll bowl your cat over.[newline]100% complete and balanced nutrition for adult cats[newline]Protein to help support strong- lean muscles[newline]Essential Fatty Acids to help support healthy skin & coat[newline]Vitamin A & Taurine to help support clear- healthy vision[newline]Antioxidants to help support a healthy immune system[newline]Product Number: 20912515_EA,https://assets.shop.loblaws.ca/products/20912515/b1/en/front/20912515_front_a01_@2.png,https://www.loblaws.ca/friskies-7-cat-food/p/20912515_EA
Health & Beauty,Shea Butter Lavender Hand Cream,6004,$5.49,,Product Number: 21358930_EA,https://assets.shop.loblaws.ca/products/21358930/b1/en/front/21358930_front_a01_@2.png,https://www.loblaws.ca/shea-butter-lavender-hand-cream/p/21358930_EA
Pet Supplies,Animal Dreams Mayfield Compressed Straw (Beige),6230,$11.95,,Compressed straw. Ideal as bedding for small animals.[newline]Product Number: SP214148,https://assets.sellers.loblaw.ca/products/all/1291/214148_1.jpg?size=274,https://www.loblaws.ca/animal-dreams-mayfield-compressed-straw-beige/p/SP214148
Pet Supplies,Shredded Ocean Whitefish & Tuna Wet Cat Food,6080,$1.09,,Thin shreds made with real ocean whitefish and tuna in just the right amount of savory sauce- giving your cat the flavors- textures and aromas she'll crave again and again.[newline]100% complete and balanced nutrition for adult cats[newline]A delightful meal made with real ocean whitefish and tuna shreds.[newline]Product Number: 20319657003_EA,https://assets.shop.loblaws.ca/products/20319657003/b1/en/front/20319657003_front_a01_@2.png,https://www.loblaws.ca/shredded-ocean-whitefish-tuna-wet-cat-food/p/20319657003_EA
Pet Supplies,Beaphar Lactol Pet Feeding Set,6155,$7.45,,This is the perfect partner for the Lactol range of milk powders. As well as being used for feeding puppies and kittens- the bottle can also be used for guinea pigs- hedgehogs- and rabbits. The set contains a 35 ml feeding bottle- four teats- and a bottle brush.[newline]Product Number: SP213990,https://assets.sellers.loblaw.ca/products/all/1291/213990_1.jpg?size=274,https://www.loblaws.ca/beaphar-lactol-pet-feeding-set/p/SP213990
Pet Supplies,Rogz Grinz Dog Ball,6231,$11.70,,Material: SEBS. Design: Teeth. Bouncy- Floatable.[newline]Product Number: SP210957,https://assets.sellers.loblaw.ca/products/all/1291/210957_1.jpg?size=274,https://www.loblaws.ca/rogz-grinz-dog-ball/p/SP210957
Health & Beauty,Enhanced Collagen Original,6005,$39.99,,Product Number: 21190856_EA,https://assets.shop.loblaws.ca/products/21190856/b1/en/front/21190856_front_a01_@2.png,https://www.loblaws.ca/enhanced-collagen-original/p/21190856_EA
Pet Supplies,Interpet Limited Nylabone Dura Chew Chicken Dog Dental Toy,6156,$10.45,,Dog chew toy with baked in particles of real chicken meal. Strong- safe and durable with raised bristles to prevent plaque from forming. Made from pure Nylon.[newline]Product Number: SP209369,https://assets.sellers.loblaw.ca/products/all/1291/209369_1.jpg?size=274,https://www.loblaws.ca/interpet-limited-nylabone-dura-chew-chicken-dog-de/p/SP209369
Pet Supplies,Extra Gravy Chunky with Salmon in Savoury Gravy Wet Cat Food,6081,$1.09,,O.M.Gravy. This scrumptious meal with salmon in gravy makes mealtime swimmingly delicous - EXTRA gravy![newline]Extra Gravy- Bite-Size Chunks[newline]With Salmon In Savory Gravy[newline]100% Complete & Balanced Nutrition for Adult Cats[newline]Product Number: 20855828_EA,https://assets.shop.loblaws.ca/products/20855828/b1/en/front/20855828_front_a01_@2.png,https://www.loblaws.ca/extra-gravy-chunky-with-salmon-in-savoury-gravy-we/p/20855828_EA
Pet Supplies,INSTACHEW Rover Pet Travel Bottle,6232,$24.99,,One-Hand Watering Has a press and holds water dispensing button allowing for a reversible functionality. If your pets don't finish their water- simply press and hold the button and refill with the unused water.[newline]Easy to Use: The bowl makes it easy for your pets to drink from- as it has been designed with a drinking arc that allows dogs from all sizes and shapes to stay hydrated.[newline]Modular: The bottle is designed to be modular meaning that you can have a separate compartment for water and for food/snacks. You can also add additional modules as needed.[newline]Anti-Leak: The bottle can be locked while not in use preventing accidental leakages. Additionally- the water outlet has been designed to prevent the growth of bacteria.[newline]Product Number: SP61944,https://assets.sellers.loblaw.ca/products/all/1066/61944_4062929670_1.jpg?size=274,https://www.loblaws.ca/instachew-rover-pet-travel-bottle/p/SP61944
Health & Beauty,Venus 3 Blades 4 Cartridges,6006,$19.99,,Product Number: 21370890_EA,https://assets.shop.loblaws.ca/products/21370890/b1/en/front/21370890_front_a01_@2.png,https://www.loblaws.ca/venus-3-blades-4-cartridges/p/21370890_EA
Pet Supplies,Cat Chow Complete Dry Cat Food- Advanced Nutrition for All Cats,6082,$9.59,,Give your cat the nutrition needed to help support her long- healthy life with you when you serve Purina Cat Chow Complete dry cat food. This delicious cat food recipe is formulated to support cats at every stage of life- from kittens and adult cats to seniors- providing them with 25 essential vitamins and minerals in every serving. Wholesome ingredients in this dry food for cats give you peace of mind that your feline friend is getting a quality meal in her dish- and 100% complete and balanced nutrition helps to support her overall health and wellness. Give your cat the four cornerstones of nutrition at every feeding- including high-quality protein- healthy carbs- essential fatty acids and essential vitamins and minerals. With a great-tasting recipe- this Purina Cat Chow dry cat food is sure to have your cat running when she hears the sound of crunchy kibble falling into her dish.[newline]Great-tasting cat food made with real chicken[newline]Provides all 25 vitamins and minerals to help support her overall health[newline]Delivers 100% complete and balanced nutrition[newline]High-quality protein to support strong muscles[newline]Essential fatty acids support her healthy skin and coat[newline]Product Number: 20319556001_EA,https://assets.shop.loblaws.ca/products/20319556001/b1/en/front/20319556001_front_a01_@2.png,https://www.loblaws.ca/cat-chow-complete-dry-cat-food-advanced-nutrition/p/20319556001_EA
Pet Supplies,Interpet Limited Mikki Nylon Muzzle,6157,$26.20,,Allows the dog to pant and drink. A strong nylon muzzle which is soft and flexible. Adjustable straps with quick-fit catch. Inhibits chewing and barking- but still allows panting and drinking. Should not be used during strenuous exercise. Size guide: Size 0 - Fits Yorkies- Spaniels and Miniature breeds. Size 1 - Fits Whippets- Westies and Jack Russells. Size 1XL - Noseband measurement: 13cm. Size 2 - Fits Beagles- Springers and Standard Poodles. Size 2XL - Noseband measurement: 16cm. Size 3 - Labradors and Retrievers. Size 4 - Fits Wolfhounds- Great Danes- St Bernards. Size 4XL - Noseband Measurement: 28.5cm. Size 5 - Fits Rottweilers and Bullmastiffs. Size 5XL- Noseband size: 26.5cm. Size 8 - Fits Boxer dogs. Size 10 - Fits Staffies and Bull Terriers.[newline]Product Number: SP208501,https://assets.sellers.loblaw.ca/products/all/1291/208501_1.jpg?size=274,https://www.loblaws.ca/interpet-limited-mikki-nylon-muzzle/p/SP208501
Pet Supplies,Sharples Tuggo Roped Ball,6233,$17.20,,Provides fun tug-of-war action. The rope can be pulled from both sides. Ideal for owners that want to play with their dogs or for two dogs to play together. Even when your dog plays by itself- the water weight makes it seem like your dog is playing with another dog or person. The built-in screw top is strong and safe. No tools needed. By tying the rope in different lengths- the Tuggo can be pulled- dragged or carried. The ball is easy to take along in a backpack or car. It can also be filled with sand or gravel. The ball floats when it isn´t filled. Suitable for every dog weighing over 18kg or small dogs that love a challenge.[newline]Product Number: SP208456,https://assets.sellers.loblaw.ca/products/all/1291/208456_1.jpg?size=274,https://www.loblaws.ca/sharples-tuggo-roped-ball/p/SP208456
Pet Supplies,Interpet Tail Tickler Cat Toy (May Vary),6158,$9.70,,Feather tail interactive wand toy for cats to pounce and chase.[newline]Product Number: SP210449,https://assets.sellers.loblaw.ca/products/all/1291/210449_1.jpg?size=274,https://www.loblaws.ca/interpet-tail-tickler-cat-toy-may-vary/p/SP210449
Health & Beauty,Colour Riche Matte Sharpenable Lip Liner 110 Matte's It,6007,$9.98,,Product Number: 21030170006_EA,https://assets.shop.loblaws.ca/products/21030170006/b1/en/front/21030170006_front_a01_@2.png,https://www.loblaws.ca/colour-riche-matte-sharpenable-lip-liner-110-matte/p/21030170006_EA
Pet Supplies,Nylabone Extreme Chew Wishbone Dog Chew,6083,$18.95,,Made from tough durable nylon. With three textured ends. Easy to hold arched design. Bison flavour. Designed to help clean teeth and freshen breath. Size - Large: 15.5 x 12.5 x 4.5 cm- Small: 12.2 x 10.5 x 4 cm.[newline]Product Number: SP209092,https://assets.sellers.loblaw.ca/products/all/1291/209092_1.jpg?size=274,https://www.loblaws.ca/nylabone-extreme-chew-wishbone-dog-chew/p/SP209092
Pet Supplies,Fibrecycle Worlds Best Unscented Cat Litter (Green/Black),6234,$52.95,,Material: Mesh. Clumping- Dust Free- Fine Granules- Flushable- Highly Absorbent- Odour Control. Lightweight- Long Life. Packaging: Plastic Packet. Fragrance: Unscented.[newline]Product Number: SP208436,https://assets.sellers.loblaw.ca/products/all/1291/208436_1.jpg?size=274,https://www.loblaws.ca/fibrecycle-worlds-best-unscented-cat-litter-green/p/SP208436
Health & Beauty,Colorista Spray 1-Day Colour- Rosegold,6008,$13.99,,Product Number: 21054573_EA,https://assets.shop.loblaws.ca/products/21054573/b1/en/front/21054573_front_a01_@2.png,https://www.loblaws.ca/colorista-spray-1-day-colour-rosegold/p/21054573_EA
Pet Supplies,Pedigree Dentastix Dog Chews (Pack Of 56),6159,$45.45,,Daily oral care dental chews for dogs. Keep your dogs teeth and gums strong and healthy. Can reduce plaque and tartar build-up by up to 80%. Pack of 56 sticks. Sizes: Large- for dogs weighing over 25kg- Medium- for dogs weighing between 10-25kg- Small- for dogs weighing between 5-10kg.[newline]Product Number: SP209378,https://assets.sellers.loblaw.ca/products/all/1291/209378_1.jpg?size=274,https://www.loblaws.ca/pedigree-dentastix-dog-chews-pack-of-56/p/SP209378
Pet Supplies,Handmade scarf/bandana D10551,6084,$7.50,,Handmade scarf/bandana that can be customized with a monogram upon request. You can showcase various fashion themes with different designs on each side. Snap buttons allow for easy wear.[newline]Product Number: SP67014,https://assets.sellers.loblaw.ca/products/all/1174/67014_8302870087_2.jpg?size=274,https://www.loblaws.ca/handmade-scarf-bandana-d10551/p/SP67014
Pet Supplies,Special design harness I7011,6235,$32.50,,Adorable harness imported from South Korea. Air mesh fabric used on the inside of the harness helps to release heat and keep your pet cool. The chest size of the harness can be adjusted using the clip on top of the harness. The harness can be worn on top of clothing. 3 different size (S- M- L) are available. Cute wing design.[newline][newline][newline][newline][newline][newline]Product Number: SP67065,https://assets.sellers.loblaw.ca/products/all/1174/67065_6828000028_2.jpg?size=274,https://www.loblaws.ca/special-design-harness-i7011/p/SP67065
Health & Beauty,Ultra HD Matte Lipcolor 625 HD Love,6009,$10.98,,Product Number: 20936595008_EA,https://assets.shop.loblaws.ca/products/20936595008/b1/en/front/20936595008_front_a01_@2.png,https://www.loblaws.ca/ultra-hd-matte-lipcolor-625-hd-love/p/20936595008_EA
Pet Supplies,King British Fishbags (Pack Of 100) (Clear),6085,$28.95,,For packing live fish. Specially developed. Complete with instructions. S: 19 x 6in- L: 19 x 8in.[newline]Product Number: SP208659,https://assets.sellers.loblaw.ca/products/all/1291/208659_1.jpg?size=274,https://www.loblaws.ca/king-british-fishbags-pack-of-100-clear/p/SP208659
Pet Supplies,Adventure Leash - Disco,6160,$28.99,,Disco’s 70s inspired color palette adds a dash of suaveness to your walks while complementing your dog’s natural strut.Made with heavy polypro webbing sourced from the USA. With a tensile strength of over 600 lbs- this leash is tough and ready to withstand all the adventure you throw at all. With a built in triglide- you can easily adjust our Adventure leash from 3 feet to 5 feet![newline]Product Number: SP109252,https://assets.sellers.loblaw.ca/products/all/1092/109252_1.jpg?size=274,https://www.loblaws.ca/adventure-leash-disco/p/SP109252
Pet Supplies,Mikki Muzzle (May Vary),6236,$21.70,,Lightweight- comfortable and safe nylon muzzle. Allows panting- drinking and treat training. Quick and easy to fit. An essential item for dogs that chase or may bite.[newline]Product Number: SP212059,https://assets.sellers.loblaw.ca/products/all/1291/212059_1.jpg?size=274,https://www.loblaws.ca/mikki-muzzle-may-vary/p/SP212059
Pet Supplies,Nutrition First Senior Dog Food- Chicken- Brown Rice & Pea,6086,$9.99,,Our Senior recipe is the ideal diet for dogs 7 and up. Quality proteins encourage efficient metabolism function and support optimal weight. Formulated with Glucosamine- Chondroitin and L-Carnitine to help maintain lean body mass and promote joint health and mobility. Enriched with antioxidants and vitamins E and C for immune system support and function. Real chicken as the first ingredient provides optimal protein- supported by hearty grains and nourishing fruits and vegetables to ensure your dog has a well-balanced diet.[newline]Product Number: 21305294_EA,https://assets.shop.loblaws.ca/products/21305294/b1/en/front/21305294_front_a01_@2.png,https://www.loblaws.ca/nutrition-first-senior-dog-food-chicken-brown-rice/p/21305294_EA
Health & Beauty,Lady Speed Stick Fresh Infusions- Fruity Melon,6010,$4.99,,48H.[newline][newline]48H odour protection[newline]Product Number: 20758150_EA,https://assets.shop.loblaws.ca/products/20758150/b1/en/front/20758150_front_a01_@2.png,https://www.loblaws.ca/lady-speed-stick-fresh-infusions-fruity-melon/p/20758150_EA
Pet Supplies,Double Duty Advanced Odour Control Clumping Cat Litter,6237,$15.99,$17.99,ARM & HAMMER Double Duty Clumping Litter eliminates both types of odours for advanced odour control. Its breakthrough formula destroys urine and feces odours instantly and helps keep your home smelling fresh and clean. Plus a fresh scent is released every time your cat uses the box. Provides rock-solid clumping for easy removal; 99% dust free and low- tracking.; ;; ;[newline]Powerful moisture-activated baking soda crystals boosted with feces odors neutralizers destroy urine and feces odors on contact[newline]Rock-solid clumps let you remove the source of odors easily[newline]Low- tracking. Easy-pour- no spill spout[newline]Plus a fresh scent refreshes the litter box each time your cat uses the box[newline]Product Number: 21097017_EA,https://assets.shop.loblaws.ca/products/21097017/b1/en/front/21097017_front_a01_@2.png,https://www.loblaws.ca/double-duty-advanced-odour-control-clumping-cat-li/p/21097017_EA
Pet Supplies,Weatherbeeta Tweed Dog Coat II (Navy),6087,$51.70,,Stylish tweed outer with warm fleece lining. 100g polyfill. Includes full wrap chest and belly closure with touch tape closure. Large collar for added warmth and comfort. Leash hole for added convenience.[newline]Product Number: SP198304,https://assets.sellers.loblaw.ca/products/all/1291/198304_1.jpg?size=274,https://www.loblaws.ca/weatherbeeta-tweed-dog-coat-ii-navy/p/SP198304
Health & Beauty,Black Cherry Lipcolor,6011,$10.98,,Product Number: 21220790002_EA,https://assets.shop.loblaws.ca/products/NoImage/b3/en/front/NoImage_front_a06.png,https://www.loblaws.ca/black-cherry-lipcolor/p/21220790002_EA
Pet Supplies,Rosewood Naturals Alfalfa Ring,6238,$8.95,,Alfalfa ring. A fun and challenging- swinging hay ring made from tasty alfalfa grass. Ideal for rabbits- guinea pigs and chinchillas.[newline]Product Number: SP214152,https://assets.sellers.loblaw.ca/products/all/1291/214152_1.jpg?size=274,https://www.loblaws.ca/rosewood-naturals-alfalfa-ring/p/SP214152
Pet Supplies,Pleasure Pack,6088,$48.00,,No additives- preservatives or colours[newline]Hand made in small batches[newline]North American sourced ingredients[newline]Minimally processed[newline]Uncompromised quality[newline]Product Number: SP48390,https://assets.sellers.loblaw.ca/products/all/1128/48390_5690515387_1.jpg?size=274,https://www.loblaws.ca/pleasure-pack/p/SP48390
Health & Beauty,Max Fresh Soft Manual Toothbrush,6012,$2.99,,Colgate MaxFresh manual toothbrush is designed with a tongue freshener and multi-height bristles to remove away odour-causing bacteria and plaque for fresher breath (vs. a flat-trim toothbrush). It has a wide thumb grip and a rubber handle for better control and comfort. Experience a whole new dimension of Freshness with Colgate MaxFresh![newline]Experience a whole new dimension of freshness! Colgate Max Fresh Full Head Soft Toothbrush has an advanced tongue freshener- with 3 waves of multidimensional cleaning to power away odour causing bacteria. Its specially designed multi-height bristles penetrate between teeth to clean away plaque. Remember to change your toothbrush every 3 months.[newline]Advanced tongue freshener- with 3 waves of multidimensional cleaning to power away odour causing bacteria.[newline]Specially designed multi-height bristles penetrate between teeth to clean away plaque.[newline]Colors will vary[newline]Soft Toothbrush Bristles[newline]Product Number: 20432339010_EA,https://assets.shop.loblaws.ca/products/20432339010/b1/en/front/20432339010_front_a01_@2.png,https://www.loblaws.ca/max-fresh-soft-manual-toothbrush/p/20432339010_EA
Pet Supplies,Adventure Leash - True North,6161,$28.99,,True North Strong and Free’ are the words from Canada’s National Anthem. The 'True North’ design provides both strength and a sense of freedom to your dog.Made with heavy polypro webbing sourced from the USA. With a tensile strength of over 600 lbs- this leash is tough and ready to withstand all the adventure you throw at all. With a built in triglide- you can easily adjust our Adventure leash from 3 feet to 5 feet![newline]Product Number: SP109255,https://assets.sellers.loblaw.ca/products/all/1092/109255_1.jpg?size=274,https://www.loblaws.ca/adventure-leash-true-north/p/SP109255
Pet Supplies,Hypoallergenic Shampoo,6239,$18.99,,Veterinary Formula Clinical Care Hypoallergenic Shampoo was scientifically formulated with the gentlest coconut-based cleansers and no harsh ingredients- dyes and fragrances so it will not irritate sensitive skin. Ideal for pets with known allergies.[newline]Product Number: SP169602,https://assets.sellers.loblaw.ca/products/all/1269/169602_0660297344_1.jpg?size=274,https://www.loblaws.ca/hypoallergenic-shampoo/p/SP169602
Pet Supplies,Happy Pet Building Block Maze Bird Toy (May Vary),6089,$37.45,,Bird toy for parrots and larger birds. Made from natural wood and safe- non toxic colours. Encourages natural foraging and chewing instincts. Blocks slide up and down and treats can be hidden inside.[newline]Product Number: SP211623,https://assets.sellers.loblaw.ca/products/all/1291/211623_1.jpg?size=274,https://www.loblaws.ca/happy-pet-building-block-maze-bird-toy-may-vary/p/SP211623
Health & Beauty,Match Perfection Light/Medium,6013,$8.98,$9.98,Product Number: 20741131004_EA,https://assets.shop.loblaws.ca/products/20741131004/b1/en/front/20741131004_front_a01_@2.png,https://www.loblaws.ca/match-perfection-light-medium/p/20741131004_EA
Pet Supplies,Clix Dogs Retrieval Training Dumbbell (May Vary),6240,$11.20,,Dogs retrieval training toy.[newline]Product Number: SP211174,https://assets.sellers.loblaw.ca/products/all/1291/211174_1.jpg?size=274,https://www.loblaws.ca/clix-dogs-retrieval-training-dumbbell-may-vary/p/SP211174
Pet Supplies,Nylabone Puppy Teething Chew Textured Bone Chicken Flavour Toy,6162,$7.45,,Puppy chew toy. Encourages proper chewing habits for puppies. Soothes gums. Made from inert soft thermoplastic polymer to satisfy the chewing instinct of teething puppies and encourage non-destructive chewing. Chicken flavour.[newline]Product Number: SP209735,https://assets.sellers.loblaw.ca/products/all/1291/209735_1.jpg?size=274,https://www.loblaws.ca/nylabone-puppy-teething-chew-textured-bone-chicken/p/SP209735
Pet Supplies,Nuvalu Fish Tank Net 5" W/ Deluxe Handle - 2 Pack`,6090,$18.74,,Nuvalu Fish Tank Net 5" W/ Deluxe Handle[newline]Product Number: SP130391,https://assets.sellers.loblaw.ca/products/all/1127/130391_1.jpg?size=274,https://www.loblaws.ca/nuvalu-fish-tank-net-5-w-deluxe-handle-2-pack/p/SP130391
Health & Beauty,Superior Preference Hair Colour- 16 Toscane,6014,$13.99,,Product Number: 20306667011_EA,https://assets.shop.loblaws.ca/products/20306667011/b1/en/front/20306667011_front_a01_@2.png,https://www.loblaws.ca/superior-preference-hair-colour-16-toscane/p/20306667011_EA
Pet Supplies,PETKIT Instachew 5 in 1 Tofu Cat Litter (4 bags 7L each),6241,$49.99,,Innovative:[newline]The Tofu Cat Litter is an all natural plant-based clumping cat litter made of food-grade soy pulp- making it safe for your cat and environmentally friendly. The litter is completely flushable due to its high solubility- also making it ultra-absorbent and fast drying![newline][newline]Easy to Use:[newline]With 2x more absorbent than regular cat litter- the Tofu Cat Litter doesn't need to be changed as often as regular litter- and is much easier to clump and clean. The litter locks urine odors naturally with no chemicals or artificial additives- making it safer for your cat and the environment.[newline][newline]Clean:[newline]The Soy Pulp substance has the ability to complete instant adsorption and agglomeration in 1.5 seconds- decreasing the likelihood of slime build up. With a low humidity level- the litter prevents mildew and harmful substance growth caused by moisture- creating a refreshing and healthy environment.[newline][newline]Deodorizing:[newline]The Soy Pulp substance contains activated Carbon molecules that provide constant deodorizing and freshness- through non-toxic fragrance allowing you and your cat to breathe comfortably.[newline][newline]Each pack contains 4 bags of 7L litter[newline][newline][newline][newline]Product Number: SP38125,https://assets.sellers.loblaw.ca/products/all/1066/38125_3547941668_9.jpg?size=274,https://www.loblaws.ca/petkit-instachew-5-in-1-tofu-cat-litter-4-bags-7l/p/SP38125
Pet Supplies,Wahl Steel Pet Comb (Steel),6163,$9.45,,Stainless Steel Comb. Great For All Animal Coats. Wide And Thin Teeth.[newline]Product Number: SP211584,https://assets.sellers.loblaw.ca/products/all/1291/211584_1.jpg?size=274,https://www.loblaws.ca/wahl-steel-pet-comb-steel/p/SP211584
Pet Supplies,Happy Pet Supersoft Loofa Dog Toy (May Vary),6091,$12.45,,A great soft plush for any dog. A soft material for any dog to enjoy carrying it around. Also a great fetch toy. Has a squeaking mechanism inside that when squeezed- can entertain your dog for hours.[newline]Product Number: SP212042,https://assets.sellers.loblaw.ca/products/all/1291/212042_1.jpg?size=274,https://www.loblaws.ca/happy-pet-supersoft-loofa-dog-toy-may-vary/p/SP212042
Health & Beauty,Homeopathic Medicine- Teething,6015,$10.99,,Effective relief that helps:.[newline][newline]- Soothe gum pain.[newline][newline]- Relieve agitation and irritability.[newline][newline]Indications: This homeopathic medicine helps soothe gum pain- relieve agitation and irritability caused by teething[newline]Product Number: 20012801_EA,https://assets.shop.loblaws.ca/products/20012801/b1/en/front/20012801_front_a01_@2.png,https://www.loblaws.ca/homeopathic-medicine-teething/p/20012801_EA
Pet Supplies,Extra Clips,6243,$12.99,,Hang your pee pads quickly and easily with our handy clips. The innovative design of our Doggy Bathroom allows you to use your own pee pads and fasten them into place vertically. Your loyal companion will appreciate the accommodations.[newline][newline]*Please note that the Doggy Bathroom comes with 6 clips.[newline][newline]Product Number: SP197479,https://assets.sellers.loblaw.ca/products/all/1283/197479_3448624704_1.jpg?size=274,https://www.loblaws.ca/extra-clips/p/SP197479
