Category,Product,Product ID,Price,Old Price,Description,Image URL,Product URL
Food,Pepperettesï¿½ Sausage Sticks- Hot Pepperoni,773,$7.99,$9.00,Experience timeless flavour in a handy- portable snack with Schneiders® Pepperettes® Hot Pepperoni Sausage Sticks. These hot pepperoni Pepperettes® have that classic pepperoni taste with an added kick! The naturally cured meat sticks are smoked and dried for 12 hours- and a variety of spices round out the traditional pepperoni flavouring in these spicy sausage sticks. Requiring no refrigeration- Schneiders® Pepperettes® hot pepperoni sticks are a shelf-stable snack option for outdoor activities such as hiking- or while at home or at work. Since 1890- Schneiders® has made high-quality cured meat with authentic- family recipes- and still uses the same techniques and recipes today. Quality never gets old.[newline]ON-THE-GO SNACK: These portable snacks require no refrigeration and the spicy pepperoni sticks fit easily into a bag or lunch box[newline]PREMIUM CUTS: Schneiders® uses only our quality cuts of meat to create pepperoni snack sticks[newline]NATURALLY CURED: Cured meat sticks are dried for the ideal amount of time to create optimal flavour and jerky-like texture[newline]SPICED JUST RIGHT: Seasoned with a variety of spices- these pork sausage sticks have a hot- tangy taste[newline]QUALITY NEVER GETS OLD: Uncompromising commitment to quality standards since 1890[newline]Product Number: 21053172_EA,https://assets.shop.loblaws.ca/products/21053172/b1/en/front/21053172_front_a01_@2.png,https://www.loblaws.ca/pepperettes-sausage-sticks-hot-pepperoni/p/21053172_EA
Food,Smoked Turkey Breast,698,$5.00,,Turkey is a flavourful- lean white meat. As a cold cut- it makes for a great sandwich filling. Try it on a bun with lettuce- tomatoes- and mayonnaise.[newline]Product Number: 20668014_EA,https://assets.shop.loblaws.ca/products/20668014/b1/en/front/20668014_front_a01_@2.png,https://www.loblaws.ca/smoked-turkey-breast/p/20668014_EA
Food,Smoked Turkey Drumsticks,869,$1.69,,Turkey is a flavourful- lean white meat. As a cold cut- it makes for a great sandwich filling. Try it on a bun with lettuce- tomatoes- and mayonnaise.[newline]Product Number: 20052384_KG,https://assets.shop.loblaws.ca/products/20052384/b1/en/front/20052384_front_a01_@2.png,https://www.loblaws.ca/smoked-turkey-drumsticks/p/20052384_KG
Food,Margarine,643,$4.29,,Margarine is a butter substitute that is typically made using vegetable oils. It can be used in baking and cooking or as a spread.[newline]Product Number: 20249802_EA,https://assets.shop.loblaws.ca/products/20249802/b1/en/front/20249802_front_a01_@2.png,https://www.loblaws.ca/margarine/p/20249802_EA
Food,Wine Gums,699,$5.99,,Product Number: 20116370_EA,https://assets.shop.loblaws.ca/products/20116370/b1/en/front/20116370_front_a01_@2.png,https://www.loblaws.ca/wine-gums/p/20116370_EA
Food,Fudge-Striped Shortbread Cookies,774,$3.49,,Shortbread cookies topped with fudge drizzle.[newline]Product Number: 20303626_EA,https://assets.shop.loblaws.ca/products/20303626/b1/en/front/20303626_front_a01_@2.png,https://www.loblaws.ca/fudge-striped-shortbread-cookies/p/20303626_EA
Food,Greek Salad Family Size,870,$12.99,,Product Number: 20972500_EA,https://assets.shop.loblaws.ca/products/20972500/b1/en/front/20972500_front_a01_@2.png,https://www.loblaws.ca/greek-salad-family-size/p/20972500_EA
Food,Medium Cornmeal,644,$3.99,,Product Number: 21389712_EA,https://assets.shop.loblaws.ca/products/21389712/b1/en/front/21389712_front_a01_@2.png,https://www.loblaws.ca/medium-cornmeal/p/21389712_EA
Food,Extra Virgin Olive Oil From Tuscany,700,$12.99,,This award-winning oil from Tuscany is made of olives grown in an olive grove and cold pressed a few hours after harvest. Full-bodied- with a robust flavor and strong peppery finish- it is ideal served with bread- for soaking or watering- for bruschetta and in soups.[newline]Product Number: 20103106_EA,https://assets.shop.loblaws.ca/products/20103106/b1/en/front/20103106_front_a01_@2.png,https://www.loblaws.ca/extra-virgin-olive-oil-from-tuscany/p/20103106_EA
Food,Activia Yogurt with Probiotics- Stawberry Vanilla Flavour- 100g (Pack of 8),775,$3.99,$4.29,Offered in a wide variety of flavours- Activia Classic features delicious- nutritious probiotic* yogurts that contribute to the health of the gut flora and perfectly complement a healthy diet.Try our Strawberry and Vanilla- two exquisite flavours available in one convenient 8 x 100g format.* With more than 1 billion CFU Bifidobacterium lactis per serving- a probiotic that contributes to healthy gut flora.[newline]Yogurt with Probiotics[newline]Contributes to your gut flora health[newline]Delicious and creamy- it's the perfect snack any time of day[newline]Treat yourself today with Canada's best-selling yogurt[newline]Product Number: 20324741001_EA,https://assets.shop.loblaws.ca/products/20324741001/b1/en/front/20324741001_front_a01_@2.png,https://www.loblaws.ca/activia-yogurt-with-probiotics-stawberry-vanilla-f/p/20324741001_EA
Food,Roasted Cashews- Salted,871,$13.99,,Cashews are kidney-shaped nuts with a buttery flavour and high fat content. Try cashews as a snack with other nuts and dried fruit- or add them to salads- curries- and stir-fries.[newline]Product Number: 20545908_EA,https://assets.shop.loblaws.ca/products/20545908/b1/en/front/20545908_front_a01_@2.png,https://www.loblaws.ca/roasted-cashews-salted/p/20545908_EA
Food,Filo Twist- Spinach- Family Size,645,$9.39,,NUTRITIONAL VALUE / 100 GR.[newline][newline]- PROTEIN: 6-5 g.[newline][newline]- FAT: 14-0 g.[newline][newline]- CARBOHYDRATE: 29-1 g.[newline][newline]- ENERGY: 271 Kcal/1133KJ.[newline][newline]Ready in 40 minutes[newline]Product Number: 20987472_EA,https://assets.shop.loblaws.ca/products/20987472/b1/en/front/20987472_front_a01_@2.png,https://www.loblaws.ca/filo-twist-spinach-family-size/p/20987472_EA
Food,Mango Punch Frozen Concentrate Juice Beverage- Can,701,$1.49,,Mix things up with this refreshing combination of mango and fruit flavours that come together in a tasty blend. Made with real fruit and natural flavours- it’s an excellent source of Vitamin C.[newline]Product Number: 20418237005_EA,https://assets.shop.loblaws.ca/products/20418237005/b1/en/front/20418237005_front_a01_@2.png,https://www.loblaws.ca/mango-punch-frozen-concentrate-juice-beverage-can/p/20418237005_EA
Food,Coloured Old Cheddar Cheese- Club Pack,776,$12.49,,Cheddar is a firm- smooth cheese that becomes crumbly with age. In general- mild cheddar is aged 2 – 4 months- medium 4 – 8 months- old 9 – 12 months- and extra old 1 – 7 years. Cheddar is a versatile cheese that melts really well. Try yours in grilled cheese sandwiches- macaroni and cheese- or simply slice and add to your next cheese platter.[newline]Product Number: 20249328_EA,https://assets.shop.loblaws.ca/products/20249328/b1/en/front/20249328_front_a01_@2.png,https://www.loblaws.ca/coloured-old-cheddar-cheese-club-pack/p/20249328_EA
Food,Organic Green Tea,872,$4.49,,The tea ceremony in Japan goes back to the 13th century- many centuries after the introduction of tea in Japan. We honour this long and rich tradition- inviting you to enjoy- with friends and loved ones- this refined green tea.[newline][newline]Four O'Clock.[newline][newline]Tea crafters since 1992[newline]Product Number: 20326306004_EA,https://assets.shop.loblaws.ca/products/20326306004/b1/en/front/20326306004_front_a01_@2.png,https://www.loblaws.ca/organic-green-tea/p/20326306004_EA
Food,Marble Cheddar,646,$8.99,,World's finest cheddar.[newline][newline]Since 1881[newline]Product Number: 20415944_EA,https://assets.shop.loblaws.ca/products/20415944/b1/en/front/20415944_front_a01_@2.png,https://www.loblaws.ca/marble-cheddar/p/20415944_EA
Food,Rustico Salami,702,$9.99,,Made with select ingredients and with a distinctively artisanal look- this dry-cured pork salami is the ideal addition to an appetizer platter with olives and cheeses- or slice and sandwich on crusty buns with provolone cheese- fresh basil and a touch of olive oil.[newline]Product Number: 20911401_EA,https://assets.shop.loblaws.ca/products/20911401/b1/en/front/20911401_front_a01_@2.png,https://www.loblaws.ca/rustico-salami/p/20911401_EA
Food,Lemon Lime Club Soda ( Case),777,$5.99,,Canada Dry Club Soda Lemon-Lime is a refreshing- sugar free- unsweetened- zero calorie and low sodium everyday sparkling beverage option. It’s naturally flavoured with a hint of lemon and lime. A great tasting bubbly alternative to your daily water intake.[newline]Unsweetened and caffeine free[newline]Ideal can size for pairing with individual meals or snacks[newline]Can be enjoyed alone or while entertaining family and friends[newline]Best savoured chilled for a revitalizing beverage experience[newline]Product Number: 20884864_C12,https://assets.shop.loblaws.ca/products/20884864/b1/en/front/20884864_front_a01_@2.png,https://www.loblaws.ca/lemon-lime-club-soda-case/p/20884864_C12
Food,King Oyster Sliced Mushrooms,873,$5.99,,The largest of all the oyster mushrooms- king oyster mushrooms put a hearty spin on any meal thanks to their meaty texture and savoury flavour. Sliced for convenience- these organic king oyster hold up beautifully in stir-fries- soup and pasta.[newline]Product Number: 21005977_EA,https://assets.shop.loblaws.ca/products/21005977/b1/en/front/21005977_front_a01_@2.png,https://www.loblaws.ca/king-oyster-sliced-mushrooms/p/21005977_EA
Food,Diet Tonic Water,647,$1.29,,Keep some on hand at all times! A zero calorie alternative to classic Tonic Water- and a must-have for mixed drinks such as Gin and Tonics![newline]Product Number: 20311645014_EA,https://assets.shop.loblaws.ca/products/20311645014/b1/en/front/20311645014_front_a01_@2.png,https://www.loblaws.ca/diet-tonic-water/p/20311645014_EA
Food,Chicken Nuggets,703,$10.99,,Product Number: 21179709_EA,https://assets.shop.loblaws.ca/products/21179709/b1/en/front/21179709_front_a01_@2.png,https://www.loblaws.ca/chicken-nuggets/p/21179709_EA
Food,Sliced Bananas,778,$4.99,,Enjoy peeled and sliced ripened frozen bananas anytime - ready to use in smoothies- milkshakes- muffins- pies and desserts or as a topping for cereal- yogurt and ice cream.[newline]Product Number: 21289947_EA,https://assets.shop.loblaws.ca/products/21289947/b1/en/front/21289947_front_a01_@2.png,https://www.loblaws.ca/sliced-bananas/p/21289947_EA
Food,Lemonade Liquid Water Enhancer,648,$3.33,,MiO Lemonade Liquid Water Enhancer provides a burst of flavour! A simple squeeze from our conveniently sized bottle delivers an instant- zero Calorie beverage full of bold fruit flavour. It’s the perfect option when you’re on the go- as our MiO bottle can easily fit anywhere: purse- pocket- you name it! One bottle makes up to twenty-four 250 mL servings. Whether you're studying- working or heading to a workout- add MiO fruit flavour drops to your water for a delicious lemonade flavoured water.[newline]48 mL bottle of MiO Lemonade Liquid Water Enhancer[newline]Delivers delicious flavour in every squeeze[newline]Contains 0 Calories- 0 g fat and 0 g carbohydrates per 1/2 tsp (2 mL) serving[newline]Convenient bottle neatly fits in your purse- bag or glove box for easy on-the-go mixing[newline]Makes up to twenty-four 250 mL servings per bottle[newline]Made with natural flavours[newline]Product Number: 20663423_EA,https://assets.shop.loblaws.ca/products/20663423/b1/en/front/20663423_front_a01_@2.png,https://www.loblaws.ca/lemonade-liquid-water-enhancer/p/20663423_EA
Food,Cream Wafers- Cappuccino Flavour,874,$1.69,$1.99,Wafer cookies layered with cappuccino flavoured crème.[newline]Product Number: 20688122_EA,https://assets.shop.loblaws.ca/products/20688122/b1/en/front/20688122_front_a01_@2.png,https://www.loblaws.ca/cream-wafers-cappuccino-flavour/p/20688122_EA
Food,3.2% Canadian Harvest Raspberry-Cranberry Yogurt,704,$3.49,,Rich and creamy stirred yogurt with 100% Canadian raspberries and cranberries. It is also made with 100% canadian milk. Canadian dairy farmers are proud to offer high-quality milk to their fellow canadians. iÖGO is owned by a cooperative of canadian dairy farmers and this delicous yogurt is made right here in Canada.[newline]Product Number: 21219056_EA,https://assets.shop.loblaws.ca/products/21219056/b1/en/front/21219056_front_a01_@2.png,https://www.loblaws.ca/3-2-canadian-harvest-raspberry-cranberry-yogurt/p/21219056_EA
Food,BBQ Sauce Sweet Chili,779,$6.49,,Product Number: 21098355_EA,https://assets.shop.loblaws.ca/products/21098355/b1/en/front/21098355_front_a01_@2.png,https://www.loblaws.ca/bbq-sauce-sweet-chili/p/21098355_EA
Food,Minigo Fresh Cheese Blueberry/Strawberry/Vanilla,649,$4.29,,Help your kids grow strong by giving them Yoplait Minigo every day. Parents love the goodness- kids love the great taste! Perfect serving size for little ones![newline]No artificial colours or flavours[newline]With probiotics[newline]Source of vitamin D and calcium[newline]Product Number: 20275868002_EA,https://assets.shop.loblaws.ca/products/20275868002/b1/en/front/20275868002_front_a01_@2.png,https://www.loblaws.ca/minigo-fresh-cheese-blueberry-strawberry-vanilla/p/20275868002_EA
Food,Kimchi Noodles,875,$1.79,,Product Number: 20863284_EA,https://assets.shop.loblaws.ca/products/20863284/b1/en/front/20863284_front_a01_@2.png,https://www.loblaws.ca/kimchi-noodles/p/20863284_EA
Food,extrï¿½az Cookie Dough Dynamo Ice Cream,705,$5.99,,Take indulgence to the next level with HÄAGEN-DAZS exträaz Cookie Dough Dynamo Ice Cream (500 ml). We’ve infused our decadently distinct HÄAGEN-DAZS ice cream with textured ingredients- bringing you a unique experience that will satisfy your richest cravings. Chunks of chewy cookie dough and delicious fudge chips are blended into our finest vanilla ice cream- made with 100% Canadian dairy. The result is a childhood favourite in new packaging that will bring back all of your sweetest memories.[newline][newline]Chunks of chewy cookie dough and sweet fudge chips in our finest vanilla ice cream- made with 100% Canadian dairy.[newline]New packaging- same decadently distinct HÄAGEN-DAZS taste.[newline]Made with only the finest ingredients- no artificial flavours or colours.[newline]Bring back your sweetest memories with this childhood favourite.[newline]Enjoy the same decadent taste with HÄAGEN-DAZS exträaz Cookie Dough Dynamo Ice Cream Bars (3 x 72 ml).[newline] Product Number: 20314040_EA,https://assets.shop.loblaws.ca/products/20314040/b1/en/front/20314040_front_a01_@2.png,https://www.loblaws.ca/extr-az-cookie-dough-dynamo-ice-cream/p/20314040_EA
Food,Liquorice Watermelon Seed,780,$3.49,,Product Number: 20009469002_EA,https://assets.shop.loblaws.ca/products/20009469002/b1/en/front/20009469002_front_a01_@2.png,https://www.loblaws.ca/liquorice-watermelon-seed/p/20009469002_EA
Food,Garlic- Minced,650,$3.89,,Product Number: 20631894_EA,https://assets.shop.loblaws.ca/products/20631894/b1/en/front/20631894_front_a01_@2.png,https://www.loblaws.ca/garlic-minced/p/20631894_EA
Food,Farmer's Market Peaches - 3L,876,$7.99,,Peaches range in colour from pinkish-white to reddish-yellow and their flavour can be tart or sweet. If you don't like their fuzzy skin- you can easily peel peaches by blanching them in boiling water for about 30 seconds and then plunging them into ice water. Enjoy peaches as a snack- in a pie- or grilled with prosciutto.[newline]Product Number: 20826568001_EA,https://assets.shop.loblaws.ca/products/20826568001/b1/en/front/20826568001_front_a01_@2.png,https://www.loblaws.ca/farmer-s-market-peaches-3l/p/20826568001_EA
Food,Market Summer Sausage,706,$15.99,,Summer sausage is a mildly seasoned- smoked- semi-dry German sausage traditionally eaten in the summer because it's light and doesn't need to be cooked. Enjoy slices of summer sausage in a bun with mozzarella cheese or as part of an antipasto plate.[newline]Product Number: 20793336_EA,https://assets.shop.loblaws.ca/products/20793336/b1/en/front/20793336_front_a01_@2.png,https://www.loblaws.ca/market-summer-sausage/p/20793336_EA
Food,Palm Hearts- Diced,781,$3.49,$3.99,Product Number: 20155832002_EA,https://assets.shop.loblaws.ca/products/20155832002/b1/en/front/20155832002_front_a01_@2.png,https://www.loblaws.ca/palm-hearts-diced/p/20155832002_EA
Food,Chica Licka Bam Bam,651,$9.99,,Product Number: 21344325_EA,https://assets.shop.loblaws.ca/products/21344325/b1/en/front/21344325_front_a01_@2.png,https://www.loblaws.ca/chica-licka-bam-bam/p/21344325_EA
Food,Tonic Water,877,$2.29,,Perfectly refined since 1783- Schweppes Tonic Water offers a unique sparkling drink- pefect for mixing. Enjoy an intense burst of Schweppes flavour in a 2L bottle![newline]Product Number: 20186234002_EA,https://assets.shop.loblaws.ca/products/20186234002/b1/en/front/20186234002_front_a01_@2.png,https://www.loblaws.ca/tonic-water/p/20186234002_EA
Food,Small Mixed Vegetables,707,$2.99,,Small Mixed Vegetables.[newline]This item is only available for pickup after 12PM.[newline]Product Number: 21086369_EA,https://assets.shop.loblaws.ca/products/21086369/b1/en/front/21086369_front_a01_@2.png,https://www.loblaws.ca/small-mixed-vegetables/p/21086369_EA
Food,Cheese- Chevrai Lemon Lime,782,$5.99,,Soft fresh goat cheese 22% MF Lemon lime[newline]Product Number: 20787663_EA,https://assets.shop.loblaws.ca/products/20787663/b1/en/front/20787663_front_a01_@2.png,https://www.loblaws.ca/cheese-chevrai-lemon-lime/p/20787663_EA
Food,Bars Oatmeal Raisin,652,$3.49,,Product Number: 21309036_EA,https://assets.shop.loblaws.ca/products/21309036/b1/en/front/21309036_front_a01_@2.png,https://www.loblaws.ca/bars-oatmeal-raisin/p/21309036_EA
Food,Mini Crisp & Thin Multigrain Crackers,878,$2.99,,Crisp and tasty crackers made with 8 different grains and seeds.[newline]Product Number: 21295601_EA,https://assets.shop.loblaws.ca/products/21295601/b1/en/front/21295601_front_a01_@2.png,https://www.loblaws.ca/mini-crisp-thin-multigrain-crackers/p/21295601_EA
Food,Chinese Style Fried Rice,708,$1.99,,Get a bowl of mouth-watering fried rice without ordering takeout. Toss in more of your favourite veggies for a personal touch – and THAT’S how you master Chinese food night. Ready in 20 minutes & Perfect every time. For your next dinner recipe- try some of our other Fast & Fancy items like Ben's Original Country Chicken Flavour or Ben's Original Broccoli & Cheddar Flavour. Better meals begin with Ben's.[newline]Ready in 20 minutes[newline]3 Portions[newline]Product Number: 21397365_EA,https://assets.shop.loblaws.ca/products/21397365/b1/en/front/21397365_front_a01_@2.png,https://www.loblaws.ca/chinese-style-fried-rice/p/21397365_EA
Food,Butter 82 Farmhouse,783,$6.99,,Product Number: 21361875_EA,https://assets.shop.loblaws.ca/products/NoImage/b3/en/front/NoImage_front_a06.png,https://www.loblaws.ca/butter-82-farmhouse/p/21361875_EA
Food,Grk Ex Crm Vanilla 5%,879,$5.99,,Product Number: 21353463_EA,https://assets.shop.loblaws.ca/products/21353463/b1/en/front/21353463_front_a01_@2.png,https://www.loblaws.ca/grk-ex-crm-vanilla-5/p/21353463_EA
Food,So Delicious Coconut Dairy-Free Frozen Dessert- Vanilla Flavour- 500ml,653,$6.29,$6.99,This rich dairy-free frozen dessert made with coconut can be enjoyed all by itself- or for the more adventurous soul- complimented with an endless array of toppings. Let the adventure begin![newline]Product Number: 20004536002_EA,https://assets.shop.loblaws.ca/products/20004536002/b1/en/front/20004536002_front_a01_@2.png,https://www.loblaws.ca/so-delicious-coconut-dairy-free-frozen-dessert-van/p/20004536002_EA
Food,Pizza Crust,709,$4.29,,Product Number: 20317832002_EA,https://assets.shop.loblaws.ca/products/20317832002/b1/en/front/20317832002_front_a01_@2.png,https://www.loblaws.ca/pizza-crust/p/20317832002_EA
Food,Peach Rings,784,$3.99,,Product Number: 21363397_EA,https://assets.shop.loblaws.ca/products/21363397/b1/en/front/21363397_front_a01_@2.png,https://www.loblaws.ca/peach-rings/p/21363397_EA
Food,Beefless Tips,654,$6.99,,Seasoned meatless tips- great for stews- soups- and stir-fries.[newline]Product Number: 20371426003_EA,https://assets.shop.loblaws.ca/products/20371426003/b1/en/front/20371426003_front_a01_@2.png,https://www.loblaws.ca/beefless-tips/p/20371426003_EA
Food,Long Grain Parboiled Rice,880,$13.99,,Rice which has been partially boiled in the husk to retain more minerals and vitamins than regular white rice.[newline]Product Number: 20106122_EA,https://assets.shop.loblaws.ca/products/20106122/b1/en/front/20106122_front_a01_@2.png,https://www.loblaws.ca/long-grain-parboiled-rice/p/20106122_EA
Food,Breton Gluten Free Original with Flax,710,$3.49,,Enjoy the tender-crisp texture and wholesome taste of Breton with our Breton Gluten Free Original with Flax crackers.[newline]Certified gluten-free with the earthy flavour of flax seeds- these crackers are made with no artificial colours or flavours and 0g trans fat per serving.[newline]Snack on them on their own or with cheese- spreads- soups and more.[newline]Gluten Free- Kosher- No Artificial Colours- No Artificial Flavours- Peanut-free[newline]Product Number: 20727536001_EA,https://assets.shop.loblaws.ca/products/20727536001/b1/en/front/20727536001_front_a01_@2.png,https://www.loblaws.ca/breton-gluten-free-original-with-flax/p/20727536001_EA
Food,Sliced Marble Cheddar Cheese,785,$4.99,,Product Number: 21371880_EA,https://assets.shop.loblaws.ca/products/21371880/b1/en/front/21371880_front_a01_@2.png,https://www.loblaws.ca/sliced-marble-cheddar-cheese/p/21371880_EA
Food,Tres Pimientos Hot Sauce,881,$3.99,,Made with three Varieties of Chili Peppers- Agave Syrup and Tamarind Extract[newline]Product Number: 21371675_EA,https://assets.shop.loblaws.ca/products/21371675/b1/en/front/21371675_front_a01_@2.png,https://www.loblaws.ca/tres-pimientos-hot-sauce/p/21371675_EA
Food,Ice Cream- ; ;Strawberry,655,$6.99,,Product Number: 21184625_EA,https://assets.shop.loblaws.ca/products/21184625/b1/en/front/21184625_front_a01_@2.png,https://www.loblaws.ca/ice-cream-strawberry/p/21184625_EA
Food,Maple Crunch Mini Ice Cream Bars,711,$5.99,,Rich- creamy maple-flavoured ice cream with a maple swirl and crunchy praline almonds might just be your new favourite indulgence - on a stick![newline]Product Number: 21229660_EA,https://assets.shop.loblaws.ca/products/21229660/b1/en/front/21229660_front_a01_@2.png,https://www.loblaws.ca/maple-crunch-mini-ice-cream-bars/p/21229660_EA
Food,1 Piece Spicy Fried Chicken Dark Meat,786,$1.99,,1 Piece Spicy Fried Chicken Dark Meat.[newline]This item is only available for pickup after 12PM.[newline]Product Number: 21099843_EA,https://assets.shop.loblaws.ca/products/21099843/b1/en/front/21099843_front_a01_@2.png,https://www.loblaws.ca/1-piece-spicy-fried-chicken-dark-meat/p/21099843_EA
Food,Lemon Flavour & Chives Quinoa,656,$3.99,,A versatile side dish that’s ready in less than 20 minutes- this mildly nutty tasting whole grain quinoa is perfectly balanced with delicate lemon flavour and chives. Conveniently packaged- it’s an exceptional side dish or enjoy chilled and tossed in salads.[newline]Product Number: 20974681_EA,https://assets.shop.loblaws.ca/products/20974681/b1/en/front/20974681_front_a01_@2.png,https://www.loblaws.ca/lemon-flavour-chives-quinoa/p/20974681_EA
Food,2% Milk,882,$3.29,,Vitamins A and D added.[newline]Product Number: 20325707002_EA,https://assets.shop.loblaws.ca/products/20325707002/b1/en/front/20325707002_front_a01_@2.png,https://www.loblaws.ca/2-milk/p/20325707002_EA
Food,Salted Caramel Cheesecake,712,$5.99,$7.99,At Dr. Oetker- we believe that the best way to create high quality- delicious desserts is to start with high quality ingredients. Our delicately melting salted caramel sauce- chunks of caramel and a deep layer of cream cheese makes this cheesecake incredibly tempting![newline]Product Number: 21163225_EA,https://assets.shop.loblaws.ca/products/21163225/b1/en/front/21163225_front_a01_@2.png,https://www.loblaws.ca/salted-caramel-cheesecake/p/21163225_EA
Food,Savory,787,$3.59,,Product Number: 20652764_EA,https://assets.shop.loblaws.ca/products/20652764/b1/en/front/20652764_front_a01_@2.png,https://www.loblaws.ca/savory/p/20652764_EA
Food,Carbonated Artesian Mineralised Sparkling Water- Lemon Cucumber,657,$2.79,,Product Number: 21227327_EA,https://assets.shop.loblaws.ca/products/21227327/b1/en/front/21227327_front_a01_@2.png,https://www.loblaws.ca/carbonated-artesian-mineralised-sparkling-water-le/p/21227327_EA
Food,Premium Noodle Soup- Shin Black Cup,883,$2.49,,Product Number: 20674067_EA,https://assets.shop.loblaws.ca/products/20674067/b1/en/front/20674067_front_a01_@2.png,https://www.loblaws.ca/premium-noodle-soup-shin-black-cup/p/20674067_EA
Food,Monterey Jack Cheddar Slices,713,$6.99,,Product Number: 21343329_EA,https://assets.shop.loblaws.ca/products/21343329/b1/en/front/21343329_front_a01_@2.png,https://www.loblaws.ca/monterey-jack-cheddar-slices/p/21343329_EA
Food,Coconut,788,$10.99,,Experience the Exquisite.[newline][newline]Considered by many to be a Superfood- Thai Young Coconuts are harvested from local farms in tropical Thai paradise. Soft- tender and flavourful- we make sure our dry coconuts taste both clean and simple. With no added colours or flavours- treat yourself to a healthy snack that is both delicious and nutritious![newline]Product Number: 20923503_EA,https://assets.shop.loblaws.ca/products/20923503/b1/en/front/20923503_front_a01_@2.png,https://www.loblaws.ca/coconut/p/20923503_EA
