Category,Product,Product ID,Price,Old Price,Description,Image URL,Product URL
Baby,Diapers Mega Size 2,1577,$12.99,,Product Number: 21302792_EA,https://assets.shop.loblaws.ca/products/21302792/b1/en/front/21302792_front_a01_@2.png,https://www.loblaws.ca/diapers-mega-size-2/p/21302792_EA
Baby,Bc Babycare Baby'S Ceramic Scissors Mint,1502,$32.99,,Prepare your baby's meal with this efficient ceramic scissors. Design to be easily and comfortably held during cutting. Blades are made from ceramic- sharp and long-lasting; scissors' structure is made with PP- can withstand boiling water or UV sanitizing. The tips are rounded and blunt- to prevent accidentally harming children. Comes with a storage stand and a locking mechanism to prevent misplacing. Easy and simple to clean.[newline]Materials: Zirconia- PP- TPE[newline]Weight: 64g[newline]Dimension: 7.5cm x 17cm[newline]Color: Clouds Green[newline]Product Number: SP223405,https://assets.sellers.loblaw.ca/products/all/1245/223405_1.jpg?size=274,https://www.loblaws.ca/bc-babycare-baby-s-ceramic-scissors-mint/p/SP223405
Baby,Grey Cable-Knit Receiving Blanket,1652,$49.99,,To snuggle inside this luxuriously plush blanket is like being wrapped in a cloud made of cotton candy. Soft fabric- a cable-knit look and the perfect color-everything about this piece is precious.[newline]Product Number: SP21719,https://assets.sellers.loblaw.ca/products/all/1049/21719_1.jpg?size=274,https://www.loblaws.ca/grey-cable-knit-receiving-blanket/p/SP21719
Baby,Stage 3 Wheat Biscuit Baby Cereal,1727,$4.99,,Now that baby has experienced different tastes and textures- GERBER Stage 3 Wheat Biscuit Baby Cereal (227 g) is perfect for little ones 8 months and older. With the smell- taste and texture of biscuit- feel good knowing every serving contains calcium- iron- and other essential nutrients that support baby's normal growth and development and probiotics to support a healthy gut flora. Since our cereals already contain milk- all you have to do is add water for quick- super convenient- and wholesome goodness. Made with no added sugar or salt**- and with no preservatives- artificial colours or flavours. Pair with a GERBER Veggie and Fruit Purée for extra nutrition. Introduce new flavours and textures to baby as they grow with the next stage of GERBER cereals! Also available in Oat Banana Mango- Multigrain Yogurt Apple Pear Banana- Multigrain Yogurt Raspberry and Multigrain Yogurt Blueberry. GERBER Stage 3 Wheat Biscuit Baby Cereal (227 g) is an excellent source of essential nutrients. With 100% of baby's daily recommended amount of iron which contributes to normal cognitive development; .Added probiotic B. lactis* contributes to baby's healthy gut flora. Different textures and flavours help expand baby's taste buds; ;No added salt** or sugar- and no preservatives- artificial colours or flavours.*1 billion B. lactis per 28 g **All cereal-based foods for babies under 12 months should not contain salt[newline]Product Number: 20358339010_EA,https://assets.shop.loblaws.ca/products/20358339010/b1/en/front/20358339010_front_a01_@2.png,https://www.loblaws.ca/stage-3-wheat-biscuit-baby-cereal/p/20358339010_EA
Baby,Contour Change Pad Cover and Portable Changing Pad (Waterproof) Bundle,1653,$39.99,,This soft changing pad cover is designed to fit 3 inch pads and is fully elasticized for a perfect fit. Your precious baby will simply love the soft and soothing comfort of Kushies' linens. Hospitals have been swaddling babies in cotton flannel for decades because of the soft smooth feel on baby's skin. That's why Kushies uses premium 100% breathable cotton flannel for your baby. All linens are generously sized and allow for shrinkage. These sheets are available in a variety of mix and match- trendy prints and solids including black & white to match any nursery! Ethically made in Canada. Other sizes available.[newline]Kushies best-selling Portable Changing Pad Liners are mommy faves! Used on top of the changing pad or on any surface that needs protection. Great for on-the-go- this multi-use changing pad liner fits perfectly in the diaper bag. The generous size allows for extra coverage to fully protect your baby- especially in public places where you need it the most.Our flat changing pad liners are 100% premium quality cotton for protectionagainst babys skin with a waterproof bottom and a bias trim for added durability. These liners are a great addition to any diaper bag as they are extremely light- and compact.Our larger than most waterproof changing pad liners measure 20 x 30. This size allows extra coverage to protect your baby while in use- as well as the ability to use it for a variety of other functions.Our Portable Changing Pads come in a variety of colours and patterns. We offer 100% Cotton Flannel- Terry- Organic Jersey & Bamboo to fit everyones needs.[newline]Product Number: SP23332,https://assets.sellers.loblaw.ca/products/all/1042/23332_1.jpg?size=274,https://www.loblaws.ca/contour-change-pad-cover-and-portable-changing-pad/p/SP23332
Baby,Deep Conditioner - 33oz,1578,$63.99,,Our Deep Conditioner is infused with Hawaiian kukui seed oil to help repair hair- leaving it silky and smooth. Apply onto ends for optimal moisture and movement- leave on hair for at least five minutes. For a deeper treatment- try wrapping hair in a warm towel or shower cap for 15 minutes to help the ingredients penetrate deeper before rinsing.[newline][newline]Features[newline]Gentle pH of 4.5 - 5.5[newline]For children and adults[newline]Key ingredients: rosemary and calendula[newline]For all hair types and textures[newline]Rich in moisture and protein[newline]Organic extracts leave hair soft- smooth and silky without weighing it down[newline]No soy- gluten- honey- peanut or dairy[newline]Vegan[newline]Product Number: SP23805,https://assets.sellers.loblaw.ca/products/all/1075/23805_0817669244_1.jpg?size=274,https://www.loblaws.ca/deep-conditioner-33oz/p/SP23805
Baby,Diapers- Size 1- 108 Count,1503,$26.99,,Product Number: 21280017_EA,https://assets.shop.loblaws.ca/products/21280017/b1/en/front/21280017_front_a01_@2.png,https://www.loblaws.ca/diapers-size-1-108-count/p/21280017_EA
Baby,Pamper Unscented,1728,$27.99,,A trusted clean- Pampers Baby Wipes clean and wipe away germs and are fragrance-free for delicate skin. These hardworking wipes are 4x stronger* for tough messes. Hypoallergenic- Pampers Unscented Wipes are alcohol-free- fragrance-free- paraben-free- and latex-free.**[newline]From Pampers- the #1 pediatrician recommended brand. For healthy skin- use Pampers Wipes together with Pampers Baby-Dry diapers.[newline]*Vs. leading U.S. sub-brand[newline]**Natural rubber[newline]Product Number: 21284750_EA,https://assets.shop.loblaws.ca/products/21284750/b1/en/front/21284750_front_a01_@2.png,https://www.loblaws.ca/pamper-unscented/p/21284750_EA
Baby,Baby Soothing Relief Moisture Cream,1654,$7.49,,- Hypoallergenic - Steroid-free.[newline][newline]AVEENO BABY SOOTHING RELIEF MOISTURE CREAM is clinically proven to moisturize and provide relief for extra dry- chapped or cracked skin for 24 hours. This exclusive soothing cream contains natural colloidal oatmeal[newline]Product Number: 20922622_EA,https://assets.shop.loblaws.ca/products/20922622/b1/en/front/20922622_front_a01_@2.png,https://www.loblaws.ca/baby-soothing-relief-moisture-cream/p/20922622_EA
Baby,Organic Rice Rusks- Blueberry Apple Beet- Baby Snacks,1729,$4.99,,Has your little one started teething? GERBER Organic Rice Rusks- Blueberry Apple Beet- Baby Snacks (24 Rusks- 50 g) are perfect for this stage. They dissolve easily- are easy to grasp and hold- all while soothing those teething gums. Each rice rusk is made with real fruits and veggies. They are gluten-free with no artificial colours or flavours- and contain no added salt*. Plus- they come as 12 individually wrapped 2-packs- making them perfect for when you and baby are on-the-go. Our recipes are lovingly made with carefully selected- 100% wholesome ingredients before being quality tested to ensure they’re good enough to be called GERBER. Try both yummy flavours of GERBER Organic Rice Rusks: Mango Banana Carrot- and Blueberry Apple Beet. Appropriate for babies 7 months and up. ; ;; ;•A perfect first snack for baby – our Rice Rusks dissolve easily (they are melt-in-your-mouth good)- are easy to hold- and soothes teething gums; ;•Made with carefully selected- 100% wholesome ingredients like real fruits and veggies; ;•GERBER Organic Rice Rusks contain no artificial colours or flavours- no added salt*- and are gluten-free; ;•GERBER Organic Rice Rusks- Baby Snacks are non-GMO**; ;•Conveniently wrapped in individual 2-packs- making them perfect for when you and baby are on-the-go; ;•*All cereal-based foods for babies under 12 months should not contain added salt.**Not made with genetically engineered ingredients- like all organic products.[newline]Product Number: 21181650_EA,https://assets.shop.loblaws.ca/products/21181650/b1/en/front/21181650_front_a01_@2.png,https://www.loblaws.ca/organic-rice-rusks-blueberry-apple-beet-baby-snack/p/21181650_EA
Baby,Swaddlers Newborn Diapers Size 0,1504,$13.99,,Made for your growing baby- new Pampers Swaddlers is our softest diaper EVER with outstanding absorbency! New ultra-soft absorbent layers soothe and protect your baby’s skin. Specially designed with your baby’s skin in mind- Pampers Swaddlers exclusive BreatheFree Liner wicks wetness away from skin so baby’s skin stays drier and healthier*. Dual Leak-Guard Barriers along the leg cuff help protect where leaks happen most. And- our Pampers Wetness Indicator shows when your baby’s wet.[newline]Pampers Swaddlers are free of parabens and latex** and are clinically proven hypoallergenic for protection that’s gentle on your baby’s delicate skin. Plus- our new prints feature hand-drawn animals that illustrate all of the love and sweetness between baby and parent.[newline]For trusted protection- trust Pampers- the #1 Pediatrician Recommended Brand.[newline]*Vs. leading value brand[newline]**Natural rubber[newline]Product Number: 21377759_EA,https://assets.shop.loblaws.ca/products/21377759/b1/en/front/21377759_front_a01_@2.png,https://www.loblaws.ca/swaddlers-newborn-diapers-size-0/p/21377759_EA
Baby,Soapsox Harper The Hippo,1655,$22.50,,A soft and cuddly animal friend makes bath time fun and helps get little ones clean- too![newline]Harper the Hippo loves playing around in the mud- but his favorite thing to do is splash around with friends when it's time to get clean![newline]Product Number: SP152833,https://assets.sellers.loblaw.ca/products/all/1074/152833_4715441567_3.jpg?size=274,https://www.loblaws.ca/soapsox-harper-the-hippo/p/SP152833
Baby,Click Lock Weighted Flexi-Straw Cup- 7oz,1580,$8.49,,Click Lock 7oz Weighted Flexi-Straw Cup - 1pk[newline]Product Number: 20874632_EA,https://assets.shop.loblaws.ca/products/20874632/b1/en/front/20874632_front_a01_@2.png,https://www.loblaws.ca/click-lock-weighted-flexi-straw-cup-7oz/p/20874632_EA
Baby,Cruisers Diapers Size 5 108 Count,1505,$29.99,$32.75,Long-lasting fit and protection for the most active babies! Pampers Cruisers have 2x stretchier sides* for a comfy- secure fit that stays put- even when they don’t. With Dual Leak-Guard Barriers that gently seal around the legs and bottom to stop leaks where they happen most. Pampers Wetness Indicator lets you know when your baby might need a change. Cruisers come in a variety of stylish prints- all with trusted Pampers All Night Protection. Plus- Pampers Cruisers are hypoallergenic and free of parabens and latex-** so they’re gentle on your baby’s skin. Pampers Cruisers diapers are available in sizes 3- 4- 5- 6- and 7.[newline]*Vs. The leading moving baby sub-brand[newline]**Natural rubber[newline]Product Number: 21371365_EA,https://assets.shop.loblaws.ca/products/21371365/b1/en/front/21371365_front_a01_@2.png,https://www.loblaws.ca/cruisers-diapers-size-5-108-count/p/21371365_EA
Baby,South Shore DreamIt 4 Piece Baby Bedding Floral in White and Pink,1730,$298.38,,A World for a Princess[newline]Create a majestic bedroom for your little girl- and make up the bed of her dreams! Which side does your little miss like for sleeping: her swan friend and his beautiful gold crown- or a bed strewn with delicate bouquets of flowers? She has lots of time to change her mind! You and your daughter will like this superb bed cover- with a different design on either side - both a match to the bed skirt- the fitted sheet- and the pillow. This comforter- featuring a white background and just enough pink for an elegant feminine touch- is a beautiful piece your little girl will love all through her early years.[newline][newline]A 4-piece Set for a Baby Girl[newline]Get your princess whatever’s needed to ensure sweet dreams: a fitted sheet and a bed skirt for her crib- a nice soft pillow- and of course the cozy reversible comforter. The elegant princely swan and the watercolor style floral pattern will work just as well in both a crib and a transition bed.[newline][newline]Easy Care[newline]We’ve made life easier for mom and dad: Get rid of minor stains by cleaning the bed cover in the washer- set to the cold water cycle. The comforter can then be tumble dried quickly- at a low temperature- so you have more time for cuddles with baby![newline][newline]30-day limited guarantee[newline]South Shore is proud to stand behind this 4-piece baby bedding: bed skirt- sheet and pillow watercolor floral with an exclusive 30-day limited guarantee. Shop with confidence knowing your purchase is always covered. All our products meets or exceeds North American safety standards and our packaging are tested and certified to reduce the risk of damage during shipment. This item it shipped in 1 box. This product is made in China for South Shore with 100% polyester. Bed and accessories not included.[newline][newline]Features :[newline]Finish: White and Pink[newline]Material: Fabric[newline]REVERSIBLE DESIGN: Does your little miss have a change of mood from time to time? You can switch easily from the princess theme - with the large swan and his brilliant gold crown - to the calm- soothing ambiance of the floral side![newline]A COMPLETE SET: Get this fitted sheet and floral print pillow- the starry bed skirt- and the reversible bed cover- to keep your little girl warm and cozy in a bed where everything’s a perfect match.[newline]EASY TO CLEAN: The comforter can be machine washed with similar colors and no bleach- then you pop it in the dryer at a low temperature. It’s that easy![newline]30-DAY LIMITED GUARANTEE: South Shore is proud to stand behind this 4-piece baby bedding: bed skirt- sheet and pillow watercolor floral with an exclusive 30-day limited guarantee. Shop with confidence knowing your purchase is always covered.[newline][newline]Specifications :[newline]Product Dimensions : 1.00" H x 48.00" W x 38.00" D[newline]Product Weight : 2.75 lbs[newline]Product Number: SP138700,https://assets.sellers.loblaw.ca/products/all/1133/138700_1.jpg?size=274,https://www.loblaws.ca/south-shore-dreamit-4-piece-baby-bedding-floral-in/p/SP138700
Baby,Diaper Rash Cream,1656,$4.99,,Product Number: 21115148_EA,https://assets.shop.loblaws.ca/products/21115148/b1/en/front/21115148_front_a01_@2.png,https://www.loblaws.ca/diaper-rash-cream/p/21115148_EA
Baby,Easy Ups Training Underwear Boys Size 5 3T-4T 100 Count,1581,$37.99,,Pampers Easy Ups are an easy way to underwear! Pampers Easy Ups Training Underwear have a 360 Degree stretchy waistband that moves with your toddler- giving him a fit that's just like real underwear. The elastic waistband helps him to pull up his Easy Ups with ease- like a big boy. They also tear easily at the side seams for easy removal- just in case! Easy Ups are super soft- like cotton underwear- to keep him comfortable- while the Dual Leak Guard Barriers will keep him confident-helping prevent the leaks that can happen when he moves. Plus- Pampers Easy Ups are the only training pants with Extra Absorb Channels to give him the outstanding Pampers Leak Protection he needs during the day AND night. A collection of Thomas the Tank Engine designs will help make potty training fun! Pampers Easy Ups: he'll think it's underwear. You'll know it's Pampers.[newline]Product Number: 21089297_EA,https://assets.shop.loblaws.ca/products/21089297/b1/en/front/21089297_front_a01_@2.png,https://www.loblaws.ca/easy-ups-training-underwear-boys-size-5-3t-4t-100/p/21089297_EA
Baby,B.BOX SPORTS SPOUT BOTTLE INDIGO ROSE 450ml,1506,$29.99,,Perfect for active kids on the go- the sports spout bottle - blue slate offers no-fuss easy flow drinking in our unique ergonomic triangle bottle.[newline][newline]Its silicone spout requires no compression- and features a slight valve to prevent spills. Large push button and flip top lid makes it easy for kids to open and drink from.[newline][newline]Parents love how the flip top lid keeps the mouthpiece clean and leak-pROOMf when closed. Flexible handle lets kids carry it to class or training easily- plus bumper (removable) to protect against life’s knocks.[newline][newline]Made from Tritan™- the bottle is lightweight and extra durable. 450ml/15oz capacity. Minimal parts make it easy to clean. Dishwasher safe (top rack only).[newline]Product Number: SP195870,https://assets.sellers.loblaw.ca/products/all/1245/195870_1.jpg?size=274,https://www.loblaws.ca/b-box-sports-spout-bottle-indigo-rose-450ml/p/SP195870
Baby,Costway Baby Sit-to-Stand Learning Walker Toddler Activity Musical Toy w/ LED Light Pink,1731,$131.99,,This sit-to-stand baby learning walker is the best helper for babies learning walking in early development.[newline][newline]Abandon the traditional walker that may conducive to the bow-legged walking- this professional baby walker combines learning walking with fantasy music strawberry-shaped panel- more attractive for babies in early development. And the ergonomic design including adjustable height and freely-weighting water tank makes it suitable for babies in various heights or various growth phases. The detachable play panel with various instruments- shape sorter with lights fully exercises baby's hand-eye coordination- suitable for ten-month old baby.[newline]Feature[newline]Push and pull walker- apply balanced force to both feet[newline][newline]Stable triangle structure with large size rear wheel and rollover prevention[newline][newline]Freely-weighting water tank up to 2.2lbs- catering to babies in various growth phases[newline][newline]TPR rear wheel with backward braking system- safe assurance[newline][newline]Detachable strawberry-shaped panel- playing in bed or outside[newline][newline]Sit-to-stand panel- various instruments- shape sorter with lights and so on[newline][newline]Made of ABS- fully tested with ASTM[newline][newline]Exercise baby's hand-eye coordination &broaden horizon[newline][newline]Suitable for ten-month old baby[newline]specification[newline]Color: shown in the picture[newline][newline]Overall Dimension: 17'' x14'' x18''/21''(LxWxH)[newline][newline]Net weight: 4.5 lbs[newline][newline]Suitable age: Over 10 months[newline][newline]Package includes:[newline][newline]1xHandle[newline][newline]1xBody[newline][newline]1xGame Panel[newline][newline]1xWater Tank[newline]Product Number: SP65111,https://assets.sellers.loblaw.ca/products/all/1012/65111_1.jpg?size=274,https://www.loblaws.ca/costway-baby-sit-to-stand-learning-walker-toddler/p/SP65111
Baby,Dwinguler Big Town Playmat - Large,1657,$298.99,,Dwinguler Playmats create a large and cushioned space for your little one to safely play- learn and toddle on without bumps or bruises. Whether it’s learning to sit- crawl or walk- these supportive playmats work to keep your child protect as they grow and learn new skills. The slightly textured surface is soft and slip resistant. When not in use- simply roll these playmats up for easy storage. Each Dwinguler Playmat is reversible- featuring a unique and interactive design on each side.[newline]• Made from eco-friendly and baby friendly materials. Free from any toxic materials - Latex Free- Phthalate Free- Lead Free- BPA Free.[newline]• Waterproof and easy to clean by wiping with soapy water.[newline]• Has sound proofing qualities.[newline]• Tested and complies with North American and European safety standards.[newline]• Large Dwinguler Playmats are compatible with Dwinguler Castle Playpens.[newline]• This Dwinguler Playmat features a town with roads design on the front with an alphabet on the reverse.[newline]Product Number: SP15487,https://assets.sellers.loblaw.ca/products/all/1043/15487_1.jpg?size=274,https://www.loblaws.ca/dwinguler-big-town-playmat-large/p/SP15487
Baby,Crib Sheet Bassinet Sheet and Contour Change Pad Cover Cotton Flannel Bundle,1582,$62.99,,This soft crib sheet is a nursery must have. Our crib sheet measures 28" x 52" and fits standard cribs. It's fully elasticized to ensure a perfect fit.[newline]This soft changing pad cover is designed to fit 3 inch pads and is fully elasticized for a perfect fit.[newline]Your precious baby will simply love the soft and soothing comfort of Kushies' linens. Hospitals have been swaddling babies in cotton flannel for decades because of the soft smooth feel on baby's skin. That's why Kushies uses premium 100% breathable cotton flannel for your baby. All linens are generously sized and allow for shrinkage. These sheets are available in a variety of mix and match- trendy prints and solids including black & white to match any nursery! Ethically made in Canada.[newline]Our soft cotton flannel bassinet sheets are a nursery must-have! Our bassinet sheet measures 30 L x 18 x 2 D and is fully elasticized. It fits many oval and some rectangular pads for your bassinet at home and add some flair for your stroller bassinet when you are on the go!Your baby will simply love the soft and soothing comfort of Kushies' linens. Hospitals have been swaddling babies in cotton flannel for decades because of the soft smooth feel on baby's skin. That's why Kushies uses premium 100% breathable cotton flannel for your baby.Soft and breathable 100% pure cotton: Babies love our bassinet sheets as they are made of the same soft and breathable fabric hospitals use to swaddle newly born babies. It's the first fabric they feel when born. We don't blend our fabrics with polyesters or other synthetic materials so your baby sleeps on pure cotton. Machine wash and dry.All linens are generously sized and allow for shrinkage. These sheets are available in a variety of mix and match- trendy prints and solids including black & white to match any nursery!ADAPTABLE ELASTIC: Our exceptional and top selling bassinet sheet is fully elasticized enabling a great fit on bassinet and cradle pads. The all-around elastic feature keeps the sheet in place for a snug- safe fit STYLISH: Our sheets are custom designed especially for you and are available in a variety of mix and match- trendy prints and solids including black & white to match any nursery!QUALITY: Our sheets are lovingly made in Canada by parents- for babies. We do not compromise on quality and continue to up our standards every year. Our factory passes the most rigid standards in the industry so you can rest easy.[newline]Product Number: SP23343,https://assets.sellers.loblaw.ca/products/all/1042/23343_1.jpg?size=274,https://www.loblaws.ca/crib-sheet-bassinet-sheet-and-contour-change-pad-c/p/SP23343
Baby,Yookidoo - Flow N Fill Spout - 3 Stackable Cups and Waterfall Spout,1732,$57.47,,Yookidoo - Flow N Fill Spout - 3 Stackable Cups and Waterfall Spout[newline]Product Number: SP67970,https://assets.sellers.loblaw.ca/products/all/1155/67970_1.jpg?size=274,https://www.loblaws.ca/yookidoo-flow-n-fill-spout-3-stackable-cups-and-wa/p/SP67970
Baby,Bennie The Bunny,1507,$44.99,,Bennie The Bunny is a plush that offers 8 soothing sounds to help calm and comfort children to sleep. Playing soft sounds of nature or the reassuring sound of a mother’s heartbeat- Bennie The Bunny is the perfect companion for a calm and restful night for both baby and parents![newline]Product Number: SP46872,https://assets.sellers.loblaw.ca/products/all/1124/46872_2833316994_2.jpg?size=274,https://www.loblaws.ca/bennie-the-bunny/p/SP46872
Baby,Classic Curl Calmer - 4oz,1583,$20.50,,For babies & up- families love our Curl Calmer. Tight- medium- frizzy curls & waves relax- leaving hair glossy and silky soft. Poofy- dry tresses soak up soothing moisture leaving locks stronger & softer. Helps strengthen & protect against breakage with jojoba protein. Never crunchy or sticky. Relax & enjoy clean feeling- silky frizz free gorgeous locks.[newline][newline]Professional Performance[newline]Extra Moisturizing for Dry or Delicate Hair[newline]Helps Fortify Against Breakage[newline]For Babies- Children & Adults[newline][newline]Worry-Free[newline]Lice & Insects don’t like Organic Rosemary but We Love It![newline]Free of Phytoestrogens Lavender & Tea Tree- Phthalates- Clove & Musk[newline]No Soy- Gluten- Honey- Peanut or Dairy[newline]No Nanoparticles or Titanium Dioxide[newline]100% Vegan[newline]Product Number: SP23822,https://assets.sellers.loblaw.ca/products/all/1075/23822_9071165413_1.jpg?size=274,https://www.loblaws.ca/classic-curl-calmer-4oz/p/SP23822
