Category,Product,Product ID,Price,Old Price,Description,Image URL,Product URL
Food,Bold ï¿½n Baked Sweet Chili,658,$3.49,,Delight your taste buds with the sweet and savoury kick of Bold 'n Baked Sweet Chili crackers.[newline]Light and crunchy- these delicious snack crackers are always baked- never fried and are made better with no artificial colours or flavours.[newline]Skip the dips and toss the toppings because- with this much bold flavour- you’ll think you found them in the chip aisle.[newline]Perfect for sharing or keeping all to yourself![newline]0g Trans Fat- Low in saturated fat- Made in Canada from domestic and imported ingredients- No Artificial Colours- No Artificial Flavours- No Cholesterol- Peanut-free- Source of Iron[newline]Product Number: 21217156_EA,https://assets.shop.loblaws.ca/products/21217156/b1/en/front/21217156_front_a01_@2.png,https://www.loblaws.ca/bold-n-baked-sweet-chili/p/21217156_EA
Food,Riso Bello Four Cheese Risotto,884,$5.49,,Product Number: 21205791_EA,https://assets.shop.loblaws.ca/products/21205791/b1/en/front/21205791_front_a01_@2.png,https://www.loblaws.ca/riso-bello-four-cheese-risotto/p/21205791_EA
Food,Creamy Havarti Cheese With Herb And Spice,714,$7.99,,Havarti- the well-known Danish cheese- is named after Havarthigaard- the farm in Denmark where it was first created. You’ll love its creamy texture and buttery flavour with a hint of sweetness. Ideal for snacking- entertaining or cooking with- it's a good source of calcium. Always keep some on hand as no cheese plate is complete without it.[newline]Product Number: 20770654_EA,https://assets.shop.loblaws.ca/products/20770654/b1/en/front/20770654_front_a01_@2.png,https://www.loblaws.ca/creamy-havarti-cheese-with-herb-and-spice/p/20770654_EA
Food,Snack Marble Cheddar,789,$5.79,,Product Number: 21290676_EA,https://assets.shop.loblaws.ca/products/21290676/b1/en/front/21290676_front_a01_@2.png,https://www.loblaws.ca/snack-marble-cheddar/p/21290676_EA
Food,Light Tomato Condensed Soup,659,$2.59,,Product Number: 20980079_EA,https://assets.shop.loblaws.ca/products/20980079/b1/en/front/20980079_front_a01_@2.png,https://www.loblaws.ca/light-tomato-condensed-soup/p/20980079_EA
Food,Bradbury Saxon Cross Smoked Cheddar,885,$7.99,,Cheddar is a firm- smooth cheese that becomes crumbly with age. In general- mild cheddar is aged 2 – 4 months- medium 4 – 8 months- old 9 – 12 months- and extra old 1 – 7 years. Cheddar is a versatile cheese that melts really well. Try yours in grilled cheese sandwiches- macaroni and cheese- or simply slice and add to your next cheese platter.[newline]Product Number: 20816781_EA,https://assets.shop.loblaws.ca/products/20816781/b1/en/front/20816781_front_a01_@2.png,https://www.loblaws.ca/bradbury-saxon-cross-smoked-cheddar/p/20816781_EA
Food,Chicken Sacchettini,715,$8.99,$9.49,Fresh egg pasta stuffed with tender chicken- savoury bacon and mild white cheddar cheese[newline][newline]Est. 1957[newline]This item is only available for pickup after 12PM.[newline]Product Number: 20003058_EA,https://assets.shop.loblaws.ca/products/20003058/b1/en/front/20003058_front_a01_@2.png,https://www.loblaws.ca/chicken-sacchettini/p/20003058_EA
Food,Pre-Cooked Yellow Corn Meal,790,$2.99,,P.A.N. pre-cooked corn meal is a unique product made out of pure corn. It is gluten-free and does not contain any preservatives- artificial colors or flavorings as it is the result of a chemical free production process. Just by adding water- P.A.N. makes instant corn dough- creating a variety of delicious and easy corn based dishes that can be adapted to different tastes and customs.[newline][newline]Try other P.A.N. products:.[newline][newline]Pre-cooked White Corn Meal.[newline][newline]Sweet Corn Mix.[newline][newline]And enjoy delicious and unique recipes![newline]Product Number: 20945695_EA,https://assets.shop.loblaws.ca/products/20945695/b1/en/front/20945695_front_a01_@2.png,https://www.loblaws.ca/pre-cooked-yellow-corn-meal/p/20945695_EA
Food,Blueberry Soft Ripened Goat's Milk Cheese,660,$9.99,,You want to add something different to your cheeseboard. You want something slightly complex – but not fussy – and it’s got to look good. Our tangy goat’s cheese is made with wild blueberries and honey vanilla granules- to create an almost too attractive to eat outer layer. We think it’s best served simply with crackers- but... we should mention it’s also ridiculously tasty on bison or lamb burgers.[newline]Product Number: 20419289_EA,https://assets.shop.loblaws.ca/products/20419289/b1/en/front/20419289_front_a01_@2.png,https://www.loblaws.ca/blueberry-soft-ripened-goat-s-milk-cheese/p/20419289_EA
Food,Peanut Butter Swirl,886,$6.99,,Product Number: 21087003_EA,https://assets.shop.loblaws.ca/products/21087003/b1/en/front/21087003_front_a01_@2.png,https://www.loblaws.ca/peanut-butter-swirl/p/21087003_EA
Food,Apple Slices,716,$4.99,,Product Number: 21020466_EA,https://assets.shop.loblaws.ca/products/21020466/b1/en/front/21020466_front_a01_@2.png,https://www.loblaws.ca/apple-slices/p/21020466_EA
Food,Squash- Kale & Beet Flatbread,791,$4.49,,Consider this a supremely good twist on your usual ‘za. Think untraditional. And vegetable-y. And cheesy. First- the crust: it’s a light and airy flatbread. We spread it with sour cream sauce. Next- that cheese – it’s a blend of three: buttery Edam- creamy goat’s milk soft unripened cheese- and tangy-sharp sheep’s milk Pecorino Romano. It’s all topped with those sweet butternut squash- beet sauce and chopped kale. It bakes up crisp and golden in the oven – or on the grill – in minutes. And to think you were going to order in.[newline]Product Number: 21103674_EA,https://assets.shop.loblaws.ca/products/21103674/b1/en/front/21103674_front_a01_@2.png,https://www.loblaws.ca/squash-kale-beet-flatbread/p/21103674_EA
Food,Bakery Soft and Fluffy Pre-Sliced Thin Buns Brioche Buns 6 Buns,661,$4.39,,Product Number: 21154251_EA,https://assets.shop.loblaws.ca/products/21154251/b1/en/front/21154251_front_a01_@2.png,https://www.loblaws.ca/bakery-soft-and-fluffy-pre-sliced-thin-buns-brioch/p/21154251_EA
Food,Easy Cook! In Sauce Lemon & Thyme Butter Atlantic Salmon,887,$11.99,,We covered juicy Atlantic salmon fillets in a zesty lemon & thyme butter sauce- then wrapped them in bags that go directly in the oven – a culinary method known as en papillote. This traps any moisture released while cooking- resulting in perfectly steamed salmon that is tender- flaky and infused with sauce. Plate each serving in its bag- then slowly peel open at the table to release the aromatic steam. What a pro.[newline]Product Number: 21314302_EA,https://assets.shop.loblaws.ca/products/21314302/b1/en/front/21314302_front_a01_@2.png,https://www.loblaws.ca/easy-cook-in-sauce-lemon-thyme-butter-atlantic-sal/p/21314302_EA
Food,Knorr Sidekicks Noodles Side Dish for a great flavour Honey Garlic low-fat and trans-free 162 g,792,$1.49,,A deliciously seasoned noodle side dish that is quick and easy to prepare[newline]This side dish allows you to enrich your cuisine with the extraordinary taste of our oriental-inspired noodles[newline]These honey garlic noodles side dish contains[newline]Product Number: 20321430023_EA,https://assets.shop.loblaws.ca/products/20321430023/b1/en/front/20321430023_front_a01_@2.png,https://www.loblaws.ca/knorr-sidekicks-noodles-side-dish-for-a-great-flav/p/20321430023_EA
Food,Sprinkle Decors,662,$5.49,,Product Number: 21011735_EA,https://assets.shop.loblaws.ca/products/21011735/b1/en/front/21011735_front_a01_@2.png,https://www.loblaws.ca/sprinkle-decors/p/21011735_EA
Food,Holiday Advent Calendar,888,$11.99,,A Reese's candy Advent calendar is a delicious and festive way to enjoy the countdown to Christmas this holiday season.[newline]Contains one 222g Reese's candy Advent calendar.[newline]Reese's candy Advent calendar is a delicious way to countdown to Christmas. A perfect gift for friends or family this holiday season.[newline]Find and open a new window each day in December leading up to Christmas to discover a delicious Reese's candy. Each Advent calendar contains: 24 wrapped Reese's Peanut Butter Cups miniatures candy and one Reese's Clusters candy.[newline]Fun festive graphics made the Advent calendar perfect to display with your holiday décor.[newline]The back side of the Advent calendar packaging includes a fun 'maze' activity to enjoy.[newline]Product Number: 21106951_EA,https://assets.shop.loblaws.ca/products/21106951/b1/en/front/21106951_front_a01_@2.png,https://www.loblaws.ca/holiday-advent-calendar/p/21106951_EA
Food,Anise Seeds,793,$2.79,,Product Number: 20876053_EA,https://assets.shop.loblaws.ca/products/20876053/b1/en/front/20876053_front_a01_@2.png,https://www.loblaws.ca/anise-seeds/p/20876053_EA
Food,Mixed Nuts Deluxe Salted,663,$3.99,$6.99,Product Number: 21190796_EA,https://assets.shop.loblaws.ca/products/21190796/b1/en/front/21190796_front_a01_@2.png,https://www.loblaws.ca/mixed-nuts-deluxe-salted/p/21190796_EA
Food,Rolls 6 Pack,889,$3.59,,In Store Baked White Panini Rolls Pkg. of 6[newline]Product Number: 20012219_EA,https://assets.shop.loblaws.ca/products/20012219/b1/en/front/20012219_front_a01_@2.png,https://www.loblaws.ca/rolls-6-pack/p/20012219_EA
Food,Lemon Curd Cake- 5in,794,$5.99,,Product Number: 21116000_EA,https://assets.shop.loblaws.ca/products/21116000/b1/en/front/21116000_front_a01_@2.png,https://www.loblaws.ca/lemon-curd-cake-5in/p/21116000_EA
Food,Caesar Salad Dressing,664,$8.99,,Renee’s Dressings are proudly made with the finest- and freshest ingredients- delivering on exceptional taste and quality. Renee’s is made with no artificial flavours- or colours- and is found and kept in the refrigerated section. Perfect for that fresh salad- dipping for vegetables- or even marinating.[newline]Made with no artificial flavours or colours[newline]Great flavour and creamy texture[newline]Great for salads and dipping[newline]Prepared in Canada[newline]Product Number: 20556299_EA,https://assets.shop.loblaws.ca/products/20556299/b1/en/front/20556299_front_a01_@2.png,https://www.loblaws.ca/caesar-salad-dressing/p/20556299_EA
Food,Egg Noodles- Fine,890,$2.49,$2.69,Long- fine noodles- great to use in soups or stir-fries.[newline]Product Number: 20275738001_EA,https://assets.shop.loblaws.ca/products/20275738001/b1/en/front/20275738001_front_a01_@2.png,https://www.loblaws.ca/egg-noodles-fine/p/20275738001_EA
Food,Panko- Japanese-Style Bread Crumbs,795,$3.49,,Fry PC Black Label Panko Bread Crumbs with melted butter and garlic; toss with grated Parmesan cheese and chopped parsley- and use to sprinkle on pasta and gnocchi dishes. Use PC Black Label Panko Bread Crumbs in place of cubed bread in stuffing. Dip turkey cutlets in cream and Dijon mustard mixture- then into PC Black Label Panko Bread Crumbs; fry until crisp and serve with lemon wedges. Coat peeled jumbo shrimp (keep the tails on as handles) in egg wash- then roll in PC Black Label Panko Bread Crumbs tossed with sesame seeds; bake or fry until crispy and golden. Serve with wasabi mayonnaise for dipping.[newline]Product Number: 20582708_EA,https://assets.shop.loblaws.ca/products/20582708/b1/en/front/20582708_front_a01_@2.png,https://www.loblaws.ca/panko-japanese-style-bread-crumbs/p/20582708_EA
Food,Pizza Mozzarella Cheese- 28% MF,665,$8.99,,A semi-soft ivory coloured cheese with a milky- little salty flavor and slightly acidulous. It has a moisture-rich- rindless body with a supple- soft- elastic- springy texture.[newline]Product Number: 20975887_EA,https://assets.shop.loblaws.ca/products/20975887/b1/en/front/20975887_front_a01_@2.png,https://www.loblaws.ca/pizza-mozzarella-cheese-28-mf/p/20975887_EA
Food,Dill Weed,891,$7.99,,More delicate in taste than dill seed- these fragrant feather-like leaves add mild yet distinctive flavour to lighter dishes- including dips and salads. Add to chicken and fish dishes- chowder and broth-based soups.[newline]Product Number: 21117325_EA,https://assets.shop.loblaws.ca/products/21117325/b1/en/front/21117325_front_a01_@2.png,https://www.loblaws.ca/dill-weed/p/21117325_EA
Food,Baby Bok Choy Jr,796,$3.95,,Baby (or Shanghai) bok choy is a cruciferous vegetable with crunchy greenish-white stalks topped with dark green leaves- both of which are edible. Baby bok choy is slightly sweeter than full-sized bok choy and can be used fresh in salads or cooked in soups and stir-fries.[newline]Product Number: 20099639001_KG,https://assets.shop.loblaws.ca/products/20099639001/b1/en/front/20099639001_front_a01_@2.png,https://www.loblaws.ca/baby-bok-choy-jr/p/20099639001_KG
Food,Tanger Grapefruit,666,$3.99,,Crystal Light Tangerine Grapefruit Pitcher Packs are a delicious- low-calorie powdered drink mix perfect for sharing. Each pouch of Crystal Light Tangerine Grapefruit makes 1.5L in seconds. Just pour the contents of one sachet into 1.5L of water and mix! Crystal Light Tangerine Grapefruit is made with natural flavours and has only 30 calories per pouch- so you can feel good serving it to your family or guests. Free from gluten- caffeine and sugar.[newline]Delicious- low-calorie flavoured drink[newline]Only 5 calories per pack[newline]Each pouch makes 15L[newline]Zero grams of fat per serving[newline]Convenient- individual packs; just empty contents into a pitcher- stir well and enjoy[newline]Product Number: 20320208_EA,https://assets.shop.loblaws.ca/products/20320208/b1/en/front/20320208_front_a01_@2.png,https://www.loblaws.ca/tanger-grapefruit/p/20320208_EA
Food,Wafers Chocolate Belgian,892,$1.49,,Product Number: 21089563_EA,https://assets.shop.loblaws.ca/products/21089563/b1/en/front/21089563_front_a01_@2.png,https://www.loblaws.ca/wafers-chocolate-belgian/p/21089563_EA
Food,Bagels Original,797,$4.89,,Product Number: 20563427_EA,https://assets.shop.loblaws.ca/products/20563427/b1/en/front/20563427_front_a01_@2.png,https://www.loblaws.ca/bagels-original/p/20563427_EA
Food,Pulled Chicken Pablano Empanada,667,$1.99,,This item is only available for pickup after 12PM.[newline]Product Number: 20925166_EA,https://assets.shop.loblaws.ca/products/20925166/b1/en/front/20925166_front_a01_@2.png,https://www.loblaws.ca/pulled-chicken-pablano-empanada/p/20925166_EA
Food,Purple Kernel Popping Corn,893,$4.29,,It’s airy- it’s fluffy… and it’s less likely to leave kernels stuck in your teeth. And that colour! It’s all naturally occurring due to anthocyanins. Purple corn originated in the Peruvian Andes – and now this unique taste is coming home. Stash some away for movie night. Spoiler: you’re going to love it.[newline]Product Number: 21291250_EA,https://assets.shop.loblaws.ca/products/21291250/b1/en/front/21291250_front_a01_@2.png,https://www.loblaws.ca/purple-kernel-popping-corn/p/21291250_EA
Food,Bar Marble Cheddar Light,798,$7.99,,Product Number: 21290422_EA,https://assets.shop.loblaws.ca/products/21290422/b1/en/front/21290422_front_a01_@2.png,https://www.loblaws.ca/bar-marble-cheddar-light/p/21290422_EA
Food,Fruit Blend Natural,668,$12.49,,Product Number: 21378036_EA,https://assets.shop.loblaws.ca/products/21378036/b1/en/front/21378036_front_a01_@2.png,https://www.loblaws.ca/fruit-blend-natural/p/21378036_EA
Food,Gum- Tropical Beats,894,$4.49,,Product Number: 21107691_EA,https://assets.shop.loblaws.ca/products/21107691/b1/en/front/21107691_front_a01_@2.png,https://www.loblaws.ca/gum-tropical-beats/p/21107691_EA
Food,Shreds Double Ched,799,$6.99,,Product Number: 21290613_EA,https://assets.shop.loblaws.ca/products/21290613/b1/en/front/21290613_front_a01_@2.png,https://www.loblaws.ca/shreds-double-ched/p/21290613_EA
Food,Red Chili Peppers- Lal Mirch,669,$1.59,,Product Number: 20755942_EA,https://assets.shop.loblaws.ca/products/20755942/b1/en/front/20755942_front_a01_@2.png,https://www.loblaws.ca/red-chili-peppers-lal-mirch/p/20755942_EA
Food,9 Piece Cut Fried Chicken with 1 Large Side,895,$16.00,,9 Cut Fried Chicken- choose from Spicy or Original- with your choice of 1 Large Side. Please specify your options at the item level comment upon check out- we will pick the default items if not specified.[newline]Side options: Homestyle Coleslaw- Onion Rings- French Fries- Potato Wedges- Scallop Potatoes- Macaroni&Cheese- Mixed Vegetables.[newline]Default side: Potato Wedges[newline]This item is only available for pickup after 12PM.[newline]Product Number: 21086324_EA,https://assets.shop.loblaws.ca/products/21086324/b1/en/front/21086324_front_a01_@2.png,https://www.loblaws.ca/9-piece-cut-fried-chicken-with-1-large-side/p/21086324_EA
Food,Bowl Noodles- Savory Chicken,800,$1.49,,Product Number: 20306702001_EA,https://assets.shop.loblaws.ca/products/20306702001/b1/en/front/20306702001_front_a01_@2.png,https://www.loblaws.ca/bowl-noodles-savory-chicken/p/20306702001_EA
Food,Okazu Curry Miso,670,$15.99,,Product Number: 21332796_EA,https://assets.shop.loblaws.ca/products/21332796/b1/en/front/21332796_front_a01_@2.png,https://www.loblaws.ca/okazu-curry-miso/p/21332796_EA
Food,6 Large Tortillas- Tomato Salsa,896,$3.49,,Casa Mendosa's tripled baked tortillas bring the authentic taste of Mexico to the table. Made with no artificial colours & flavours- versatile and delicious- our tomato salsa tortillas are perfect for wraps- appetizers- breakfast burritos and so much more![newline]Product Number: 20981522_EA,https://assets.shop.loblaws.ca/products/20981522/b1/en/front/20981522_front_a01_@2.png,https://www.loblaws.ca/6-large-tortillas-tomato-salsa/p/20981522_EA
Food,Grape Tomatoes,801,$4.99,,Bite-size and bursting with sweet flavour- these juicy organic grape tomatoes are great for snacking and everyday dishes. Toss in fresh salads and pasta dishes- use them to make fresh salsa or skewer for meat or veggie kebabs. They?re also delicious roasted or saut?ed as a side.[newline]Product Number: 20799491001_EA,https://assets.shop.loblaws.ca/products/20799491001/b1/en/front/20799491001_front_a01_@2.png,https://www.loblaws.ca/grape-tomatoes/p/20799491001_EA
Food,Cod Fillets,671,$15.27,,Product Number: 20059002_KG,https://assets.shop.loblaws.ca/products/20059002/b1/en/front/20059002_front_a01_@2.png,https://www.loblaws.ca/cod-fillets/p/20059002_KG
Food,00Domie Chicken Flavor,897,$23.99,,Product Number: 21197754_C40,https://assets.shop.loblaws.ca/products/21197754/b1/en/front/21197754_front_a01_@2.png,https://www.loblaws.ca/00domie-chicken-flavor/p/21197754_C40
Food,Dried Apricots,802,$4.49,,Tender- naturally sweet dried apricots in a handy resealable pack – perfect for snacking![newline]Product Number: 20742433_EA,https://assets.shop.loblaws.ca/products/20742433/b1/en/front/20742433_front_a01_@2.png,https://www.loblaws.ca/dried-apricots/p/20742433_EA
Food,Rice Pudding Tubs,672,$3.99,,Made with simple ingredients. At Kozy Shack- we believe that simple ingredients make for better-tasting pudding and desserts. That is why our 45-year-old recipes use the same quality ingredients that you would use in your own kitchen.. SIMPLE INGREDIENTS. . DELICIOUS PUDDING.[newline]Product Number: 20323829001_EA,https://assets.shop.loblaws.ca/products/20323829001/b1/en/front/20323829001_front_a01_@2.png,https://www.loblaws.ca/rice-pudding-tubs/p/20323829001_EA
Food,Baking Cups- Pink & Blue,898,$3.49,,Product Number: 20795479002_EA,https://assets.shop.loblaws.ca/products/20795479002/b1/en/front/20795479002_front_a01_@2.png,https://www.loblaws.ca/baking-cups-pink-blue/p/20795479002_EA
Food,100% Whole Wheat Bagels,803,$4.09,,Product Number: 21016376_EA,https://assets.shop.loblaws.ca/products/21016376/b1/en/front/21016376_front_a01_@2.png,https://www.loblaws.ca/100-whole-wheat-bagels/p/21016376_EA
Food,Pasta Salad Mediterranean Style,673,$3.49,,Product Number: 21107082_EA,https://assets.shop.loblaws.ca/products/21107082/b1/en/front/21107082_front_a01_@2.png,https://www.loblaws.ca/pasta-salad-mediterranean-style/p/21107082_EA
Food,Club Pack Fully Cooked Buttermilk Chicken Breast Fillets,899,$24.99,,Made with buttermilk- garlic powder and a blend of spices- these perfectly seasoned breaded chicken breast fillets are fully cooked and ready to heat until golden and crisp. They’re delicious served with accompanying creamy buttermilk ranch sauce for dipping.[newline]Product Number: 21163504_EA,https://assets.shop.loblaws.ca/products/21163504/b1/en/front/21163504_front_a01_@2.png,https://www.loblaws.ca/club-pack-fully-cooked-buttermilk-chicken-breast-f/p/21163504_EA
Food,Mama Yolanda's Mini Ricotta and Spinach Lasagna,804,$14.99,,Product Number: 21202794_EA,https://assets.shop.loblaws.ca/products/21202794/b1/en/front/21202794_front_a01_@2.png,https://www.loblaws.ca/mama-yolanda-s-mini-ricotta-and-spinach-lasagna/p/21202794_EA
Food,Lethbridge Pork Tenderloins,674,$11.25,,Product Number: 20964429_KG,https://assets.shop.loblaws.ca/products/20964429/b1/en/front/20964429_front_a01_@2.png,https://www.loblaws.ca/lethbridge-pork-tenderloins/p/20964429_KG
Food,Crispbread- Multigrain,900,$2.99,,A round crisp bread baked with 100% wholegrain and a blend of rye- wheat- oat and barley. [newline]Product Number: 20070817_EA,https://assets.shop.loblaws.ca/products/20070817/b1/en/front/20070817_front_a01_@2.png,https://www.loblaws.ca/crispbread-multigrain/p/20070817_EA
Food,Sociables Crackers,805,$2.99,,RITZ is loved by Canadians and can be shared amongst family and friends. RITZ SOCIABLES snacking crackers are ideal for pairing with a variety of toppings like cheese- meat- dips or spreads. Enjoy this delicious snack at home- in the office or as easy party appetizers. A taste of welcome.[newline]One 200 g box of CHRISTIE RITZ SOCIABLES crackers[newline]This classic cracker is great for pairing with a variety of toppings like cheese- meat- dips or spreads[newline]Oven baked- not fried[newline]Perfect for entertaining[newline]A taste of welcome[newline]Product Number: 21362199_EA,https://assets.shop.loblaws.ca/products/21362199/b1/en/front/21362199_front_a01_@2.png,https://www.loblaws.ca/sociables-crackers/p/21362199_EA
Food,Yogurt- Vanilla,675,$3.99,,nanö Drinkable Yogurt is made especially for kids with 40% less sugar and is also made with real fruit- no preservatives- no gelatin- artificial flavours- artificial colours and made in Canada![newline]Product Number: 20903653_EA,https://assets.shop.loblaws.ca/products/20903653/b1/en/front/20903653_front_a01_@2.png,https://www.loblaws.ca/yogurt-vanilla/p/20903653_EA
Food,Peppermint Extract,806,$1.99,,Loretta.[newline][newline]Est. 1956[newline]Product Number: 21011105_EA,https://assets.shop.loblaws.ca/products/21011105/b1/en/front/21011105_front_a01_@2.png,https://www.loblaws.ca/peppermint-extract/p/21011105_EA
Food,Extra Lean Cooked Ham (Thin Sliced),807,$2.79,,Ham is the thick cut of meat from a pig's hind leg. It's commonly cured and sometimes smoked for flavour before being sold fresh- partially cooked- or cooked. As a deli meat- ham makes for a classic sandwich filling. Enjoy sliced ham on a croissant with your favourite cheese.[newline]Product Number: 20313480_KG,https://assets.shop.loblaws.ca/products/20313480/b1/en/front/20313480_front_a01_@2.png,https://www.loblaws.ca/extra-lean-cooked-ham-thin-sliced/p/20313480_KG
Food,Mussels,717,$6.99,,Could not find desc,https://assets.shop.loblaws.ca/products/20992437/b1/en/front/20992437_front_a01_@2.png,https://www.loblaws.ca/mussels/p/20992437_EA
Food,Maca Matcha Superfood Bag,718,$8.99,,Product Number: 21358142_EA,https://assets.shop.loblaws.ca/products/21358142/b1/en/front/21358142_front_a01_@2.png,https://www.loblaws.ca/maca-matcha-superfood-bag/p/21358142_EA
Food,KitKat Chunky Milk Chocolate Wafer Bar,719,$0.88,$1.00,BIG cravings deserve BIG flavour- and NESTLÉ KITKAT CHUNKY Milk Chocolate Wafer Bar (49 g) grew even BIGGER to meet those KITKAT cravings. Now 20% chunkier*- enjoy an impressive hit of our signature crispy wafer enrobed in a thick milk chocolate coating. It’s the same irresistible and classic KITKAT taste you know and love that’ll take care of even the biggest chocolate desires. Made with 100% sustainably-sourced cocoa- all-natural flavours- and no artificial colours- this is the ultimate KITKAT treat. HAVE A BREAK HAVE A KITKAT.*Compared to our 40 g bar[newline]Crispy wafer covered in a thick milk chocolate[newline]Prepared in Canada & made with only natural flavours & no artificial colours[newline]100% Sustainably Sourced Cocoa certified by UTZ- as part of the NESTLÉ COCOA PLAN[newline]NESTLÉ Canada has raised more than $10.2 million in support of KIDS HELP PHONE over the last 28 years[newline]HAVE A BREAK HAVE A KITKAT[newline]Product Number: 21237351_EA,https://assets.shop.loblaws.ca/products/21237351/b1/en/front/21237351_front_a01_@2.png,https://www.loblaws.ca/kitkat-chunky-milk-chocolate-wafer-bar/p/21237351_EA
Food,Grk Ex Crm Vanilla 5%,720,$5.99,,Product Number: 21353463_EA,https://assets.shop.loblaws.ca/products/21353463/b1/en/front/21353463_front_a01_@2.png,https://www.loblaws.ca/grk-ex-crm-vanilla-5/p/21353463_EA
Food,Long Grain Parboiled Rice,721,$13.99,,Rice which has been partially boiled in the husk to retain more minerals and vitamins than regular white rice.[newline]Product Number: 20106122_EA,https://assets.shop.loblaws.ca/products/20106122/b1/en/front/20106122_front_a01_@2.png,https://www.loblaws.ca/long-grain-parboiled-rice/p/20106122_EA
Food,Tres Pimientos Hot Sauce,722,$3.99,,Made with three Varieties of Chili Peppers- Agave Syrup and Tamarind Extract[newline]Product Number: 21371675_EA,https://assets.shop.loblaws.ca/products/21371675/b1/en/front/21371675_front_a01_@2.png,https://www.loblaws.ca/tres-pimientos-hot-sauce/p/21371675_EA
Food,2% Milk,723,$3.29,,Vitamins A and D added.[newline]Product Number: 20325707002_EA,https://assets.shop.loblaws.ca/products/20325707002/b1/en/front/20325707002_front_a01_@2.png,https://www.loblaws.ca/2-milk/p/20325707002_EA
