Category,Product,Product ID,Price,Old Price,Description,Image URL,Product URL
Baby,Bowls For Ages 6+ Months,1126,$5.49,,· ASSORTED COLOURS AND FUN DESIGNS[newline]Product Number: 20555143_EA,https://assets.shop.loblaws.ca/products/20555143/b1/en/front/20555143_front_a01_@2.png,https://www.loblaws.ca/bowls-for-ages-6-months/p/20555143_EA
Food,Cantaloupe Slices,901,$4.49,,Product Number: 21219915_EA,https://assets.shop.loblaws.ca/products/21219915/b1/en/front/21219915_front_a01_@2.png,https://www.loblaws.ca/cantaloupe-slices/p/21219915_EA
Food,Chocolate Hazelnut Spread,976,$2.99,,Made with roasted hazelnuts- the goodness of skim milk and premium cocoa.[newline]Product Number: 20792384_EA,https://assets.shop.loblaws.ca/products/20792384/b1/en/front/20792384_front_a01_@2.png,https://www.loblaws.ca/chocolate-hazelnut-spread/p/20792384_EA
Baby,Minnie Mouse Toddler Girls 3pk Training Pants 2T Pack of 6,1051,$139.75,,Toddler Girls Minnie Mouse Potty Training Pants is a wonderul way to potty train your little one! The waist and leg bindings are self fabric for a comfy fit. Made of 100% combed cotton and tagless for extra comfort. These padded training pants provide coverage for minor accidents. Help your child make the transition to underwear.Minnie underwear and training pants combo pack. Combo contains 4 underwear and 3 training pants. Unique prints per pair- 100 percent cotton.[newline]Product Number: SP148117,https://assets.sellers.loblaw.ca/products/all/1127/148117_1.jpg?size=274,https://www.loblaws.ca/minnie-mouse-toddler-girls-3pk-training-pants-2t-p/p/SP148117
Food,Chocolate Fudge 8inch Cake,902,$25.99,,Product Number: 20943733_EA,https://assets.shop.loblaws.ca/products/20943733/b1/en/front/20943733_front_a01_@2.png,https://www.loblaws.ca/chocolate-fudge-8inch-cake/p/20943733_EA
Baby,B.BOX SPOUT CUP LEMON 240ml,1127,$17.99,,Is bub ready to move on from the bottle? The spout cup is the perfect starting base. The cup features an ergonomically angled silicone spout that’s ultra gentle on baby’s gum and comfortable to drink from. Easy-grip handles fits baby’s hand perfectly for easy drinking. The cup also features an in-built spout cover which not only keeps the mouthpiece clean- it means you’ll never lose the lid (think no more lost lids in the supermarket- or random loose lids in the drawer!) Interchangeable base and lid means you can switch between the spout- sippy cup and training lids as baby grows.[newline]Product Number: SP195875,https://assets.sellers.loblaw.ca/products/all/1245/195875_1.jpg?size=274,https://www.loblaws.ca/b-box-spout-cup-lemon-240ml/p/SP195875
Food,Onebun Sandwich Bun- Flax,977,$4.39,,Thin sandwich bun made with whole and ground flax seeds.[newline]Product Number: 20336956_EA,https://assets.shop.loblaws.ca/products/20336956/b1/en/front/20336956_front_a01_@2.png,https://www.loblaws.ca/onebun-sandwich-bun-flax/p/20336956_EA
Baby,Baby Care Good Dinosaur Playmat - Small,1052,$124.99,,Baby Care Playmats create a cushioned space for your little one to safely play- learn and toddle on without bumps or bruises. Whether it’s learning to sit- crawl or walk- these supportive playmats work to keep your child protect as they grow and learn new skills. Their slightly textured surface is soft and slip resistant. When not in use- simply roll these playmats up for easy storage. Each Baby Care Playmat is reversible- featuring a unique design on each side. With numerous designs to choose from- you’re sure to find the perfect playmat for your home![newline]• Made of nontoxic materials and free of latex- BPA- lead- formaldehyde and EVA.[newline]• Waterproof and easy to clean by wiping with soapy water.[newline]• This Baby Care Playmat features a dinosaur pattern on the front with a modern pastel alphabet on the reverse.[newline]Product Number: SP15463,https://assets.sellers.loblaw.ca/products/all/1043/15463_1.jpg?size=274,https://www.loblaws.ca/baby-care-good-dinosaur-playmat-small/p/SP15463
Food,Creme Filled Ginger Sandwich Cookies,903,$2.99,,Creamy vanilla filling sandwiched between two delightfully gingery cookies – a deliciously indulgent treat.[newline]Product Number: 21314854_EA,https://assets.shop.loblaws.ca/products/21314854/b1/en/front/21314854_front_a01_@2.png,https://www.loblaws.ca/creme-filled-ginger-sandwich-cookies/p/21314854_EA
Baby,Light Blue & White Sherpa Stroller Blanket,1128,$54.99,,You can wrap your little one up nicely in this spacious blanket- cool in color yet ultrasoft and warm in pure cotton knit fabric.30'' x 36''. 100% cotton.Machine wash; tumble dry[newline]Product Number: SP21711,https://assets.sellers.loblaw.ca/products/all/1049/21711_8713560228_1.jpg?size=274,https://www.loblaws.ca/light-blue-white-sherpa-stroller-blanket/p/SP21711
Food,Original Crackers,978,$7.49,,Rich- flaky- salty- melt-in-your mouth crackers.[newline]Product Number: 20012532_EA,https://assets.shop.loblaws.ca/products/20012532/b1/en/front/20012532_front_a01_@2.png,https://www.loblaws.ca/original-crackers/p/20012532_EA
Baby,Infant Car Seat Cover,1053,$89.99,,This award winning infant car seat cover has made traveling in the winter with baby safer and easier.[newline][newline]It goes on like a 'shower cap' over the top of the infant car seat - no extra bulk/padding has been added behind the baby. This car seat cover does not interfere with the harness system.[newline][newline]Check out our how-to -use video:[newline]https://www.youtube.com/watch?v=rtx5YA7TeZ4[newline][newline]reflective tape:it gets dark earlier in the colder months- more visibility means more safety[newline]safe design:the cover goes over entire seat and does not interfere with the harness system[newline]buckle me label:a friendly reminder to those of us who are sleep deprived[newline]fit:will work on all approved Canadian infant car seats[newline]duo zippers:create a wide opening for easier access to your baby[newline]face flap:designed to fall away from your baby's face[newline]generous size:to accommodate a growing baby[newline]cars heat up pretty fast:simple unzip to prevent overheating[newline]moveable face hole:baby will always be able to see out of the cover[newline]triple layered fabric:wind and water resistant microfibre outer layer- Powderfill™ thermal interlining and an antipill sub-ice micro fleece interior[newline]care:machine wash cold and dry on low heat or air dry[newline]customers reported: using our parkas in -40 c/f windchill- not that we recommend going out in that temperature[newline]proudly made in Canada:where we know a thing or two about winter[newline]Do not leave child unattended with product.[newline]Consult with a Car Passenger Seat Technician (CPST)to learn how to install your baby's car seat correctly.[newline]Product Number: SP177530,https://assets.sellers.loblaw.ca/products/all/1278/177530_3318299949_9.jpg?size=274,https://www.loblaws.ca/infant-car-seat-cover/p/SP177530
Food,Dill Weed,904,$8.99,,Product Number: 21379280_EA,https://assets.shop.loblaws.ca/products/21379280/b1/en/front/21379280_front_a01_@2.png,https://www.loblaws.ca/dill-weed/p/21379280_EA
Baby,Lawn & Stem & Twig Countertop Drying Rack Bundle,1129,$60.84,,Dry it all! Boon brings three of their most popular drying accessories together in one bundle! The Boon lawn drying rack's flexible grass blades hold all of your just-washed baby accessories. (And whatever else you want.) Plus it's like having a Fairway next to your kitchen sink. (Minus the Gophers) need more room? Branch out with Boon twig and stem drying accessories. Planting twig in the middle of your lawn lets you hang up small- just-washed parts while you free space below for drying bigger items. For added beauty and even more drying space on lawn- try a little flower power with Boon stem![newline]Product Number: SP52343,https://assets.sellers.loblaw.ca/products/all/1069/52343_1.jpg?size=274,https://www.loblaws.ca/lawn-stem-twig-countertop-drying-rack-bundle/p/SP52343
Food,Real Fruit Beverage Peach,979,$2.49,,Product Number: 21108439_EA,https://assets.shop.loblaws.ca/products/21108439/b1/en/front/21108439_front_a01_@2.png,https://www.loblaws.ca/real-fruit-beverage-peach/p/21108439_EA
Baby,B.Box Bowl & Straw New Edition Boysenberry,1054,$19.99,,This colourful bowl and straw make it easier and more fun for little ones to drink/eat soup- cereal and much more. Simply clip the straw onto the side of the bowl so kids can slurp up their milk and cereal. You may have noticed the unique tear drop shape? That’s so kids can drink straight from the bowl. And when it’s snack time on-the-go- just pop in the snack insert to stop little mishaps. When little tummies are full- just clip on the easy storage lid and pack it away.[newline]Product Number: SP195832,https://assets.sellers.loblaw.ca/products/all/1245/195832_1.jpg?size=274,https://www.loblaws.ca/b-box-bowl-straw-new-edition-boysenberry/p/SP195832
Food,Sunflower Oil,905,$5.39,,Product Number: 20018186_EA,https://assets.shop.loblaws.ca/products/20018186/b1/en/front/20018186_front_a01_@2.png,https://www.loblaws.ca/sunflower-oil/p/20018186_EA
Baby,Grey 6 Piece Hooded Towel and Washcloth set " Noah Ark",1130,$23.00,,Baby will love the cozy comfort and playful style of this illustrated hooded towel with a collection of washcloths in soft cotton ensuring quick clean-up.[newline]Product Number: SP21310,https://assets.sellers.loblaw.ca/products/all/1049/21310_4821146609_1.jpg?size=274,https://www.loblaws.ca/grey-6-piece-hooded-towel-and-washcloth-set-noah-a/p/SP21310
Baby,Contour Change Pad Cover and Portable Changing Pad (Waterproof) Bundle,1055,$39.99,,This soft changing pad cover is designed to fit 3 inch pads and is fully elasticized for a perfect fit. Your precious baby will simply love the soft and soothing comfort of Kushies' linens. Hospitals have been swaddling babies in cotton flannel for decades because of the soft smooth feel on baby's skin. That's why Kushies uses premium 100% breathable cotton flannel for your baby. All linens are generously sized and allow for shrinkage. These sheets are available in a variety of mix and match- trendy prints and solids including black & white to match any nursery! Ethically made in Canada. Other sizes available.[newline]Kushies best-selling Portable Changing Pad Liners are mommy faves! Used on top of the changing pad or on any surface that needs protection. Great for on-the-go- this multi-use changing pad liner fits perfectly in the diaper bag. The generous size allows for extra coverage to fully protect your baby- especially in public places where you need it the most.Our flat changing pad liners are 100% premium quality cotton for protectionagainst babys skin with a waterproof bottom and a bias trim for added durability. These liners are a great addition to any diaper bag as they are extremely light- and compact.Our larger than most waterproof changing pad liners measure 20 x 30. This size allows extra coverage to protect your baby while in use- as well as the ability to use it for a variety of other functions.Our Portable Changing Pads come in a variety of colours and patterns. We offer 100% Cotton Flannel- Terry- Organic Jersey & Bamboo to fit everyones needs.[newline]Product Number: SP23331,https://assets.sellers.loblaw.ca/products/all/1042/23331_1.jpg?size=274,https://www.loblaws.ca/contour-change-pad-cover-and-portable-changing-pad/p/SP23331
Food,Hot Cross Buns,980,$4.39,,Product Number: 20638117_EA,https://assets.shop.loblaws.ca/products/20638117/b1/en/front/20638117_front_a01_@2.png,https://www.loblaws.ca/hot-cross-buns/p/20638117_EA
Food,Rich Hot Chocolate,906,$15.99,,Product Number: 21123226_EA,https://assets.shop.loblaws.ca/products/21123226/b1/en/front/21123226_front_a01_@2.png,https://www.loblaws.ca/rich-hot-chocolate/p/21123226_EA
Food,Sanuki-Style Udon,981,$3.99,,Product Number: 20570578_EA,https://assets.shop.loblaws.ca/products/20570578/b1/en/front/20570578_front_a01_@2.png,https://www.loblaws.ca/sanuki-style-udon/p/20570578_EA
Baby,Great Northern Hot Water Bottle,1131,$26.00,,Take this hot water bottle holder with you on your next adventure in the great outdoors.[newline]Product Number: SP30833,https://assets.sellers.loblaw.ca/products/all/1077/30833_1.jpg?size=274,https://www.loblaws.ca/great-northern-hot-water-bottle/p/SP30833
Baby,Portable Changing Pad (Waterproof) Organic Jersey Print 2 Pack,1056,$44.99,,Our best-selling Organic Jersey Portable Changing Pad Liners are mommy faves![newline]Used on top of the changing pad or on any surface that needs protection. Great for on-the-go- this multi-use changing pad liner fits perfectly in the diaper bag. The generous size allows for extra coverage to fully protect your baby- especially in public places where you need it the most.[newline]Our larger than most waterproof changing pad liners measure 20 x 30. This size allows extra coverage to protect your baby while in use- as well as the ability to use it for a variety of other functions.[newline]Our flat changing pad liners are 100% premium quality organic jersey for protection against babys skin with a waterproof bottom and a bias trim for added durability. These liners are a great addition to any diaper bag as they are extremely light- and compact.[newline]Our Portable Changing Pads come in a variety of colours and patterns. We offer 100% Cotton Flannel- Terry- Organic Jersey & Bamboo to fit everyones needs.[newline]Product Number: SP23312,https://assets.sellers.loblaw.ca/products/all/1042/23312_1.jpg?size=274,https://www.loblaws.ca/portable-changing-pad-waterproof-organic-jersey-pr/p/SP23312
Food,Bold 'n Spicy Deli Mustard,982,$2.49,,A spicy flavoured mustard with a thick texture that makes it ideal to use on deli-style sandwiches.[newline]Product Number: 20318504002_EA,https://assets.shop.loblaws.ca/products/20318504002/b1/en/front/20318504002_front_a01_@2.png,https://www.loblaws.ca/bold-n-spicy-deli-mustard/p/20318504002_EA
Food,Greenergy Smoothie,907,$5.99,,NO SUGAR ADDED*.[newline][newline]*Natural fruit and vegetable sugars.[newline][newline]ONE 250 ML SERVING EQUALS 2 FRUIT & VEGETABLE SERVINGS**!.[newline][newline]**As per Canada's Food Guide.[newline][newline]Feel so good!.[newline][newline]Our promise to be pure:.[newline][newline]- Vitamins B?- B?- B?- are factors in energy metabolism and tissue formation.[newline][newline]- No sugar added*.[newline][newline]- Ready to serve.[newline][newline]Health Signature.[newline][newline]oasis.ca[newline][newline]Be pure..[newline][newline]OASIS- a proudly Canadian brand- is pleased to offer you this product..[newline][newline]DISCOVER.[newline][newline]oasis.ca[newline]Product Number: 20859964_EA,https://assets.shop.loblaws.ca/products/20859964/b1/en/front/20859964_front_a01_@2.png,https://www.loblaws.ca/greenergy-smoothie/p/20859964_EA
Baby,Little Swimmers Disposable Swim Diapers- Swimpants- Size 5-6 Large (over 32 lb.)- 17 Ct.,1057,$15.99,,HUGGIES Little Swimmers are the #1 best-selling disposable swimpants* and are specially designed for water use. These disposable diapers for swimming are made with a material that doesn’t swell up in water- plus they have easy-open side tabs so you can adjust the fit or make fast changes when needed. Soft- stretchy sides make these swim diapers more comfortable for baby- and leak guards help to eliminate messy accidents. Use them in the backyard- at the pool or on the beach for worry-free water fun. Little Swimmers swimming diapers are available in Size 3 (16-26 lb.)- Size 4 (24-34 lb.) and Size 5-6 (over 32 lb.).*Based on national disposable swim pants category sales- Nielsen 2017; ;[newline]Little Swimmers Size 5-6 fits babies over 32 lb.[newline]The #1 best-selling disposable swimpants*[newline]Easy-open sides for an adjustable fit[newline]Designed for water use and won’t swell in water[newline]Two Disney-Pixar Finding Nemo designs in each pack[newline]Product Number: 20570040_EA,https://assets.shop.loblaws.ca/products/20570040/b1/en/front/20570040_front_a01_@2.png,https://www.loblaws.ca/little-swimmers-disposable-swim-diapers-swimpants/p/20570040_EA
Baby,Infant Car Seat Cover,1134,$89.99,,This award winning infant car seat cover has made traveling in the winter with baby safer and easier.[newline][newline]It goes on like a 'shower cap' over the top of the infant car seat - no extra bulk/padding has been added behind the baby. This car seat cover does not interfere with the harness system.[newline][newline]Check out our how-to -use video:[newline]https://www.youtube.com/watch?v=rtx5YA7TeZ4[newline][newline]reflective tape: it gets dark earlier in the colder months- more visibility means more safety[newline]safe design: the cover goes over entire seat and does not interfere with the harness system[newline]buckle me label: a friendly reminder to those of us who are sleep deprived[newline]fit: will work on all approved Canadian infant car seats[newline]duo zippers: create a wide opening for easier access to your baby[newline]face flap: designed to fall away from your baby's face[newline]generous size: to accommodate a growing baby[newline]cars heat up pretty fast: simple unzip to prevent overheating[newline]moveable face hole: baby will always be able to see out of the cover[newline]triple layered fabric: wind and water resistant microfibre outer layer- Powderfill™ thermal interlining and an antipill sub-ice micro fleece interior[newline]care: machine wash cold and dry on low heat or air dry[newline]customers reported: using our parkas in -40 c/f windchill- not that we recommend going out in that temperature[newline]proudly made in Canada: where we know a thing or two about winter[newline]Do not leave child unattended with product.[newline]Consult with a Car Passenger Seat Technician (CPST)to learn how to install your baby's car seat correctly.[newline]Product Number: SP177529,https://assets.sellers.loblaw.ca/products/all/1278/177529_6844027365_9.jpg?size=274,https://www.loblaws.ca/infant-car-seat-cover/p/SP177529
Food,Pulled Roasted Beef Jalapeno Empanada,908,$1.99,,This item is only available for pickup after 12PM.[newline]Product Number: 20925165_EA,https://assets.shop.loblaws.ca/products/20925165/b1/en/front/20925165_front_a01_@2.png,https://www.loblaws.ca/pulled-roasted-beef-jalapeno-empanada/p/20925165_EA
Food,Vanilla Bean Ice Cream,983,$5.99,,Indulge in the irresistible taste of HAAGEN-DAZS Vanilla Bean Ice Cream (500 ml). Since 1960- our passion has taken us on a journey to transform only the finest ingredients into a simply extraordinary ice cream experience.  Madagascar vanilla is blended with pure- sweet cream to create this unique twist on a classic flavour- with flecks of real vanilla beans in every bite. Made with 100% Canadian dairy- this sweet delight is perfection.[newline]Madagascar vanilla blended with pure- sweet cream and flecks of real vanilla beans.[newline]Our ice cream is made with 100% Canadian dairy.[newline]Each tub is finished with a quality seal to guarantee freshness.[newline]HAAGEN-DAZS has been perfecting premium ice cream since[newline]1960.[newline]Elevate your dessert by pairing it with HAAGEN-DAZS Vanilla Bean ice cream.[newline]Product Number: 20323566_EA,https://assets.shop.loblaws.ca/products/20323566/b1/en/front/20323566_front_a01_@2.png,https://www.loblaws.ca/vanilla-bean-ice-cream/p/20323566_EA
Baby,Umi - Ultrasonic Humidifier Air Purifier - Celcius,1058,$99.99,,The Umi is an ultrasonic humidifier and air purifier that optimizes the level of comfort in your child’s room. With its advanced technology and AST ™ sensors- it is ultra quiet- requires no filters and is energy efficient.[newline]Product Number: SP12624,https://assets.sellers.loblaw.ca/products/all/1028/12624_8022087957_4.jpg?size=274,https://www.loblaws.ca/umi-ultrasonic-humidifier-air-purifier-celcius/p/SP12624
Baby,Dreambabyï¿½ Dallas Fold Down Bed Rail,1135,$79.99,,When your child is ready to graduate on from their crib- it can be an exciting time for everyone involved. To help remove any stress or angst you or your child have about falling from the bed- use Dallas Fold Down Bed Rail from Dreambaby®. The Dallas Bed Rail is designed fit almost any bed- acting as a gentle barrier for even the most restless sleepers. It can be used with mattresses up to a queen size on flat- recessed- or slat beds. It’s simple to assemble and install- having your child ready for "big kid" bed in no time at all. Of utmost importance- it has safety anchors that securely hold the rail in place for reinforced peace of mind. Easy to uninstall and pack away in the included storage bag makes it ideal and convenient for travelling or sleepovers at grandma’s house. It has a simple fold down feature which makes it convenient when it’s time to make the bed or you are reading to your child at bed time. The bed rail has a fabric and mesh cover that is removable and machine washable- so it’s super simple to keep clean. The Dreambaby® Dallas Fold Down Bed Rail is extra wide and extra tall measuring 43.25" wide and 19.5" tall for extended safety.[newline][newline]SUITABLE FOR MOST BEDS: The Dreambaby® Dallas Fold Down Bed Rail fits up to a queen-size mattress and can be used on either slat- recessed- or flat bed bases making it perfect for almost any home or child. It cleverly has safety anchors to secure it in place.[newline]GREAT ON THE GO: Super simple to assemble and install- it’s an excellent option for families on the go. Its modular construction and included storage bag are ideal for travelling whether it’s a night at grandma’s or a week vacation in a hotel bed.[newline]CONVENIENT FOLD DOWN: It has a simple fold down feature makes it convenient when it’s time to make the bed or you are reading to your child at bed time.[newline]BREATHABLE MESH COVER: The bed rail has a fabric and mesh cover that is removable and machine washable- so it’s super simple to keep clean.[newline]EXTRA WIDE AND EXTRA TALL DESIGN: The Dreambaby® Dallas Bed Rail measures 43.25" wide and 19.5" tall. Suitable for children 18 months and older.[newline][newline][newline]Product Number: SP135265,https://assets.sellers.loblaw.ca/products/all/1218/135265_8030874762_1.jpg?size=274,https://www.loblaws.ca/dreambaby-dallas-fold-down-bed-rail/p/SP135265
Food,Break Berry Pomegranate Antioxidant Juice,909,$5.99,,When life gets busy- stop and refuel with Oasis Health Break Berry Pomegranate Antioxidant Juice- an exceptional fruit juice blend that fits your active lifestyle. This nutrient-enriched berry pomegranate juice is packed full of phytonutrients- with no added sugar or artificial flavours. High in vitamin C- this antioxidant juice blend is an easy way to add health benefits to your routine. For every moment of joy- refresh with Oasis Health Break.[newline][newline][newline]Keep refrigerated and consume within 10 days. Shake well before opening.[newline][newline][newline]A blend of fruit juices[newline]Contains antioxidant properties[newline]No added sugar or sweeteners[newline]Excellent source of vitamin C[newline]No artificial flavours or colours[newline]Recyclable container[newline]Prepared in Canada[newline]Product Number: 20320745003_EA,https://assets.shop.loblaws.ca/products/20320745003/b1/en/front/20320745003_front_a01_@2.png,https://www.loblaws.ca/break-berry-pomegranate-antioxidant-juice/p/20320745003_EA
Food,Bowl Noodle- Kimchi,984,$1.49,,Product Number: 20087422001_EA,https://assets.shop.loblaws.ca/products/20087422001/b1/en/front/20087422001_front_a01_@2.png,https://www.loblaws.ca/bowl-noodle-kimchi/p/20087422001_EA
Baby,Mini Sparkle Pack,1059,$23.50,,Aquabeads is the original water-activated bead craft product. Made from the highest quality materials- Aquabeads are fun and safe for the entire family. With the Mini Sparkle Pack you can create 6 sparkling designs - bunny- crown- flowers- tree- cake and a bow - the possibilities are endless! Creating Aquabeads is easy - it's as simple as make- spray and they stay![newline]Product Number: SP136042,https://assets.sellers.loblaw.ca/products/all/1069/136042_1.jpg?size=274,https://www.loblaws.ca/mini-sparkle-pack/p/SP136042
Baby,Regatta Great Outdoors Kids Maui 2 Season Sleeping Bag (Oxford Blue/Palm Tree),1136,$28.70,,2 Season rectangular sleeping bag. 100% Polyester.[newline]Product Number: SP220492,https://assets.sellers.loblaw.ca/products/all/1291/220492_1.jpg?size=274,https://www.loblaws.ca/regatta-great-outdoors-kids-maui-2-season-sleeping/p/SP220492
Baby,Baby Ointment Everyday,1060,$6.99,,Product Number: 21313433_EA,https://assets.shop.loblaws.ca/products/21313433/b1/en/front/21313433_front_a01_@2.png,https://www.loblaws.ca/baby-ointment-everyday/p/21313433_EA
Food,Light Rye Crispbread,910,$2.99,$3.79,Whole grains and fibre .[newline][newline]Wasa Crispbread's whole grain crunch is a satisfying foundation for healthy snacking. Top it with a slice of cheese- fresh vegetables- even peanut butter for a satisfying snack.[newline][newline]Wasa.[newline][newline]Baked Since 1919[newline]Product Number: 20138816001_EA,https://assets.shop.loblaws.ca/products/20138816001/b1/en/front/20138816001_front_a01_@2.png,https://www.loblaws.ca/light-rye-crispbread/p/20138816001_EA
Baby,Pop-Up Teddy Shower Buddy,1137,$35.59,,POP UP TEDDY SHOWER BUDDY - E0202[newline]Product Number: SP18997,https://assets.sellers.loblaw.ca/products/all/1069/18997_1.jpg?size=274,https://www.loblaws.ca/pop-up-teddy-shower-buddy/p/SP18997
