Category,Product,Product ID,Price,Old Price,Description,Image URL,Product URL
Baby,Expression 1X Fit,1692,$4.49,,Meet the one wipe for everything and everyone. Expressions Multi-Use Wipes by Pampers can be used on body- face- messes- surfaces- and more. Expressions Wipes are gentle enough for faces- yet durable enough to take on tough messes. Free of alcohol- parabens- and latex-* our Botanical Rain Scent wipes bring a fresh- dewy- botanical scent as you clean. And for less waste- our unique pop-top helps keep wipes fresh- and only dispenses one wipe at a time- so you only get what you need.[newline]*Natural rubber[newline]Product Number: 21247270_EA,https://assets.shop.loblaws.ca/products/21247270/b1/en/front/21247270_front_a01_@2.png,https://www.loblaws.ca/expression-1x-fit/p/21247270_EA
Baby,CosyCare Infant Blanket with Maple Moose Teether,1561,$58.00,,Buffalo check Blanket: This baby blanket by CosyCare is handmade in Canada- and made only with 100% premium cotton. With a gorgeous checkered print- this blanket is perfect for your little one to cuddle up in. Extremely versatile- this blanket is the perfect addition to any stroller and bedroom. This natural maple wooden teething ring is an earth friendly and trendy alternative to plastic teething rings! Maple Wood Is a Natural Antiseptic It has 100% Cotton Fabric Moose Antlers shape for your baby or toddler to grip on to while they gnaw on the wooden ring and of course they can gnaw on the Fabric Antlers too![newline]Product Number: SP15810,https://assets.sellers.loblaw.ca/products/all/1017/15810_8417072964_1.jpg?size=274,https://www.loblaws.ca/cosycare-infant-blanket-with-maple-moose-teether/p/SP15810
Baby,Premium Diaper Bag,1617,$199.99,,The Hamilton diaper bag is designed for parents who want both style and functionality. It includes a functional organizer that can easily be attached to the stroller. Finished with brushed silver fittings and zippers.[newline]Product Number: SP70833,https://assets.sellers.loblaw.ca/products/all/1068/70833_9357453253_2.jpg?size=274,https://www.loblaws.ca/premium-diaper-bag/p/SP70833
Baby,Dream Buddies - Bennie The Grey Bunny,1785,$29.99,,Dreamz Buddies are compact- ultra-plush pals that help ease children’s fear of the dark by projecting a starry night sky into ceiling and walls. From green to blue to amber- the slowly morphing colors will mesmerize your little ones and lull them into deep sleep. These mini buddies are perfect calming companions that your tiny tots can tote with them wherever they go. With many characters to choose from- your little ones can collect them all![newline]Product Number: SP46882,https://assets.sellers.loblaw.ca/products/all/1124/46882_6218464435_2.jpg?size=274,https://www.loblaws.ca/dream-buddies-bennie-the-grey-bunny/p/SP46882
Baby,Baby Food - Chicken in Broth Purï¿½e,1693,$1.49,,Heinz by Nature Baby Food - Chicken in Broth Purée is packed with nutritious ingredients and delicious flavour. Heinz by Nature is baby food made easy- just like you would make it! We craft all of our recipes to provide your little one with silky smooth goodness- containing no added sugar or salt. Got a spoon? Then you’re ready to serve baby food that is as yummy as homemade. Let's welcome your child to the delicious world of food together. Our purées are delivered to you in glass jars that are recyclable or reusable. Our puree is made for babies 6 months plus.[newline]One jar of 128 ml Heinz by Nature Baby Food - Chicken in Broth Purée[newline]Baby food deliciously made with simple processes like wash- chop- heat and puree[newline]For infants 6+ months[newline]Baby food that is as delicious as homemade[newline]Recyclable jars[newline]No added sugar or salt[newline]Product Number: 21289603_EA,https://assets.shop.loblaws.ca/products/21289603/b1/en/front/21289603_front_a01_@2.png,https://www.loblaws.ca/baby-food-chicken-in-broth-pur-e/p/21289603_EA
Baby,Edison Non-Slip Stainless Single Handle Cup Lion (Blue),1618,$15.99,,Entrust your child's lunch to Edison stainless steel picnic lunch box set. This package includes 2 lunch containers with a shallower 2 compartment box and a deep stainless steel one compartment box. Guarantee leakage-free and worries-free for your child. INCLUDES: 2 Bento/Lunch Box Containers (2-Compartment & 1-Compartment Deep with Stainless Steel Inserts) in Fabric Pouch.[newline]SMART DESIGN: Secure Locking- Mix Prevention Travel Containers with Utensils / Experience the Innovative Design(s) focused on the Ease of Use- and Cleanliness.[newline]-BPA FREE / FOOD SAFE / MADE IN KOREA under strict Quality Control with accompanying safety certifications in South Korea & Europe[newline]-GUARANTEED QUALITY - Trusted Brand in South Korea with innovation and safety in mind since 2013[newline]Product Number: SP223434,https://assets.sellers.loblaw.ca/products/all/1245/223434_1.jpg?size=274,https://www.loblaws.ca/edison-non-slip-stainless-single-handle-cup-lion-b/p/SP223434
Baby,Cotton Swabs,1562,$3.99,,IDEAL FOR:. 1. Blending and applying. 2. Applying and softening. 3. Removing smudges. 4. Removing and touching up. 5. Applying cream and ointment to baby's delicate skin. President's Choice Cotton Swabs are made with 100% cotton.[newline]Product Number: 20887369_EA,https://assets.shop.loblaws.ca/products/20887369/b1/en/front/20887369_front_a01_@2.png,https://www.loblaws.ca/cotton-swabs/p/20887369_EA
Baby,Boogie Wipes- Fresh Scent,1786,$3.29,$4.29,Boogie Wipes Fresh Scent 30ct[newline]Product Number: 20753501_EA,https://assets.shop.loblaws.ca/products/20753501/b1/en/front/20753501_front_a01_@2.png,https://www.loblaws.ca/boogie-wipes-fresh-scent/p/20753501_EA
Baby,Oatmeal Cereal with Apple & Cinnamon,1694,$3.99,,Heinz Baby Cereals with Milk are an excellent source of calcium and provide a creamy- smooth texture and preferred flavour. Plus- they also provide an excellent source of iron and B vitamins to help your baby grow. Whats more- they are easy to digest. Simply add water. Heinz Baby Cereals are steam cooked and gently blended in a variety of delicious flavours- with added fruit and mixed grains to give your little one a happy and nutritious mealtime![newline]One 227gr Heinz Baby Cereal with Milk[newline]Excellent source of calcium[newline]With Milk to provide a creamy and smooth texture[newline]Simply add water[newline]Great to introduce solids to your baby[newline]Product Number: 20315666008_EA,https://assets.shop.loblaws.ca/products/20315666008/b1/en/front/20315666008_front_a01_@2.png,https://www.loblaws.ca/oatmeal-cereal-with-apple-cinnamon/p/20315666008_EA
Baby,Organic Baby Food - Mango- Apricot & Kale Purï¿½e,1619,$1.99,,Heinz by Nature Organic Baby Food - Mango- Apricot & Kale Purée is packed with nutritious ingredients and delicious flavour. We craft all of our recipes to provide your little one with silky smooth goodness. Our on-the-go and creamy puree pouch features a yummy combination of organic mangos- apricots and kale for your baby's growing appetite. Made with nourishing flavours and containing no added sugar or salt- babies will love the taste of Heinz Baby food. With Heinz by Nature- families can feel good knowing they are feeding their baby food that is as savoury as homemade. The pouch format allows parents to feed their babies while they are on-the-go. Our purée is made for babies 7 months plus.[newline]One pouch of 128 ml Heinz by Nature Organic Baby Food - Mango- Apricot & Kale Purée[newline]Organic baby food made with natural ingredients and acerola cherry[newline]Deliciously made with simple processes like wash- chop- heat and puree[newline]Made for life on-the-go[newline]No added sugar or salt and no artificial preservatives[newline]For infants 7+ months[newline]Product Number: 21289459_EA,https://assets.shop.loblaws.ca/products/21289459/b1/en/front/21289459_front_a01_@2.png,https://www.loblaws.ca/organic-baby-food-mango-apricot-kale-pur-e/p/21289459_EA
Baby,Portaplay Wonderland Adventures- Child Stools (Set of 2),1563,$49.99,,Make the conversion from our PortaPlay™ Wonderland Adventures Activity Center to a Play table even more exciting with matching stools for your little ones. Sturdy and lightweight- these stools are designed to be just the right height for children up to 5 years of age. Stools come as a pair.[newline]Weight Load : Holds up to 77 pounds.[newline]Care instructions: Wipe clean with a dry cloth. If necessary- wipe clean with cloth dampened in water and mild soap.[newline]Product Number: SP70060,https://assets.sellers.loblaw.ca/products/all/1068/70060_9717944511_1.jpg?size=274,https://www.loblaws.ca/portaplay-wonderland-adventures-child-stools-set-o/p/SP70060
Baby,100% Natural Baby Food - Organic Green Beans & Sweet Corn Purï¿½e,1695,$1.49,,Heinz by Nature 100% Natural Baby Food - Organic Green Beans & Sweet Corn Purée is packed with nutritious ingredients and delicious flavour. Heinz by Nature is baby food made with tasty ingredients. We craft all of our recipes to provide your little one with silky smooth goodness. Our on-the-go and creamy puree features a yummy combination of green beans and sweet corn- perfect for your baby's growing appetite. Made with nourishing flavours and containing no added sugar or salt- babies will love the taste of Heinz By Nature. Got a spoon? Then you’re ready to serve baby food that is as savoury as homemade. Let's welcome your child to the delicious world of food together. Our purées are delivered to you in glass jars that are recyclable or reusable and made for babies 6 months plus.[newline]One jar of 128 ml Heinz by Nature 100% Natural Baby Food - Organic Green Beans & Sweet Corn Purée[newline]Organic baby food made with natural ingredients[newline]Deliciously made with simple processes like wash- chop- heat and puree[newline]No added sugar or salt[newline]For infants 6+ months[newline]Recyclable jars[newline]Product Number: 21289472_EA,https://assets.shop.loblaws.ca/products/21289472/b1/en/front/21289472_front_a01_@2.png,https://www.loblaws.ca/100-natural-baby-food-organic-green-beans-sweet-co/p/21289472_EA
Baby,PalPlay Unicorn Themed Play Dream House,1564,$249.99,,Perfectly suited for indoor/outdoor use- the adorable Dream House by PalPlay will keep your child busy and entertained with hours of creative and imaginative play. Designed to stimulate children’s imagination- this adorable playhouse features a sunroof- front door that opens and closes easily- peepholes on each side of the house and a key hole. When the sun is shining and its warm outside- this cozy house will offer your children enjoyable play time and fun games in the comfort of your backyard. When the weather is inclement- easily move the Dream House indoors and allow the kids to carrying on playing. Lightweight enough you can even place it in the kids’ bedroom![newline]Product Number: SP133464,https://assets.sellers.loblaw.ca/products/all/1090/133464_1.jpg?size=274,https://www.loblaws.ca/palplay-unicorn-themed-play-dream-house/p/SP133464
Baby,Cruisers Diapers Size 5 60 Count,1620,$29.99,,Long-lasting fit and protection for the most active babies! Pampers Cruisers have 2x stretchier sides* for a comfy- secure fit that stays put- even when they don’t. With Dual Leak-Guard Barriers that gently seal around the legs and bottom to stop leaks where they happen most. Pampers Wetness Indicator lets you know when your baby might need a change. Cruisers come in a variety of stylish prints- all with trusted Pampers All Night Protection. Plus- Pampers Cruisers are hypoallergenic and free of parabens and latex-** so they’re gentle on your baby’s skin. Pampers Cruisers diapers are available in sizes 3- 4- 5- 6- and 7.[newline]*Vs. The leading moving baby sub-brand[newline]**Natural rubber[newline]Product Number: 21101449_EA,https://assets.shop.loblaws.ca/products/21101449/b1/en/front/21101449_front_a01_@2.png,https://www.loblaws.ca/cruisers-diapers-size-5-60-count/p/21101449_EA
Baby,Yellow Stripe Receiving Blanket - Set of Four,1788,$26.99,,Wrap your baby with these Precious Moments Receiving Blankets. Made from soft cotton- these flannel receiving blankets keep your little one warm and comfy and feature charming prints.[newline]Product Number: SP21299,https://assets.sellers.loblaw.ca/products/all/1049/21299_1.jpg?size=274,https://www.loblaws.ca/yellow-stripe-receiving-blanket-set-of-four/p/SP21299
Baby,B.Box Silicone Bowl & Spoon S'Berry,1565,$24.99,,We all know that toddlers can sometimes be a little "extra active" at mealtimes. Here’s a solution for less oopsies and less mess during those times. Introducing the silicone first feeding set. The set includes a silicone bowl with "stay suction" technology that sticks the base to any smooth surface - like highchair trays or smooth tables - so bubs can’t lift it- knock it- drop it or throw it anymore! No more ducking from that flying bowl of pasta! This silicone bowl has super suction powers to ensure the bowl stays put- challenging even the most energetic of toddlers! The set also includes an FDA food grade silicone spoon- that’s gentle on baby’s gums. Dishwasher safe (top rack only). Available in 4 funky colours.[newline]Product Number: SP195867,https://assets.sellers.loblaw.ca/products/all/1245/195867_1.jpg?size=274,https://www.loblaws.ca/b-box-silicone-bowl-spoon-s-berry/p/SP195867
Baby,Baby Food Apple Pear Banana,1696,$2.49,,Product Number: 21363181006_EA,https://assets.shop.loblaws.ca/products/21363181006/b1/en/front/21363181006_front_a01_@2.png,https://www.loblaws.ca/baby-food-apple-pear-banana/p/21363181006_EA
Baby,B.Box New Sippy Cup Gelato Edition Bubblegum,1789,$19.99,,6m+[newline].Weighted straw moves with the liquid- whatever angle the cup is held[newline].Simple flip top lid[newline].Dishwasher safe[newline].Do not microwave[newline].Made from PP and silicone- steel weighted ball[newline].Dimensions (cup with lid) 15 x 12 x 7.5cm[newline].240mls/8oz capacity[newline].BPA- Phthalates and PVC free[newline]Product Number: SP195860,https://assets.sellers.loblaw.ca/products/all/1245/195860_3.jpg?size=274,https://www.loblaws.ca/b-box-new-sippy-cup-gelato-edition-bubblegum/p/SP195860
Baby,Pure Protection Club Pack Plus - Diapers Size 5 72 Count,1621,$29.99,$33.99,Product Number: 21303616_EA,https://assets.shop.loblaws.ca/products/21303616/b1/en/front/21303616_front_a01_@2.png,https://www.loblaws.ca/pure-protection-club-pack-plus-diapers-size-5-72-c/p/21303616_EA
Baby,Dwinguler Downy Grey Castle Extension Set,1566,$184.99,,Dwinguler Castle Extension Kits can be attached to the Dwinguler Castle Playpen to create an extra large space for children to play in. This extension allows the playpen to be used comfortably with multiple children.[newline]• Package contents include four panels and two panel supports.[newline]• Requires a Dwinguler Castle Playpen for use[newline]• When attached to the Dwinguler Castle Playpen- the playpen become large enough to fit 2 large Dwinguler Playmats[newline]• U.S. and E.U. certified.[newline]• Made of non toxic materials and free of BPA- lead- phthalates and heavy metals.[newline]• Easy to clean and wipe.[newline]• Dwinguler Castle Playpen is sold separately[newline]Product Number: SP15491,https://assets.sellers.loblaw.ca/products/all/1043/15491_1.jpg?size=274,https://www.loblaws.ca/dwinguler-downy-grey-castle-extension-set/p/SP15491
Baby,Beetberry,1697,$5.29,,Love beets but don't want the kitchen to turn pink?! Say hello to mess-free Beetberry Squoosh snacks made with tart apple- creamy banana- nutrient rich beets and juicy berries to satisfy tastebuds of all ages.[newline]Product Number: 20649780004_EA,https://assets.shop.loblaws.ca/products/20649780004/b1/en/front/20649780004_front_a01_@2.png,https://www.loblaws.ca/beetberry/p/20649780004_EA
Baby,Digital Ovulation Test,1790,$67.99,,The Clearblue Digital Ovulation Test identifies your 2 best days to get pregnant. The simple urine ovulation test is over 99% accurate at detecting the luteinising hormone (LH) surge. The optical reader interprets your result and gives you a clear smiley face in the digital display when the LH surge has been detected- so you know this day and the following day are your 2 best days to try for a baby.[newline]For women whose cycles are variable- it can be especially challenging to accurately detect the timing of the two best days to get pregnant. A 20 count test kit will give you a higher chance of detecting your most fertile days.[newline]Product Number: 20355102_EA,https://assets.shop.loblaws.ca/products/20355102/b1/en/front/20355102_front_a01_@2.png,https://www.loblaws.ca/digital-ovulation-test/p/20355102_EA
Baby,Twilight Buddies - Dragon,1622,$39.99,,Twilight Cuddle Buddies™ help ease children’s fear of the dark by projecting a starry night sky onto the bedroom ceilings and walls. Hidden within the soothing star pattern are the moon and 3 constellations! Little ones find instant soothing companionship with these ultra-cuddly friends that can travel with them wherever they go.[newline]Product Number: SP46881,https://assets.sellers.loblaw.ca/products/all/1124/46881_2624884545_2.jpg?size=274,https://www.loblaws.ca/twilight-buddies-dragon/p/SP46881
Baby,Diapers- Size 1- 35 Count,1567,$11.99,,Product Number: 21280070_EA,https://assets.shop.loblaws.ca/products/21280070/b1/en/front/21280070_front_a01_@2.png,https://www.loblaws.ca/diapers-size-1-35-count/p/21280070_EA
Baby,Rice Rusks- Blueberry & Goji,1698,$3.49,,Baby Mum-Mum is the original and most popular rice teething biscuit in North America- parent trusted for over 25 years. They are made from premium Japonica rice and dissolve easily- making it a perfect gluten free- no-mess choice for your child. You may give Baby Mum-Mum Rice Rusks to your child as soon as they are ready for solid food..[newline][newline]Baby Mum-Mums remain free of the top common allergens!.[newline][newline]Milk- peanuts- wheat- tree nuts- soy- shellfish- fish- sesame- eggs[newline][newline]Check out our web site.[newline][newline]www.mummums.com[newline]Product Number: 21024948_EA,https://assets.shop.loblaws.ca/products/21024948/b1/en/front/21024948_front_a01_@2.png,https://www.loblaws.ca/rice-rusks-blueberry-goji/p/21024948_EA
Baby,Little Movers Baby Diapers- Size 4,1791,$32.99,,Our #1 Fitting Diaper-* Huggies Little Movers Diapers are designed for active babies! Little Movers baby diapers feature a contoured shape and SnugFit Waistband that helps eliminate gaps at the legs & waist. Double Grip Strips hold the diaper in place and help prevent sagging while crawling- walking & running. Huggies' DryTouch liner absorbs wetness on contact to help keep skin clean & healthy- while the absorbent Leak Lock System helps eliminate leaks for up to 12 hours of protection. Little Movers now feature Huggies' Pocketed Waistband to help prevent diaper blowouts (NB-Size 2). Plus wetness indicator let's you know when baby is ready for a diaper change. They also include a SizeUp indicator- so you'll know when it's time for baby to move up to the next size. Little Movers disposable baby diapers are hypoallergenic- fragrance free- lotion free- paraben free- and free of elemental chlorine & natural rubber latex. Featuring exclusive Disney Lion King designs- Little Movers Diapers are available in size 3 (16-28 lb.)- size 4 (22-37 lb.)- size 5 (27+ lb.)- size 6 (35+ lb.) and size 7 (41+ lb.). Join Huggies Rewards+ Powered by Fetch to get rewarded fast. Earn points on Huggies diapers and wipes- in addition to thousands of other products to redeem for hundreds of gift cards. Download the Fetch Rewards app to get started today! (*Wet Fit- Among Open Diapers)[newline]Product Number: 21370956_EA,https://assets.shop.loblaws.ca/products/21370956/b1/en/front/21370956_front_a01_@2.png,https://www.loblaws.ca/little-movers-baby-diapers-size-4/p/21370956_EA
Baby,Swaddlers Overnights Diapers size 5 50 Count,1623,$29.99,,A restful night’s sleep starts with the right protection. For dry nights- Pampers Swaddlers Overnights are[newline]designed with extra absorbency to lock wetness away from skin for up to 12 hours. Designed to keep[newline]skin dry and healthy- Pampers Swaddlers Overnights are the only nighttime diaper with a BreatheFree LinerTM that wicks away wetness and mess- allowing your baby’s skin to breathe. Our Soft Flexi-Sides provide a soft cushiony stretch for a secure and comfortable fit. Plus- they feature eight nighttime prints for the sweetest dreams. For protection that’s gentle on your baby’s skin- Pampers Swaddlers Overnights are hypoallergenic and free of parabens and latex.*[newline]For trusted protection- trust Pampers- the #1 U.S. Pediatrician Recommended Brand.[newline]*Natural rubber[newline]Product Number: 21101489_EA,https://assets.shop.loblaws.ca/products/21101489/b1/en/front/21101489_front_a01_@2.png,https://www.loblaws.ca/swaddlers-overnights-diapers-size-5-50-count/p/21101489_EA
Baby,Dwinguler Dï¿½corSoft Modern Area Baby Playmat- Venetian,1568,$249.99,,The DecorSoft Modern Rug is a really good alternative to carpets and rugs that are difficult to clean and are a breeding place for germs and dust mites. The mat is ultra soft and has extra thick padding that can comfortably absorb the impact of movement- jumps- falls- tumbles- and rough playing. The versatile mat works to protect all members of the family- thanks to its shock absorbent- padded construction. It will protect delicate fingers- wrists- knees- and heads of kids as they play on the mat. It is a great mat for workouts and yoga for adults in the family. The delicate bones of elderly members of the family are also kept safe by the mat. The thick mat protects against cold- hard floors and is a boon in winters. The most desirable feature of the mat- however- remains its range of gorgeous designs that introduce luxurious elegance to your spaces.[newline][newline]The ultra-soft and comfortable mat is great for everyone in the family.[newline]Waterproof and easy to clean with soap and water- the mat is easy to keep clean.[newline]The antimicrobial material of the mat helps promote hygiene.[newline]The versatile mat can be used as a sports mat as well as a play area mat.[newline]The mat is flame-retardant and fire-proof.[newline]Mats come with their own display boxes for shops and retail outlets. Free from BPA- lead- and phthalate. This playmat is not only eco-friendly- but is absolutely safe for babies.[newline]Product Number: SP15493,https://assets.sellers.loblaw.ca/products/all/1043/15493_1.jpg?size=274,https://www.loblaws.ca/dwinguler-d-corsoft-modern-area-baby-playmat-venet/p/SP15493
Baby,Banana Kale,1699,$3.99,,All hail kale! Excite baby’s tastebuds with this dynamic combination of sweet- creamy banana and nutrient-rich kale. Pair with our Banana- Apple- & Kale blend for the perfect kale lovers combo![newline]Product Number: 21097100_EA,https://assets.shop.loblaws.ca/products/21097100/b1/en/front/21097100_front_a01_@2.png,https://www.loblaws.ca/banana-kale/p/21097100_EA
Baby,Shoosha Pure Mineral Suncreen SPF45 & Shoosha Anti-Itch Stick,1792,$47.99,,Shooshas water-resistant Pure Mineral Sunscreen offers broad spectrum UVA/UVB protection without any toxic irritating chemical ingredients. Made with a blend of uncoated Clear Zinc Oxide and anti-oxidant rich and deeply moisturizing ingredients like Organic Shea Butter- Organic Coconut- Organic Avocado- Organic Green Tea Oil and Organic Calendula. Combined- these super food ingredients provide skin nourishment and while shielding your childs skin from chafing and irritation caused by dryness.[newline]Note that once applied- there is a soft white cast which disappears once rubbed in. Stay sun safe with Shoosha![newline]Reef Friendly: No toxic chemicals or micronized Zinc that causes bleaching of coral reefs[newline]Biodegradable: Its all natural/organic and like food- biodegrades without causing harm to the environment.[newline]Vegan: No animal by-products or animal tissue.[newline]Moisturizing: Boosted with Organic Shea Butter- Organic Coconut- Organic Green Tea Oil and Organic Calendula that work to deeply nourish- hydrate and calm babys skin while shielding it from harmful rays.[newline]Made with Certified Organic Ingredients: All of our ingredients are either Certified USDA Organic or as gentle as can be natural ingredients.[newline]Cruelty Free. Paraben Free. Perfume/Fragrance Free.[newline]A safe medicated treatment balm that will provide temporary protection and relief from minor skin irritation and itching due to insect bites- poison ivy- poison oak and poison sumac.[newline]Product Number: SP23398,https://assets.sellers.loblaw.ca/products/all/1042/23398_1.jpg?size=274,https://www.loblaws.ca/shoosha-pure-mineral-suncreen-spf45-shoosha-anti-i/p/SP23398
