Category,Product,Product ID,Price,Old Price,Description,Image URL,Product URL
Pet Supplies,Pawsitively Chilly Dog Fleece Coat Blue and Purple Plaid with Pink Heart Design Winter Pet Coat X-Small,6112,$32.19,,8 SIZES AVAILABLE (XXS/XS/S/M/L/XL/XXL/XXXL): Can fit small- medium or large dogs. Please measure your pet's size before ordering for the perfect fit.[newline]EASY-ON/OFF DESIGN: Adjustable velcro strap designed with your dog in mind so that you can spend more time on walks and less time getting dressed.[newline]KEEP WARM WITH POLAR FLEECE: Soft and breathable polar fleece to keep your dog warm and comfortable in the cold weather.[newline]ADJUSTABLE and ACCURATE FIT: Adjustable chest closure for better tuck-in of the body and keep body heat.[newline]FASHIONABLE DESIGN: A must-have item for any stylish pup's winter wardrobe collection in a trendy plaid pattern with a sweet pink heart graphic. Perfect for keeping your pup warm while looking cool! Available in various other patterns.[newline][newline][newline]Chilly weather is the paw-fect reason to keep your dog cozy in a fashionable outer layer! From morning walks to playing in the snow- your pup will love staying warm while doing their favorite activities in our Fleece Coat. Just like fleece layers for humans- dog fleece coats and jackets are essential for keeping your pet at a comfortable temperature. Our Fleece Coats are also excellent for getting adorable photos of your pup this winter![newline][newline]This Fleece Coat for dogs features a stylish plaid pattern- polar fleece lining on the collar for extra warmth- and has an easy-wear design so that you can spend more time on walks and less time getting dressed.[newline][newline]Show & Tail's Winter Coat Collection is a staple for keeping your pup warm while looking cool! With so many styles to choose from- you are sure to find the perfect match for your perfect pet.[newline][newline]Show & Tail is passionate about creating fun- stylish- and adorable apparel for your pet. We offer a diverse range of holiday wear- seasonal clothing- bandanas- and more.[newline][newline]Established in 1949- Pamson has been a leading manufacturer for more than 70 years with success with importers and retailers across the globe.[newline]Product Number: SP159941,https://assets.sellers.loblaw.ca/products/all/1127/159941_1.jpg?size=274,https://www.loblaws.ca/pawsitively-chilly-dog-fleece-coat-blue-and-purple/p/SP159941
Pet Supplies,Hydor Pico Replacement Filter Sponge (Silver),6184,$6.45,,Replacement filter sponge for use with the Hydor Pico Power Filter.[newline]Product Number: SP211372,https://assets.sellers.loblaw.ca/products/all/1291/211372_1.jpg?size=274,https://www.loblaws.ca/hydor-pico-replacement-filter-sponge-silver/p/SP211372
Pet Supplies,Whitaker Weir Dog Coat (Navy),6264,$36.70,,Denier: 600D. Design: Logo- Reflective. 2 Heated Chest Panels- Waterproof. Fastening: Touch and Close Fastening.[newline]Product Number: SP198359,https://assets.sellers.loblaw.ca/products/all/1291/198359_1.jpg?size=274,https://www.loblaws.ca/whitaker-weir-dog-coat-navy/p/SP198359
Health & Beauty,Foundation Fair Ivory,6037,$12.98,,Product Number: 21270260_EA,https://assets.shop.loblaws.ca/products/21270260/b1/en/front/21270260_front_a01_@2.png,https://www.loblaws.ca/foundation-fair-ivory/p/21270260_EA
Pet Supplies,ONE True Instinct Natural Dry Dog Food- Salmon & Tuna,6113,$23.99,,No matter how far science advances us- we always look to nature to inspire us.[newline]Product Number: 20923556_C01,https://assets.shop.loblaws.ca/products/20923556/b1/en/front/20923556_front_a01_@2.png,https://www.loblaws.ca/one-true-instinct-natural-dry-dog-food-salmon-tuna/p/20923556_C01
Pet Supplies,Whitaker Weir Dog Coat (Navy),6185,$36.70,,Denier: 600D. Design: Logo- Reflective. 2 Heated Chest Panels- Waterproof. Fastening: Touch and Close Fastening.[newline]Product Number: SP198361,https://assets.sellers.loblaw.ca/products/all/1291/198361_1.jpg?size=274,https://www.loblaws.ca/whitaker-weir-dog-coat-navy/p/SP198361
Pet Supplies,Cat Flaked Tuna Entrï¿½e,6265,$1.99,,Product Number: 21360280_EA,https://assets.shop.loblaws.ca/products/21360280/b1/en/front/21360280_front_a01_@2.png,https://www.loblaws.ca/cat-flaked-tuna-entr-e/p/21360280_EA
Health & Beauty,Colorstay Eyebrow Pencil- Taupe,6038,$13.98,,Product Number: 21159384005_EA,https://assets.shop.loblaws.ca/products/21159384005/b1/en/front/21159384005_front_a01_@2.png,https://www.loblaws.ca/colorstay-eyebrow-pencil-taupe/p/21159384005_EA
Pet Supplies,Dog Gone Smart Olympia Softshell Dog Coat,6114,$58.20,,Dog softshell coat. Keeps dogs warm and dry in the most extreme conditions. Temperature rating minus 30 degrees F/minus 34 degrees Celsius. The soft fleece outer shell and cosy fleece lining features Repeliz-It Stay Clean Nano protection to repel dirt- stains- odours- bacteria and fungi. The 4 inch long water proof zipper allows for plenty of adjustability when attaching the leash to the collar or harness ring. Simply open the zipper- clip the harness ring to the leash- and re zip to keep your dog warm and dry. High collar provides extra warmth for chilly winter days. Elastic waist band ensures a comfortable fit for any size breed. Reflective piping offers improved visibility at night. Full zipper back allows for easy step-in design. Adjustable neck enclosure provides comfort for all size breeds. Front leg sleeves feature elastic bands to ensure proper fit on any size dog. Elastic belly allows for plenty of adjustability. Rear leg straps ensure proper fit around the backside. Coat size is determined by measuring nape of the neck to base of tail.[newline]Product Number: SP198274,https://assets.sellers.loblaw.ca/products/all/1291/198274_1.jpg?size=274,https://www.loblaws.ca/dog-gone-smart-olympia-softshell-dog-coat/p/SP198274
Pet Supplies,Animal Instincts Snow Mates Plush Dog Toy (Winston Walrus),6186,$8.20,,Material: Plush. Snow Mates are made from a premium- super soft fabric and include a squeak for additional entertainment. Provide hours of interactive fun for you and your dog. Suitable for playing and fetching.[newline]Product Number: SP208559,https://assets.sellers.loblaw.ca/products/all/1291/208559_1.jpg?size=274,https://www.loblaws.ca/animal-instincts-snow-mates-plush-dog-toy-winston/p/SP208559
Pet Supplies,Sharples Faces N Feathers Cork Cat Ball,6266,$4.95,,Material: Cork. Design: Face. Feather Teaser- Filled with Catnip- Tassels.[newline]Product Number: SP208260,https://assets.sellers.loblaw.ca/products/all/1291/208260_1.jpg?size=274,https://www.loblaws.ca/sharples-faces-n-feathers-cork-cat-ball/p/SP208260
Health & Beauty,Excellence Crï¿½me- J Black,6039,$10.99,$13.99,Product Number: 20306551020_EA,https://assets.shop.loblaws.ca/products/20306551020/b1/en/front/20306551020_front_a01_@2.png,https://www.loblaws.ca/excellence-cr-me-j-black/p/20306551020_EA
Pet Supplies,Animooos Squeaky Banana Toy - 1 Count,6187,$15.63,,Animooos Squeaky Banana Toy - 1 Count[newline]Product Number: SP151871,https://assets.sellers.loblaw.ca/products/all/1127/151871_1.jpg?size=274,https://www.loblaws.ca/animooos-squeaky-banana-toy-1-count/p/SP151871
Pet Supplies,Caldex Classic Aquarium Decoration Fluorescent Skull (May Vary),6115,$9.20,,Fluorescent skull shaped aquarium decoration. Overall size approximately L 60 x W 92 x H 65 mm.[newline]Product Number: SP210507,https://assets.sellers.loblaw.ca/products/all/1291/210507_1.jpg?size=274,https://www.loblaws.ca/caldex-classic-aquarium-decoration-fluorescent-sku/p/SP210507
Pet Supplies,Adult Cat Chicken Brown Rice,6267,$34.99,,Product Number: 21360273_EA,https://assets.shop.loblaws.ca/products/21360273/b1/en/front/21360273_front_a01_@2.png,https://www.loblaws.ca/adult-cat-chicken-brown-rice/p/21360273_EA
Health & Beauty,Click Compact Tampons- Super Absorbency- Unscented- 16,6040,$3.99,,Product Number: 21287976_EA,https://assets.shop.loblaws.ca/products/21287976/b1/en/front/21287976_front_a01_@2.png,https://www.loblaws.ca/click-compact-tampons-super-absorbency-unscented-1/p/21287976_EA
Pet Supplies,Dog Gone Smart Olympia Softshell Dog Coat,6188,$80.45,,Dog softshell coat. Keeps dogs warm and dry in the most extreme conditions. Temperature rating minus 30 degrees F/minus 34 degrees Celsius. The soft fleece outer shell and cosy fleece lining features Repeliz-It Stay Clean Nano protection to repel dirt- stains- odours- bacteria and fungi. The 4 inch long water proof zipper allows for plenty of adjustability when attaching the leash to the collar or harness ring. Simply open the zipper- clip the harness ring to the leash- and re zip to keep your dog warm and dry. High collar provides extra warmth for chilly winter days. Elastic waist band ensures a comfortable fit for any size breed. Reflective piping offers improved visibility at night. Full zipper back allows for easy step-in design. Adjustable neck enclosure provides comfort for all size breeds. Front leg sleeves feature elastic bands to ensure proper fit on any size dog. Elastic belly allows for plenty of adjustability. Rear leg straps ensure proper fit around the backside. Coat size is determined by measuring nape of the neck to base of tail.[newline]Product Number: SP198286,https://assets.sellers.loblaw.ca/products/all/1291/198286_1.jpg?size=274,https://www.loblaws.ca/dog-gone-smart-olympia-softshell-dog-coat/p/SP198286
Pet Supplies,Henry Wag Drying Dog Coat,6116,$26.45,,High quality microfibre material. Simple strap holds it in place. Removes water and dirt. Protects interior furnishings and reduces the risk of infection.[newline]Product Number: SP211168,https://assets.sellers.loblaw.ca/products/all/1291/211168_1.jpg?size=274,https://www.loblaws.ca/henry-wag-drying-dog-coat/p/SP211168
Pet Supplies,Adventure Collar - Disco,6268,$22.99,,Disco’s 70s inspired color palette adds a dash of suaveness to your walks while complementing your dog’s natural strut.Our products are made with premium components from world-class manufacturer like YKK. This buckle incorporates a new multiple locking system to prevent accidental release- and it has the best tensile strength in its class. Our collars from the adventure collection are built with heavy polypro webbing sourced from the USA. With a tensile strength of over 600 lbs- our webbing is built for adventure.[newline]Product Number: SP109222,https://assets.sellers.loblaw.ca/products/all/1092/109222_1.jpg?size=274,https://www.loblaws.ca/adventure-collar-disco/p/SP109222
Health & Beauty,Lï¿½Oreal Root,6041,$10.99,$15.99,Product Number: 21243611_EA,https://assets.shop.loblaws.ca/products/21243611/b1/en/front/21243611_front_a01_@2.png,https://www.loblaws.ca/l-oreal-root/p/21243611_EA
Pet Supplies,Supa Chewi Tube Toy (May vary),6189,$4.20,,A recreational chewy toy for your pet Ideal for hamsters- gerbils- mice and similar size pets. Made from 100% safe- environmentally friendly vegetable parchment. Chewi-tubes help promote: Exercise and stimulation for a healthier and happier pet. Gnawing- to keep teeth in good order. Natural burrowing instincts. Chewi-tubes can be an ideal den for your pet to hide in and feel safe.[newline]Product Number: SP213578,https://assets.sellers.loblaw.ca/products/all/1291/213578_1.jpg?size=274,https://www.loblaws.ca/supa-chewi-tube-toy-may-vary/p/SP213578
Pet Supplies,Mikki Dogs Claw File (May Vary),6117,$13.70,,Dogs Claw File is made from heat treated stainless steel with strength and durability. Ideal for more nervous pets or for smoothing clipped nail edges.[newline]Product Number: SP210202,https://assets.sellers.loblaw.ca/products/all/1291/210202_1.jpg?size=274,https://www.loblaws.ca/mikki-dogs-claw-file-may-vary/p/SP210202
Pet Supplies,Sharples Roped Tuggo Ball (Blue/Yellow/Red),6269,$8.45,,Pretty much indestructible tug-of-war action: the rope can be pulled from both sides. Ideal for owners that want to play with their dogs or for two dogs to play together. Even when your dog plays by itself- the water weight makes it seem like your dog is playing with another dog or person. The built-in screw top is strong and safe. No tools needed. By tying the rope in different lengths- the Tuggo can be pulled- dragged or carried. The ball is easy to take along in a backpack or car. The ball can also be filled with sand or gravel. The ball floats when it isn´t filled. The ball is suitable for every dog weighing over 18kg or small dogs that love a challenge.[newline]Product Number: SP211227,https://assets.sellers.loblaw.ca/products/all/1291/211227_1.jpg?size=274,https://www.loblaws.ca/sharples-roped-tuggo-ball-blue-yellow-red/p/SP211227
Health & Beauty,Shea Butter Hand Cream,6042,$5.49,,Product Number: 21358931_EA,https://assets.shop.loblaws.ca/products/21358931/b1/en/front/21358931_front_a01_@2.png,https://www.loblaws.ca/shea-butter-hand-cream/p/21358931_EA
Pet Supplies,Ancol Pet Products All Weather Micro Fibre Dog Jacket,6190,$24.45,,All weather padded dog jacket. Made with micro fibre material- a very tightly woven cloth which is both water repellent and breathable. Complete with easy fit touch fastening chest and belly straps and soft luxurious checkered lining.[newline]Product Number: SP198271,https://assets.sellers.loblaw.ca/products/all/1291/198271_1.jpg?size=274,https://www.loblaws.ca/ancol-pet-products-all-weather-micro-fibre-dog-jac/p/SP198271
Pet Supplies,Paw-fect for Winter Dog Quilted Coat Red Fashionable and Sporty Faux Fur Trim Pet Coat XX-L,6118,$36.79,,7 SIZES AVAILABLE (XXS/XS/S/M/L/XL/XXL/XXL): Can fit small- medium or large dogs. Please measure your pet's size before ordering for the perfect fit.[newline]EASY-ON/OFF DESIGN: Adjustable velcro strap designed with your dog in mind so that you can spend more time on walks and less time getting dressed.[newline]KEEP YOUR PET WARM THIS WINTER: Just as humans need their jacket to brave the cold- dog winter coats are a staple for keeping your pet at a comfortable temperature.[newline]MATERIAL: Made with 100% polyester woven fabric- this jacket is durable- warm- and easy to clean. Features Faux Fur on the Hood.[newline]ADJUSTABLE and ACCURATE FIT: Adjustable chest closure for better tuck-in of the body and keep body heat.[newline]FASHIONABLE DESIGN: A must-have item for any stylish pup's winter wardrobe collection in an exciting shade of red with a trendy faux fur trim hood. Perfect for keeping your pup warm while looking cool! Available in various other patterns.[newline][newline][newline]Chilly weather is the paw-fect reason to keep your dog warm in a stylish outer layer! From morning walks to playing in the snow- your pup will love doing their favourite activities in our Quilted Coat. Just as humans need their jackets to brave the cold- dog winter coats are essential for keeping your pet at a comfortable temperature. This coat comes in a wonderful shade of red- making it excellent for getting adorable photos of your pup this winter![newline][newline]This Quilted Coat for dogs features a fashionable faux fur lined hood- a cozy inner lining- and has an easy-wear design so that you can spend more time on walks and less time getting dressed.[newline][newline]Show & Tails Winter Coat Collection is a staple for keeping your pup warm while looking cool! With so many styles to choose from- you are sure to find the perfect match for your perfect pet.[newline][newline]Show & Tail is passionate about creating fun- stylish- and adorable apparel for your pet. We offer a diverse range of holiday wear- seasonal clothing- bandanas- and more.[newline][newline]Established in 1949- Pamson has been a leading manufacturer for more than 70 years with success with importers and retailers across the globe.[newline].[newline]Product Number: SP159962,https://assets.sellers.loblaw.ca/products/all/1127/159962_1.jpg?size=274,https://www.loblaws.ca/paw-fect-for-winter-dog-quilted-coat-red-fashionab/p/SP159962
Pet Supplies,Animal Instincts Snow Mates Plush Dog Toy (Winston Walrus),6270,$8.20,,Material: Plush. Snow Mates are made from a premium- super soft fabric and include a squeak for additional entertainment. Provide hours of interactive fun for you and your dog. Suitable for playing and fetching.[newline]Product Number: SP208559,https://assets.sellers.loblaw.ca/products/all/1291/208559_1.jpg?size=274,https://www.loblaws.ca/animal-instincts-snow-mates-plush-dog-toy-winston/p/SP208559
Health & Beauty,Invisible Spray Antiperspirant And Deodorant- Swagger,6043,$5.99,,Old Spice Red Collection Invisible Spray Swagger 132mL[newline]Product Number: 21031197_EA,https://assets.shop.loblaws.ca/products/21031197/b1/en/front/21031197_front_a01_@2.png,https://www.loblaws.ca/invisible-spray-antiperspirant-and-deodorant-swagg/p/21031197_EA
Pet Supplies,Zoï¿½ Tender Bites Dog Treats - Peanut Butter & Banana - 6 bags,6191,$46.99,,Who can resist peanut butter and banana? We know we can't. And we bet your dog can't either. Zoë Tender Bites are soft & chewy dog treats that are perfect for training and rewarding your dog on a daily basis.[newline][newline]Made in Canada- these treats are highly palatable- grain free and 100% natural. Zoë Tender Bites contain no corn- no wheat- no soy- no artificial flavours or preservatives- so treat your better half with these treats.[newline][newline]Quantity of 1 = 6 bags[newline]Product Number: SP17426,https://assets.sellers.loblaw.ca/products/all/1072/17426_2176179834_1.jpg?size=274,https://www.loblaws.ca/zo-tender-bites-dog-treats-peanut-butter-banana-6/p/SP17426
Pet Supplies,Cat Grass and Cat Double Dish,6119,$20.79,,Combo Set - Catit Cat Grass 85g & Cat Lightweight Double Dish- Small[newline]Product Number: SP16917,https://assets.sellers.loblaw.ca/products/all/1072/16917_1366493032_1.jpg?size=274,https://www.loblaws.ca/cat-grass-and-cat-double-dish/p/SP16917
Pet Supplies,Waboba Fetch Dog Ball,6271,$12.45,,Design: Text. Length: 60mm. Width: 60mm. Bounces On Water- Easy to Throw and Fetch- Extra Durability- Firmer Core- Reinforced Seams. Height: 60mm. Packaging: Boxed. Please Note: If Product Becomes Damaged Remove For Your Pet Immediately- Inspect This Toy Regularly- Not A Chew Toy- Supervise Your Dog When Playing- Water Retrieval Toy. Suitable for: Lake Use- Open Water Play.[newline]Product Number: SP211978,https://assets.sellers.loblaw.ca/products/all/1291/211978_1.jpg?size=274,https://www.loblaws.ca/waboba-fetch-dog-ball/p/SP211978
Health & Beauty,5 Blade Disposable Men,6044,$5.99,,Product Number: 21197706_EA,https://assets.shop.loblaws.ca/products/21197706/b1/en/front/21197706_front_a01_@2.png,https://www.loblaws.ca/5-blade-disposable-men/p/21197706_EA
Pet Supplies,Animooos Squeaky Spiked Ball - 1 Count,6192,$16.88,,Animooos Squeaky Spiked Ball - 1 Count[newline]Product Number: SP151867,https://assets.sellers.loblaw.ca/products/all/1127/151867_1.jpg?size=274,https://www.loblaws.ca/animooos-squeaky-spiked-ball-1-count/p/SP151867
Pet Supplies,Ancol Extreme Blizzard Dog Coat,6120,$56.20,,100% waterproof nano treated rip-stop nylon. Lightweight base layer of breathable mesh. 3 point adjustment for the perfect fit. Tail opening- leg straps- under-body protection and a harness hole- 5 reflective points for low light visibility. XS: 25 x 44-55cm- S: 30 x 45-57cm- S/M: 35 x 55-70cm- M: 40 x 55-73cm- L: 50 x 70-90cm- XL: 60 x 70-93cm- XXL: 70 x 80-106cm.[newline]Product Number: SP198372,https://assets.sellers.loblaw.ca/products/all/1291/198372_1.jpg?size=274,https://www.loblaws.ca/ancol-extreme-blizzard-dog-coat/p/SP198372
Health & Beauty,Tattoo Studio Liner Ink- Black,6045,$10.98,,Product Number: 21158568004_EA,https://assets.shop.loblaws.ca/products/21158568004/b1/en/front/21158568004_front_a01_@2.png,https://www.loblaws.ca/tattoo-studio-liner-ink-black/p/21158568004_EA
Pet Supplies,Jolly Pets Tug-n-Toss Dog Toy,6272,$23.70,,A great interactive toy with a handle that makes them super easy to retrieve. These balls float and bounce and do not need air to inflate. Ideal for large dogs.[newline]Product Number: SP209047,https://assets.sellers.loblaw.ca/products/all/1291/209047_1.jpg?size=274,https://www.loblaws.ca/jolly-pets-tug-n-toss-dog-toy/p/SP209047
Pet Supplies,Mikki Mothering Kit,6193,$9.20,,For controlled feeding of very small- weak or young animals. Comprises of syringe and a small silicone rubber teat. Fill with the appropriate liquid and attached the sucker. Gently introduce into the mouth and slowly push the plunger. Can be sterilised.[newline]Product Number: SP211448,https://assets.sellers.loblaw.ca/products/all/1291/211448_1.jpg?size=274,https://www.loblaws.ca/mikki-mothering-kit/p/SP211448
Pet Supplies,Original TEENIE Natural Dental Dog Treats- 43 Pack,6121,$17.99,$19.99,One GREENIES Original Dental Treat a day is all it takes for clean teeth- fresh breath and a happy dog. Your dog can't wait to sink their teeth into these delicious dental chews that are made with natural ingredients plus vitamins- minerals and nutrients and feature a delightfully chewy texture that fights plaque and tartar. Irresistibly tasty and incredibly powerful- GREENIES dental treats for dogs are recommended by U.S. Veterinarians for at-home oral care. Best of all- these dog treats are made with highly soluble ingredients that are easy to digest. Give your dog the mouth-wowing treat that helps promote oral health with GREENIES dental treats for dogs.[newline]Contains one (1) 12 oz. 43-count pack of GREENIES Original TEENIE Natural Dental Dog Treats; Natural Dog Treats Plus Vitamins- Minerals- and Other Nutrients[newline]Chewy texture cleans teeth & helps maintain healthy gums for a sparkle in every smile.[newline]GREENIES Dental Treats for Dogs are veterinarian recommended* for dental care and accepted by the Veterinary Oral Health Council (VOHC) to help control plaque and tartar. * Based on a survey of U.S. Veterinarians.[newline]Treat your dog fantastically with the great taste of GREENIES Original Dental Treats[newline]Product Number: 21186367_EA,https://assets.shop.loblaws.ca/products/21186367/b1/en/front/21186367_front_a01_@2.png,https://www.loblaws.ca/original-teenie-natural-dental-dog-treats-43-pack/p/21186367_EA
Pet Supplies,Animate Dog Cooling Coat & Bag (Navy),6273,$48.70,,Activated quickly by soaking in water. Will give hours of use. Fitted like a normal dog coat. For both indoor and outdoor use. Antimicrobial. Touch fasten straps. Adjustable. Size: XS: 8in- S: 12in- M: 16in- L: 20in- XL: 24in- XXL: 28in.[newline]Product Number: SP210826,https://assets.sellers.loblaw.ca/products/all/1291/210826_1.jpg?size=274,https://www.loblaws.ca/animate-dog-cooling-coat-bag-navy/p/SP210826
Health & Beauty,Pads- Flex Wings,6046,$10.99,,If you think all pads are exactly the same — think again. Discover the completely reinvented* Always Ultra pads with 3X Protection System for up to 100% leak-free comfort. Thanks to RapidDRY- the pads absorb two times faster than the leading store brand to wick away gushes in seconds. Plus- the LeakGUARD core locks in leaks for long-lasting protection- while OdorLOCK neutralizes odors to help you feel fresh and clean all day long. Reinvented from the inside out- Always Ultra Thin Size 2 Long Pads Unscented with Wings provide strong period protection- no matter what your day brings. It’s Always like never before. *vs. previous Always Ultra[newline]Product Number: 20963695_EA,https://assets.shop.loblaws.ca/products/20963695/b1/en/front/20963695_front_a01_@2.png,https://www.loblaws.ca/pads-flex-wings/p/20963695_EA
Pet Supplies,Rogz Grinz Ball Dog Toy,6194,$9.70,,Bounce and fetch toy that your dog will truly enjoy. Gentle on the dog`s teeth and gums. Can hold treats for hours of fun and play. Medium toughness for supervised playtime. Bounces and floats for easy fetching.[newline]Product Number: SP209522,https://assets.sellers.loblaw.ca/products/all/1291/209522_1.jpg?size=274,https://www.loblaws.ca/rogz-grinz-ball-dog-toy/p/SP209522
Pet Supplies,Dura Play Toy,6122,$5.99,,Dog toy with bacon scent[newline]Product Number: 20842562_EA,https://assets.shop.loblaws.ca/products/20842562/b1/en/front/20842562_front_a01_@2.png,https://www.loblaws.ca/dura-play-toy/p/20842562_EA
Pet Supplies,Animooos Mechanical Mouse - 1 Count,6274,$15.63,,Animooos Mechanical Mouse - 1 Count[newline]Product Number: SP151842,https://assets.sellers.loblaw.ca/products/all/1127/151842_1.jpg?size=274,https://www.loblaws.ca/animooos-mechanical-mouse-1-count/p/SP151842
