Category,Product,Product ID,Price,Old Price,Description,Image URL,Product URL
Baby,Pears- Baby Food Stage 1,1019,$1.39,,No sugar added. No artificial flavours or artificial colours.[newline]Product Number: 20651248003_EA,https://assets.shop.loblaws.ca/products/20651248003/b1/en/front/20651248003_front_a01_@2.png,https://www.loblaws.ca/pears-baby-food-stage-1/p/20651248003_EA
Baby,Little Movers Baby Diapers- Size 3,1112,$24.99,$29.99,Our #1 Fitting Diaper-* Huggies Little Movers Diapers are designed for active babies! Little Movers baby diapers feature a contoured shape and SnugFit Waistband that helps eliminate gaps at the legs & waist. Double Grip Strips hold the diaper in place and help prevent sagging while crawling- walking & running. Huggies' DryTouch liner absorbs wetness on contact to help keep skin clean & healthy- while the absorbent Leak Lock System helps eliminate leaks for up to 12 hours of protection. Little Movers now feature Huggies' Pocketed Waistband to help prevent diaper blowouts (NB-Size 2). Plus wetness indicator let's you know when baby is ready for a diaper change. They also include a SizeUp indicator- so you'll know when it's time for baby to move up to the next size. Little Movers disposable baby diapers are hypoallergenic- fragrance free- lotion free- paraben free- and free of elemental chlorine & natural rubber latex. Featuring exclusive Disney Lion King designs- Little Movers Diapers are available in size 3 (16-28 lb.)- size 4 (22-37 lb.)- size 5 (27+ lb.)- size 6 (35+ lb.) and size 7 (41+ lb.). Join Huggies Rewards+ Powered by Fetch to get rewarded fast. Earn points on Huggies diapers and wipes- in addition to thousands of other products to redeem for hundreds of gift cards. Download the Fetch Rewards app to get started today! (*Wet Fit- Among Open Diapers)[newline]Product Number: 21370900_EA,https://assets.shop.loblaws.ca/products/21370900/b1/en/front/21370900_front_a01_@2.png,https://www.loblaws.ca/little-movers-baby-diapers-size-3/p/21370900_EA
Food,Ice Cream Bar vanilla ice cream dipped in a chocolatey coating- caramel sauce and milk chocolate Double Caramel Belgian Chocolate with Rainforest Alliance Certified cocoa,962,$5.99,,Magnum Double Caramel Ice Cream Bar features vanilla bean ice cream dipped in a chocolatey coating- rich caramel sauce- and Belgian chocolate milk[newline]Magnum Ice Cream Bars are made with Belgian unsweetened chocolate[newline]These Magnum bars featuring rich vanilla ice cream are the ultimate dessert indulgence for pleasure seekers[newline]Magnum chocolate ice cream bar is made with cocoa that comes from Rainforest Alliance Certified farms[newline]Magnum Double Caramel Ice Cream Bars are double-dipped for even more chocolate pleasure[newline]Each pack of Magnum Double Caramel Ice Cream Bars contains 3 bars[newline]Product Number: 20950739_EA,https://assets.shop.loblaws.ca/products/20950739/b1/en/front/20950739_front_a01_@2.png,https://www.loblaws.ca/ice-cream-bar-vanilla-ice-cream-dipped-in-a-chocol/p/20950739_EA
Baby,Feathers Black Changing Pouch,1190,$45.99,,LÄSSIG’s Changing Pouch Feathers Black fits into every handbag and all important diaper changing items are compactly packed together. Various pockets offer space for diapers- wet wipes and the like. A water-resistant changing pad is included.[newline][newline]All important diaper changing necessities are stowed compactly - the perfect accessory for spontaneous parents: LÄSSIG’s Changing Pouch fits into every handbag. So every day you can decide which handbag or backpack you would like to use. The mobile diaper bag for an adventure with your child.[newline][newline]Totally light and easy to handle: LÄSSIG’s Casual Changing Pouch is practical to use with its flexible- color-contrasting closing band and fits in everywhere due to its ideal form.[newline][newline]Functional features allow for a quick and easy diaper change. A compartment for wet wipes with a practical opening slit- various pockets for diapers and the like- a zipped pocket for odds and ends- as well as a tape for fastening a pacifier- make this a practical accessory. A water-repellent- soft padded changing mat that matches the bag- ensure an optimum diaper change for baby.[newline]Product Number: SP101632,https://assets.sellers.loblaw.ca/products/all/1068/101632_3576571313_1.jpg?size=274,https://www.loblaws.ca/feathers-black-changing-pouch/p/SP101632
Baby,Banana- Apple & Carrot,1020,$1.39,,Wait till you see how our squeezable BPA-free pouches give you added convenience and portability. What a great alternative to jars! You can squeeze food directly onto spoons or into bowls. And when baby is ready- they’re ideal for self-feeding. Made with certified organic ingredients with no sugar added and no artificial flavours or colours. Try adding a couple spoonfuls to baby cereal for added taste.[newline]Product Number: 20666167002_EA,https://assets.shop.loblaws.ca/products/20666167002/b1/en/front/20666167002_front_a01_@2.png,https://www.loblaws.ca/banana-apple-carrot/p/20666167002_EA
Baby,Oribel Portaplay House of Fun,1113,$79.99,,Six unique spaces- new stories every day. Let your child’s imagination lead the way. Give your little ones a head-start in home ownership and let their imaginations run free! Explore the bathroom- kitchen- living room- study room- bedroom- and attic! Set-up your house however you want and let the stories flow! It brings out your little one’s inner-storyteller while developing fine motor skills and creativity.[newline][newline]Age Suitability : Play house 12+months[newline]Product Number: SP134559,https://assets.sellers.loblaw.ca/products/all/1068/134559_1800133928_1.jpg?size=274,https://www.loblaws.ca/oribel-portaplay-house-of-fun/p/SP134559
Food,Lime Herbal Kombucha,963,$3.99,,Product Number: 21107515_EA,https://assets.shop.loblaws.ca/products/21107515/b1/en/front/21107515_front_a01_@2.png,https://www.loblaws.ca/lime-herbal-kombucha/p/21107515_EA
Baby,Eczema Care Moisturizing Cream,1191,$11.99,,Aveeno Baby Eczema Care Moisturizing Cream helps soothe baby’s delicate skin and helps reduce itch and irritation caused by eczema. It also helps relieve the dryness and redness caused by eczema. Formulated with leading dermatologists- this patented Triple Oat Formula contains natural colloidal oatmeal- and is clinically shown to moisturize and relieve dry skin. This formula also contains ceramides (essential lipids found within the skin’s surface) that help enhance skin’s ability to retain moisture and restore the skin’s protective function. From the number-one paediatrician recommended baby skin care brand- Aveeno Baby Eczema Care Moisturizing Cream is steroid-free and fragrance-free. This infant eczema cream is also paraben-free and phthalate-free. Suitable for babies- toddlers- kids and also for adults- this cream comes in 166ml tube and 330ml bottle. To use- apply liberally over affected areas as needed- or as directed by a doctor.[newline]Product Number: 20299121_EA,https://assets.shop.loblaws.ca/products/20299121/b1/en/front/20299121_front_a01_@2.png,https://www.loblaws.ca/eczema-care-moisturizing-cream/p/20299121_EA
Baby,Banana & Kiwi,1021,$1.39,,No sugar added. No artificial flavours or artificial colours.[newline]Product Number: 20651248001_EA,https://assets.shop.loblaws.ca/products/20651248001/b1/en/front/20651248001_front_a01_@2.png,https://www.loblaws.ca/banana-kiwi/p/20651248001_EA
Baby,Diaper Rash Cream- Maximum Strength,1114,$8.49,,USES: Protects chafed skin (or minor skin irritation) due to diaper rash and incontinence dermatitis. Temporarily helps relieve minor skin irritation due to diaper rash and incontinence dermatitis. Helps treat diaper rash and incontinence dermatitis.[newline]Product Number: 20060534_EA,https://assets.shop.loblaws.ca/products/20060534/b1/en/front/20060534_front_a01_@2.png,https://www.loblaws.ca/diaper-rash-cream-maximum-strength/p/20060534_EA
Food,Sopressata Salami,964,$6.49,,Natural Choice*. * Pork with natural ingredients - a natural choice for your family.. No added preservatives. Except for those naturally occurring in the ingredients[newline]Product Number: 20313149_EA,https://assets.shop.loblaws.ca/products/20313149/b1/en/front/20313149_front_a01_@2.png,https://www.loblaws.ca/sopressata-salami/p/20313149_EA
Baby,Endanzoo Organic Newborn Coming Home Outfit Set - Safari Hugs,1192,$104.99,,A very important moment for the family when a baby is welcomed to a house where it is called "My home". Dress up your baby with this natural parental hugs prints.[newline]Made with premium 100% GOTS certified organic cotton with peace of mind.[newline]Set Includes:[newline]1 x organic cotton swaddling blanket. 40" x 40"[newline]1 x organic cotton knotted beanie (one size fits most 0-6m)[newline]1 x organic cotton long sleeve bodysuit (Personalized)[newline]1 x organic cotton comfy pant[newline]The long sleeve bodysuit also features foldover mitt (in sizes nb- 0-3- and 3-6m) for protection from self-scratching and additional warmth during those cold days. No more losing mittens or getting them lost in the laundry.[newline]HOW TO ORDER[newline]1. Select the bodysuit size.[newline]2. Add to cart & checkout.[newline]Product Number: SP102432,https://assets.sellers.loblaw.ca/products/all/1105/102427_7849060173_2.jpg?size=274,https://www.loblaws.ca/endanzoo-organic-newborn-coming-home-outfit-set-sa/p/SP102432
Baby,Prunes Strained Baby Food,1022,$1.39,,An ideal choice for parents who believe organic is the best start- this strained baby food is suitable for babies 6 months and older. In a convenient pouch that makes on-the-go feeding a cinch- just skip the bowl and squeeze the food onto a spoon for easy cleanup.[newline]Product Number: 20962515_EA,https://assets.shop.loblaws.ca/products/20962515/b1/en/front/20962515_front_a01_@2.png,https://www.loblaws.ca/prunes-strained-baby-food/p/20962515_EA
Baby,CosyCare Infant Blanket with Maple Moose Teether,1115,$58.00,,Buffalo check Blanket: This baby blanket by CosyCare is handmade in Canada- and made only with 100% premium cotton. With a gorgeous checkered print- this blanket is perfect for your little one to cuddle up in. Extremely versatile- this blanket is the perfect addition to any stroller and bedroom. This natural maple wooden teething ring is an earth friendly and trendy alternative to plastic teething rings! Maple Wood Is a Natural Antiseptic It has 100% Cotton Fabric Moose Antlers shape for your baby or toddler to grip on to while they gnaw on the wooden ring and of course they can gnaw on the Fabric Antlers too![newline]Product Number: SP15810,https://assets.sellers.loblaw.ca/products/all/1017/15810_8417072964_1.jpg?size=274,https://www.loblaws.ca/cosycare-infant-blanket-with-maple-moose-teether/p/SP15810
Food,Sport- Chocolate,965,$2.39,,Rich in nutrients- milk has been a food staple for centuries. Used in cooking- baking or simply as a wholesome beverage- Milk is a great way to get calcium and protein into your diet. Whole milk contains at least 3.25% milk fat. When a portion of the milk’s fat is removed- it becomes partly skimmed milk- such as 2% milk and 1% milk- depending on the quantity removed. Skim milk is virtually fat-free- with only about 0.1% fat.[newline]Product Number: 20723286001_EA,https://assets.shop.loblaws.ca/products/20723286001/b1/en/front/20723286001_front_a01_@2.png,https://www.loblaws.ca/sport-chocolate/p/20723286001_EA
Baby,100% Silicon Bucket Bib Bears Berry Pink,1193,$33.99,,The plastic-free baby bucket-bib is made of pure- silky soft & reusable silicone that keeps your baby’s sensitive skin happy & prevents single-use options from ending up in our oceans & landfills. Reuse over & over knowing that your baby is safe from lead- latex- phthalates- BPAs and other harsh chemicals found in plastic & lower-grade silicone. Roll up the flexible- memory-free bib for on-the-go dining & rescue clothes from endless spills & stains with the non-porous & dishwasher safe material.[newline]Product Number: SP154794,https://assets.sellers.loblaw.ca/products/all/1240/154794_1.jpg?size=274,https://www.loblaws.ca/100-silicon-bucket-bib-bears-berry-pink/p/SP154794
Baby,Apple - Peach- Pumpkin,1023,$1.39,,We've expanded the lineup of our popular baby food in squeezable pouches to give you more options. This includes some with vegetables and grains- like our sumptuous PC Organics Pumpkin- Apple- Peach & Buckwheat Strained Baby Food. Lighter and more portable than jars- they make feeding easier and more convenient- and there's no added sugar- artificial flavours or colours![newline]Product Number: 20666167011_EA,https://assets.shop.loblaws.ca/products/20666167011/b1/en/front/20666167011_front_a01_@2.png,https://www.loblaws.ca/apple-peach-pumpkin/p/20666167011_EA
Baby,Cotton Swabs,1116,$3.99,,IDEAL FOR:. 1. Blending and applying. 2. Applying and softening. 3. Removing smudges. 4. Removing and touching up. 5. Applying cream and ointment to baby's delicate skin. President's Choice Cotton Swabs are made with 100% cotton.[newline]Product Number: 20887369_EA,https://assets.shop.loblaws.ca/products/20887369/b1/en/front/20887369_front_a01_@2.png,https://www.loblaws.ca/cotton-swabs/p/20887369_EA
Food,Lemon Garlic Juice,966,$1.79,,Product Number: 21229645_EA,https://assets.shop.loblaws.ca/products/21229645/b1/en/front/21229645_front_a01_@2.png,https://www.loblaws.ca/lemon-garlic-juice/p/21229645_EA
Baby,B.Box New Sippy Cup Gelato Edition Cherry Blossom,1194,$19.99,,6m+[newline].Weighted straw moves with the liquid- whatever angle the cup is held[newline].Simple flip top lid[newline].Dishwasher safe[newline].Do not microwave[newline].Made from PP and silicone- steel weighted ball[newline].Dimensions (cup with lid) 15 x 12 x 7.5cm[newline].240mls/8oz capacity[newline].BPA- Phthalates and PVC free[newline]Product Number: SP195861,https://assets.sellers.loblaw.ca/products/all/1245/195861_1.jpg?size=274,https://www.loblaws.ca/b-box-new-sippy-cup-gelato-edition-cherry-blossom/p/SP195861
Baby,Pixar Toddler 3pk Training Pants 4T Pack of 6,1117,$139.75,,Keep your little guy motivated with his favorite Toy Story characters. This 3-pack of training pants from Disney provides coverage while helping him transition to big kid underwear! Track his progress and successes with the bonus training chart and stickers.[newline]• Disney Toy Story 3-pack training pants[newline]• Combed cotton construction (100% cotton)[newline]• Woven poly lining (100% polyester)[newline]• Patterns as shown Includes potty training chart and stickers[newline]• Machine wash cold Made in Bangladesh[newline]Product Number: SP148126,https://assets.sellers.loblaw.ca/products/all/1127/148126_1.jpg?size=274,https://www.loblaws.ca/pixar-toddler-3pk-training-pants-4t-pack-of-6/p/SP148126
Baby,Mini Cereal Bars- Banana Berry,1024,$3.99,,This product is suitable for children 12 months and older. This product should only be fed to seated and supervised children who are accustomed to chewing solid food. • Source of iron • Made with whole grain whole wheat flour- whole grain rolled oats and enriched wheat flour • Made with banana purée- raspberry and strawberry juice concentrates • No artificial flavours or artificial colours[newline]Product Number: 20431441001_EA,https://assets.shop.loblaws.ca/products/20431441001/b1/en/front/20431441001_front_a01_@2.png,https://www.loblaws.ca/mini-cereal-bars-banana-berry/p/20431441001_EA
Food,Grade A Large Brown Eggs,967,$5.19,,Eggs range in size (extra-large- large- medium- etc.) and their shells are either white or brown- depending on the breed of the hen. Crack the thin- protective shell against the edge of a bowl (with one hand- if you want to impress your friends) and use the yolk and egg white inside for your favourite breakfast recipes and desserts.[newline]Product Number: 20813936001_EA,https://assets.shop.loblaws.ca/products/20813936001/b1/en/front/20813936001_front_a01_@2.png,https://www.loblaws.ca/grade-a-large-brown-eggs/p/20813936001_EA
Baby,Teddy Bear 10 Piece Baby Crib Bedding set,1195,$159.99,,The BabyFad Teddy Bear 10 piece crib bedding set features teddy bear embroidery and a combination of high quality fabrics. All the pieces in this set are all made from 100% natural cotton. These premium fabrics and modern design bring together a style perfect for a baby boy.[newline]Each 10 Piece Set Includes:[newline]• Crib Quilt (36" x 45"). The quilt features highly detailed embroidery and cute fuzzy monkey characters. The quilt measures 36" x 45" which allows for several years of use before it is outgrown.[newline]• Crib Bumper (10.5" x 158"). The bumper features different embroidered details throughout the full length of the bumper. The bumper fabrics are made from 100% cotton- easy to setup and designed to fit any standard sized crib.[newline]• Crib Skirt (Dust Ruffle). The crib skirt has an 11" drop and is made with coordinating fabrics.[newline]• Fitted Sheet. The fitted sheet is fully elasticized for a snug fit and fits a standard sized 52" x 28" crib mattress. The fitted sheet is made from 100% cotton providing a soft gentle fabric next to baby’s skin.[newline]• 2 Window Valances (38" x 19"). The valances will dress up the nursery window(s) nicely. Also made from 100% cotton- the valances are beautiful and durable.[newline]• Diaper Stacker (21" x 11.5" x 8")[newline]• Toy Bag (23" x 15").[newline]• Decorative Pillow (15" x 10").[newline]• Musical Mobile. Saving the best for last- this set also includes the matching musical mobile. Your baby entertained for hours with this musical mobile that plays Brahms lullaby.[newline]Care instructions: Machine washable- tumble dry low- iron on low setting as required.[newline]Product Number: SP16607,https://assets.sellers.loblaw.ca/products/all/1058/16607_0606437271_1.jpg?size=274,https://www.loblaws.ca/teddy-bear-10-piece-baby-crib-bedding-set/p/SP16607
Baby,Snug & Dry Diapers- Size 2- 180 Count,1118,$32.99,,Huggies Snug & Dry Diapers give baby up to 12 hours of long-lasting protection with our trusted Leak Lock System. Featuring new and improved leakage protection-* Snug & Dry absorbs wetness in seconds and helps separate moisture from baby's sensitive skin.[newline]Huggies trusted Leak Lock System helps prevent leaks for up to 12 hours- day or night[newline]Huggies Snug & Dry absorbs wetness in seconds to help keep baby dry & comfortable[newline]Now with improved leakage protection-* Snug & Dry helps get baby drier faster & stay dry longer (*sizes 3-6)[newline]Snug & Dry baby diapers have a contoured shape for better leakage protection while sleeping- crawling & walking[newline]No Harsh Ingredients – Hypoallergenic and free of fragrances- parabens- elemental chlorine & natural rubber latex[newline]Wetness Indicator – Changes color when wet- easily letting you know when it's time for a diaper change[newline]Featuring fun and exclusive Disney Mickey Mouse designs[newline]Product Number: 21238553_EA,https://assets.shop.loblaws.ca/products/21238553/b1/en/front/21238553_front_a01_@2.png,https://www.loblaws.ca/snug-dry-diapers-size-2-180-count/p/21238553_EA
Baby,PUFFS- Blueberry Vanilla- Baby Snacks,1025,$3.49,,New look- same great taste! GERBER PUFFS- Blueberry Vanilla- Baby Snacks (42 g) are made with your little one in mind. GERBER PUFFS are made with whole grains- rice- and real apple. They dissolve easily- and are a great source of iron and zinc- which help support baby’s normal growth and development. Even more- GERBER PUFFS are perfectly shaped and sized for picking up! Our star-shaped Puffs are a great first finger food snack for baby- and also help develop your baby’s fine oral and motor skills.[newline]Perfect for baby’s first finger food snack — GERBER PUFFS dissolve easily (they are melt-in-your-mouth good) and are nutritious- with no artificial colours or flavours[newline]GERBER PUFFS contain 3 g of whole grains per serving and contain no added salt*[newline]GERBER PUFFS are made with only NON-GMO ingredients**[newline]GERBER PUFFS are an excellent source of zinc and iron- which help support baby’s growth and development[newline]GERBER PUFFS are Kosher[newline]*All cereal-based foods for babies under 12 months should not contain added salt.**Not made with genetically engineered ingredients[newline]Product Number: 20304618008_EA,https://assets.shop.loblaws.ca/products/20304618008/b1/en/front/20304618008_front_a01_@2.png,https://www.loblaws.ca/puffs-blueberry-vanilla-baby-snacks/p/20304618008_EA
Food,Instant Oatmeal- Quick Cook Steel Cut - Brown Sugar Cinnamon,968,$5.49,,Enjoy a heartier breakfast but are short on time? Quaker Quick Cook Brown Sugar Cinnamon Steel Cut Oats Brown are 100% whole grain oats that have been expertly cut to preserve their hearty texture and nutty flavour. Now you can enjoy the robust texture and flavour of steel cut oatmeal- even on the busiest of mornings![newline]Product Number: 21005217_EA,https://assets.shop.loblaws.ca/products/21005217/b1/en/front/21005217_front_a01_@2.png,https://www.loblaws.ca/instant-oatmeal-quick-cook-steel-cut-brown-sugar-c/p/21005217_EA
Baby,Inflatable Bed Rail (+ Foot Pump),1196,$35.99,,Bed Rail + Foot Pump + Carrying Bag. Keep your child safe from rolling off the bed with The Shrunks Inflatable Bed Rail. Its slim design allows the bed rail to slip conveniently under any fitted standard sized twin- queen or king size bed sheet. Recommended for kids 2 years and up.[newline]Product Number: SP15859,https://assets.sellers.loblaw.ca/products/all/1028/15859_1.jpg?size=274,https://www.loblaws.ca/inflatable-bed-rail-foot-pump/p/SP15859
Baby,Overnites Nighttime Baby Diapers- Size 6,1119,$24.99,$29.99,Huggies Overnites are designed to help keep your baby sleeping longer. Our most absorbent diaper features a DryTouch Liner with extra absorbency that locks away moisture for up to 12 hours of overnight protection. With a contoured shape for better leak protection & Double Leak Guards around baby's legs- Huggies Overnites help prevent nighttime diaper leaks & allow your baby to rest comfortably. These disposable overnight diapers also feature Huggies' SnugFit Waistband with Double Grip Strips for a secure fit- perfect for babies starting to roll & toss during sleep. Plus a breathable outer cover helps keep skin dry & comfortable- while Huggies' wetness indicator lets you know if baby needs a diaper change before waking. Huggies Overnites feature adorable Disney Winnie the Pooh designs and are available in size 3 (16-28 lb.)- size 4 (22-37 lb.)- size 5 (27+ lbs.) and size 6 (35+ lbs.). Say goodnight to midnight changes with Huggies Overnites- the #1 Best Selling Night-Time Diaper.* Join the new Huggies Rewards+ Powered by Fetch to get rewarded fast. Earn points on Huggies diapers and wipes- in addition to thousands of other products to redeem for hundreds of gift cards. Download the Fetch Rewards app to get started today! (*Based on nighttime diaper category sales)[newline]Product Number: 21371074_EA,https://assets.shop.loblaws.ca/products/21371074/b1/en/front/21371074_front_a01_@2.png,https://www.loblaws.ca/overnites-nighttime-baby-diapers-size-6/p/21371074_EA
Food,Spring Roll Pastry,969,$1.99,,Product Number: 21022148_EA,https://assets.shop.loblaws.ca/products/21022148/b1/en/front/21022148_front_a01_@2.png,https://www.loblaws.ca/spring-roll-pastry/p/21022148_EA
Baby,Tranquil Turtle - Aqua,1197,$59.99,,Tranquil Turtle will transform a child's room into a peaceful oasis. The light projector creates a serene underwater effect - complete with softly undulating waves - while the sound machine offers two calming choices: a gentle melody or whispering waves. Winner of Infant Toy of the Year Award and the National Parenting Center Seal of Approval- Tranquil Turtle is the perfect solution for kids who are afraid of the dark.[newline]Product Number: SP46891,https://assets.sellers.loblaw.ca/products/all/1124/46891_2481016766_2.jpg?size=274,https://www.loblaws.ca/tranquil-turtle-aqua/p/SP46891
Baby,Portable Changing Pad (Waterproof) Organic Jersey Print 2 Pack,1120,$44.99,,Our best-selling Organic Jersey Portable Changing Pad Liners are mommy faves![newline]Used on top of the changing pad or on any surface that needs protection. Great for on-the-go- this multi-use changing pad liner fits perfectly in the diaper bag. The generous size allows for extra coverage to fully protect your baby- especially in public places where you need it the most.[newline]Our larger than most waterproof changing pad liners measure 20 x 30. This size allows extra coverage to protect your baby while in use- as well as the ability to use it for a variety of other functions.[newline]Our flat changing pad liners are 100% premium quality organic jersey for protection against babys skin with a waterproof bottom and a bias trim for added durability. These liners are a great addition to any diaper bag as they are extremely light- and compact.[newline]Our Portable Changing Pads come in a variety of colours and patterns. We offer 100% Cotton Flannel- Terry- Organic Jersey & Bamboo to fit everyones needs.[newline]Product Number: SP23314,https://assets.sellers.loblaw.ca/products/all/1042/23314_1.jpg?size=274,https://www.loblaws.ca/portable-changing-pad-waterproof-organic-jersey-pr/p/SP23314
Food,Beet Hummus Chickpea Dip And Spread,970,$4.49,,With vibrant ruby colour- this versatile dip and spread is a richly flavoured spin on traditional hummus. Sweet and tender beets are blended with chickpeas- tahini and garlic- then crowned with more beets- chopped and pickled with balsamic vinegar. Partner with vegetable platters and crackers- or spread on pita and naan bread.[newline]Product Number: 20959181_EA,https://assets.shop.loblaws.ca/products/20959181/b1/en/front/20959181_front_a01_@2.png,https://www.loblaws.ca/beet-hummus-chickpea-dip-and-spread/p/20959181_EA
